"Doc/Sen Id","Mention Id","Sentence","Mention","Head","AFET Labels","Turk-General","Turk-Fine","Predict"
"wex/20110513/1/82/558:11",7,"Although the '' presentation style '' mix of movies and elaborate stage shows is no longer in <a>XXXX</a> , it was Balaban 's pioneering success in Chicago with this combination that today is often associated with Radio City Music Hall in New York .","popular or economic favor","favor","[]","['place']","['stage']","['favor']"
"wex/20110513/1/84/309:28",0,"<a>XXXX</a> was inaugurated by Atal Bihari Vajpayee , the former Prime minister of India .","The organisation","organisation","[]","['person']","['president', 'politician']","['organisation']"
"wex/20110513/1/84/407:116",1,"Paper presented at <a>XXXX</a> for Regional Cooperation -LRB- SAARC -RRB- seminar .","the South Asian Association","Association","[]","['event']","['conference', 'meeting']","['association']"
"wex/20110513/1/85/574:1",0,"He won <a>XXXX</a> in the K-4 10000 m event at the 1989 ICF Canoe Sprint World Championships in Plovdiv .","a silver medal","medal","[]","['object']","['award', 'medal', 'trophy']","['medal']"
"wex/20110513/1/88/504:8",0,"Campbell joined the Foreign Office in 1946 - <a>XXXX</a> had been Consul General in Shanghai - and became third secretary in Singapore .","a grandfather , Sir Pelham Warren ,","grandfather","[]","['person']","['general', 'politician']","['grandfather']"
"wex/20110513/1/88/574:11",4,"In September 1940 , with the Luftwaffe threatening the south-east , the Clarks moved their son to a safer location at <a>XXXX</a> .","Cheltenham College Junior School","School","[]","['location']","['state']","['school']"
"wex/20110513/1/89/91:21",2,"In 1983 , <a>XXXX</a> entered the United States national team , as Team America , into the NASL as a franchise .","U.S. Soccer , in coordination with the NASL ,","Soccer","[]","['person']","['player', 'coach']","['soccer']"
"wex/20110513/1/89/781:2",1,"He was educated at <a>XXXX</a> gaining a BA in Mechanical Sciences .","Winchester School and Trinity College , Cambridge ,","School","[]","['institution', 'place']","['college', 'university']","['school']"
"wex/20110513/1/90/810:4",0,"The group has worked with <a>XXXX</a> , premiering pieces by Steve Reich , John Adams , David Lang , Anthony Gatto , Cenk Ergun , Aaron Jay Kernis , Michael Gordon , Augusta Read Thomas , Stefan Freund , and Wolfgang Rihm .","contemporary composers","composers","[]","['person']","['group']","['composer']"
"wex/20110513/1/91/93:2",2,"<a>XXXX</a> is nominated with advice and consent of the Senate by the President of the United States .","The Federal Coordinator -LRB- director of the agency -RRB-","Coordinator","[]","['person']","['leader']","['coordinator']"
"wex/20110513/1/91/241:6",1,"Even though Alastair was born in Yorkshire , he would go over <a>XXXX</a> to Lancashire to watch Burnley Football Club with his father , Donald .","the county border","border","[]","['place']","['state', 'area']","['border']"
"wex/20110513/1/91/294:1",3,"<a>XXXX</a> was born in 1970 in Trinafour , near Perth and educated at Westbourne House School and Glenalmond College in Perthshire .","He","He","[]","['person']","['student']","['he']"
"wex/20110513/1/92/55:66",0,"For two years after this landing , <a>XXXX</a> left every so often from training camps in Malta and Britain and Germany .","small groups of British-trained Albanians","groups","[]","['person']","['soldier']","['group']"
"wex/20110513/1/94/462:0",0,"Albert Jan Kluyver -LRB- June 3 , 1888 , Breda - May 14 , 1956 -RRB- was <a>XXXX</a> .","a Dutch microbiologist and biochemist","microbiologist","[]","['person']","['scientist']","['microbiologist']"
"wex/20110513/1/95/201:24",2,"That same year , he married the novelist Elsa Morante , whom he had met in 1936 ; they lived in <a>XXXX</a> , where he wrote Agostino .","Capri","Capri","['/geography', '/location/city', '/location', '/geography/island']","['location', 'place']","['state', 'country', 'town']","['capri']"
"wex/20110513/1/95/676:11",0,"<a>XXXX</a> also received a few free lessons from the Eugene Ysaye-trained Spanish violinist Alfredo Fernandez .","Sammons","Sammons","[]","['person']","['musician', 'student']","['sammons']"
"wex/20110513/1/95/929:8",3,"On 21 July 1915 , at a meeting of 18 Irish people in Sydney , Dryer proposed the establishment of the Irish National Association of Australasia , to preserve the notion of Irish sovereignty in <a>XXXX</a> .","Australia","Australia","[]","['location']","['country']","['australia']"
"wex/20110513/1/99/195:6",2,"Kessler left the NBA to study <a>XXXX</a> and graduated from the School of Medicine at Emory University in 1999 .","medicine","medicine","[]","['subject']","['medicine']","['medicine']"
"wex/20110513/2/0/799:32",2,"In early September 1936 <a>XXXX</a> was appointed NKVD liaison to the Spanish Republican Ministry of Interior arriving in Madrid on September 16 .","Orlov","Orlov","[]","['person']","['politician']","['orlov']"
"wex/20110513/2/0/910:0",0,"<a>XXXX</a> is a village in the administrative district of Gmina Szudzialowo , within Sokolka County , Podlaskie Voivodeship , in north-eastern Poland , close to the border with Belarus .","Aleksandrowka aleksan ' drufka","drufka","[]","['location', 'place']","['village', 'town']","['drufka']"
"wex/20110513/2/3/665:8",2,"<a>XXXX</a> was the godfather of Charles Spencer , 9th Earl Spencer , brother of Diana , Princess of Wales .","He","He","[]","['person']","['godfather', 'royalty']","['he']"
"wex/20110513/2/4/228:36",2,"Tikhon issued a decree based on <a>XXXX</a> that the clergy in Russia were not to surrender sacred vessels for non-ecclesiastical use .","canon law","law","[]","['object']","['document']","['law']"
"wex/20110513/2/5/202:16",1,"In 1999 Alexander was interviewed following a Russian Orthodox Liturgy in Amsterdam , Holland , in which he described in detail life inside of a Soviet Gulag , specifically Perm 36 , near <a>XXXX</a> .","the Siberian border where he had been jailed","border","[]","['location', 'place']","['area', 'city', 'region']","['border']"
"wex/20110513/2/9/119:74",2,"In February 2011 , McLeish led Birmingham to victory in the League Cup , defeating <a>XXXX</a> Arsenal 2-1 in the final at Wembley in what he described as '' relatively speaking , & nbsp ; ... -LSB- his -RSB- greatest achievement '' .","favourites","favourites","[]","['group']","['team']","['favourite']"
"wex/20110513/2/9/327:1",1,"Prior was born in <a>XXXX</a> to a British father and a Russian mother who descended from Constantin Stanislavski .","London","London","['/transportation', '/location/cemetery', '/language', '/location', '/location/city', '/transportation/road']","['location', 'place']","['city']","['london']"
"wex/20110513/2/9/358:1",0,"Although he was most interested in acid house and early Detroit techno , Reece came to <a>XXXX</a> in the mid 1990s as a jungle star .","prominence","prominence","[]","['object', 'place']","['state', 'recognition', 'fame']","['prominence']"
"wex/20110513/2/9/555:18",1,"On 20 November 2007 , Smithies made his debut for the England U-18 team , where <a>XXXX</a> played 45 minutes in their 2 & ndash ; 0 win against Ghana U-18 's at Gillingham 's Priestfield Stadium .","he","he","[]","['person']","['player', 'athlete']","['he']"
"wex/20110513/2/9/967:4",1,"On 1 March 1174 , <a>XXXX</a> confirmed the metropolitan status of the see of Capua and confirmed its suffragans as Aquino , Caiazzo , Calvi , Carinola , Caserta , Isernia , Sessa , Teano , and Venafro : all the churches of the Campania .","the pope","pope","[]","['person']","['politician']","['pope']"
"wex/20110513/2/11/209:3",4,"After Eton and Haileybury , <a>XXXX</a> joined the Indian Civil Service in 1856 , and served a long career in India , He landed at Calcutta in January 1856 .","he","he","[]","['person']","['officer', 'soldier', 'man']","['he']"
"wex/20110513/2/11/341:98",2,"The Duke was exceedingly fond of <a>XXXX</a> and took a prominent part in establishing the Royal College of Music .","music","music","[]","['object']","['music']","['music']"
"wex/20110513/2/11/810:3",2,"Gross was born in Toronto , Ontario , Canada in 1918 , the son of Romanian immigrants , he grew up in Cleveland , Ohio , in <a>XXXX</a> .","the United States","States","['/person/artist', '/location/cemetery', '/language', '/title', '/location/country', '/location', '/government_agency', '/person']","['location']","['country']","['states']"
"wex/20110513/2/12/106:40",2,"There is no record that the general was ever formally paroled , but he applied for <a>XXXX</a> at Raleigh on June 22 , 1865 , and was pardoned on June 18 , 1866 .","amnesty","amnesty","[]","['object']","['pardon']","['amnesty']"
"wex/20110513/2/12/314:6",1,"<a>XXXX</a> met a young Buenos Aires heiress , Amalia Lacroze , during a 1941 Teatro Colon function , and the two began a relationship .","Fortabat , whose marriage to Magdalena Corti Maderna ended in divorce ,","Fortabat","[]","['person']","['man']","['fortabat']"
"wex/20110513/2/12/594:6",2,"After his war service <a>XXXX</a> settled in the now much smaller Austria and returned to politics by rejoining the renamed Deutsche Nationalsozialistische Arbeiterpartei .","Proksch","Proksch","[]","['person']","['politician']","['proksch']"
"wex/20110513/2/12/793:3",0,"He served as <a>XXXX</a> from 1984 to 1990 , effectively the last Communist mayor of the city .","the Chairman of the Executive Committee of the Riga City Soviet","Chairman","[]","['person']","['mayor']","['chairman']"
"wex/20110513/2/14/862:3",2,"After their malfunctioning ship gets stuck in the Earth 's magnetic pole , they crash-land in <a>XXXX</a> .","a Middle Age kingdom called Houghton Bottoms , ruled by the diminutive King Arthur and his Queen Edith","kingdom","[]","['location', 'place']","['city', 'region', 'country']","['kingdom']"
"wex/20110513/2/15/182:8",1,"In 1901 and 1902 she sang at the Teatro Colon in Buenos Aires and the Solis Theatre in Montevideo , notably portraying Amneris in Giuseppe Verdi 's Aida and as <a>XXXX</a> .","Azucena in Verdi 's Il Trovatore","Azucena","[]","['person']","['singer', 'character']","['azucena']"
"wex/20110513/2/15/814:145",2,"She has cited <a>XXXX</a> as her inspirations , including Prince , Nina Simone , Barbra Streisand , Marvin Gaye , Quincy Jones , Donny Hathaway and Stevie Wonder .","several musicians","musicians","[]","['person']","['artist']","['musician']"
"wex/20110513/2/15/814:178",0,"<a>XXXX</a> participated in the Nobel Peace Prize Concert which took place at the Oslo Spektrum in Oslo , Norway , on December 11 , 2007 , along with other various artists .","She","She","[]","['person']","['musician', 'artist']","['she']"
"wex/20110513/2/17/256:0",0,"Dr. Alireza Mehran -LRB- علیرضا مهران -RRB- was <a>XXXX</a> from 1977 to 1978 .","chancellor of Sharif University of Technology","chancellor","[]","['person', 'event']","['president']","['chancellor']"
"wex/20110513/2/20/992:1",1,"Chilton started his career with <a>XXXX</a> before joining Liverpool as an amateur in the summer of 1938 .","Seaham Colliery","Colliery","[]","['object']","['team']","['colliery']"
"wex/20110513/2/22/151:0",0,"<a>XXXX</a> was a short-lived French automobile manufactured in Paris from 1905 to 1908 .","The Alliance","Alliance","[]","['object']","['company', 'car']","['alliance']"
"wex/20110513/2/23/225:7",3,"Galway , a team who faced no competition in the Connacht Championship , entered the championship at the All-Ireland semi-final stage where they played <a>XXXX</a> .","the Leinster winners","winners","[]","['object']","['team']","['winner']"
"wex/20110513/2/26/247:1",1,"<a>XXXX</a> was recorded live at the Jazz Middelheim Festival -LRB- Antwerp , Belgium -RRB- and at Flagey studio 4 -LRB- a jazz venue in Brussels -RRB- in August 2003 .","It","It","[]","['event', 'object']","['album']","['it']"
"wex/20110513/2/27/492:9",0,"<a>XXXX</a> made an abridged version -LRB- a version with omitted material of the collection where he commented on its claimed authenticity -RRB- .","Al-Dhahabi in his Talkhis al-Mustadrak","Al-Dhahabi","[]","['person']","['writer']","['al-dhahabi']"
"wex/20110513/2/29/67:5",2,"After Manassas broke up in 1973 , Perkins joined fellow Manassas member Chris Hillman in forming the Souther-Hillman-Furay Band ; when <a>XXXX</a> splintered in 1975 , he joined Mason Proffit .","that group","group","[]","['organization']","['music_group', 'band']","['group']"
"wex/20110513/2/32/923:7",1,"He also reformed the existing monasteries of St. Florian , Kremsmunster Abbey , Melk and St. Polten , and had stone churches built at <a>XXXX</a> .","all of them","all","[]","['place']","['structure', 'town']","['all']"
"wex/20110513/2/36/761:1",0,"Born into <a>XXXX</a> and wed into another , she became a naturalised citizen of Britain in 1740 and was granted the life peerage title of '' Countess of Yarmouth '' .","one prominent family in Hanover","family","[]","['organization']","['family']","['family']"
"wex/20110513/2/38/713:6",1,"<a>XXXX</a> was spoken as a first language by 87.56 % , 11.37 % spoke Amharic , and 0.59 % Sebat Bet Gurage ; the remaining 0.48 % spoke all other primary languages reported .","Oromiffa","Oromiffa","['/language']","['concept']","['language']","['oromiffa']"
"wex/20110513/2/39/782:4",0,"Ambivli is accessible by <a>XXXX</a> from Kalyan and also has two alternate routes to Titwala .","road","road","[]","['transportation']","['automobile', 'boat']","['road']"
"wex/20110513/2/41/5:44",1,"In 1916 Ameen married Bertha Case , an American artist , who was part of the Matisse , Picasso , Cezanne and Derain group in Paris , and the Midi , and joined them in exhibiting <a>XXXX</a> at the Salon de Mai .","her work","work","[]","['object']","['art', 'painting', 'exhibition']","['work']"
"wex/20110513/2/41/184:237",1,"<a>XXXX</a> suggested signals originating from several locations , including Gardner Island .","Bearings taken by Pan American Airways stations","Bearings","[]","['person']","['scientist']","['bearings']"
"wex/20110513/2/41/231:5",1,"It revolves around the title character , Amelia , who is expecting her first child and explores her relationship with <a>XXXX</a> .","her father , Dodge , a United States Navy pilot who died in the Vietnam War","father","[]","['person']","['father']","['father']"
"wex/20110513/2/41/237:18",3,"Following the birth of their son Ramses -LRB- ne Walter -RRB- Emerson -LRB- '' as swarthy as an Egyptian and as arrogant as a Pharaoh '' -RRB- , the Emersons initially settle in Kent , from where Emerson commutes to <a>XXXX</a> .","a job lecturing in Egyptology at university in London","job","[]","['location', 'place']","['town', 'city']","['job']"
"wex/20110513/2/41/835:0",0,"American Airlines flies to 82 domestic destinations -LRB- including United States territories -RRB- and 76 international destinations in 46 countries across Asia , Americas and Europe -LRB- including <a>XXXX</a> -RRB- .","British overseas territories and overseas possessions of the Netherlands including Aruba and the former Netherlands Antilles","territories","[]","['location']","['country', 'place']","['territory']"
"wex/20110513/2/43/30:130",0,"At the review aggregate website Rotten Tomatoes , 79 % of 199 reviewers approved of <a>XXXX</a> .","American Gangster","Gangster","[]","['object']","['movie', 'film']","['gangster']"
"wex/20110513/2/43/56:16",0,"The American Gigolo soundtrack album has been re-issued on CD by both PolyGram and Universal Music on <a>XXXX</a> .","the labels Polydor and Spectrum","Polydor","[]","['date', 'object']","['day', 'year']","['polydor']"
"wex/20110513/2/43/334:83",1,"There were three companies at Fort Brooke -LRB- Tampa -RRB- with another two expected momentarily , so it was decided to send two companies to <a>XXXX</a> .","Fort King","King","[]","['location', 'place']","['city']","['king']"
"wex/20110513/2/44/78:3",1,"The APA continues to publish and expand <a>XXXX</a> , and aims to promote all aspects of poultry fancy by certifying official judges , sponsoring shows , fostering youth participation , and advocating for its members , in both the U.S. and Canada .","the Standard","Standard","[]","['organisation']","['business']","['standard']"
"wex/20110513/2/44/427:0",0,"<a>XXXX</a> also called Ameslan , is the dominant sign language of Deaf Americans , including deaf communities in the United States , in the English-speaking parts of Canada , and in some regions of Mexico .","American Sign Language , or ASL , for a time","Language","[]","['object']","['sign_language', 'language']","['language']"
"wex/20110513/2/46/497:7",2,"Aminoshikimate pathway has been assembled in <a>XXXX</a> to synthesize aminoshikimic acid , which is a promising starting material for the synthesis of antiinfluenza agent Tamiflu .","E. coli","coli","[]","['place']","['area']","['coli']"
"wex/20110513/2/49/128:3",1,"Argos was later colonised by its Ambraciot neighbours at <a>XXXX</a> .","the invitation of the Amphilochian Argives","invitation","[]","['place']","['area']","['invitation']"
"wex/20110513/2/50/960:6",0,"In 1999 she received fellowships from the Pollock-Krasner Foundation and the Joan Mitchell Foundation , and in 2000 was awarded <a>XXXX</a> .","a Guggenheim Fellowship","Fellowship","['/award', '/title']","['object']","['money']","['fellowship']"
"wex/20110513/2/50/967:21",2,"Smart was a speaker for the Heal the Bay organization ; <a>XXXX</a> has also worked with the Humane Society and the Environmental Media Association , and was named one of Organic Style magazine 's '' Women with Organic Style '' of 2004 .","she","she","[]","['person']","['woman']","['she']"
"wex/20110513/2/52/25:21",2,"Buprenorphine is thought to be a partial agonist of the opioid receptor , and <a>XXXX</a> is an opiate agonist with SNRI properties .","tramadol","tramadol","['/medicine/medical_treatment', '/medicine/drug', '/medicine']","['object']","['drug']","['tramadol']"
"wex/20110513/2/52/544:14",0,"He moved to the United States in 1917 to serve as <a>XXXX</a> in the Museum of Fine Arts in Boston .","the first Keeper of Indian art","Keeper","[]","['person']","['employee', 'curator']","['keeper']"
"wex/20110513/2/53/67:62",3,"<a>XXXX</a> rejected the anarcho-capitalist Lockean position in favour of the anarchist position of '' occupancy and use '' -LRB- or '' possession '' , to use Proudhon 's term -RRB- , particularly in land .","Many nineteenth-century individualist anarchists , including Benjamin Tucker ,","anarchists","[]","['person']","['politician', 'leader']","['anarchist']"
"wex/20110513/2/53/134:13",0,"With approximately 35,000 , or 0.1 % , of the votes , <a>XXXX</a> outperformed Lyndon LaRouche 's '' BuSo '' and also the German Communist Party DKP .","the APPD","APPD","[]","['person']","['politician', 'candidate']","['appd']"
"wex/20110513/2/53/923:4",0,"In <a>XXXX</a> , he built the fortress of Theodosiopolis along the border with Persarmenia in the mid-430s ; in 440 he directed some works at Heliopolis of Phoenicia and rebuilt the walls of Gerasa in Arabia .","his capacity as magister militum","capacity","[]","['time']","['year']","['capacity']"
"wex/20110513/2/54/29:30",0,"Eventually <a>XXXX</a> was proposed and adopted on 11 June 1991 by the Supreme Soviet of Russia .","a compromise form of a voucher privatization similar to used in Czech Republic","form","[]","['object']","['law']","['form']"
"wex/20110513/2/55/177:276",2,"He wrote that the flowers of certain plants like juniper and myrtle could be soaked in <a>XXXX</a> to help with snakebites and gout .","wine","wine","[]","['object']","['liquid', 'chemical']","['wine']"
"wex/20110513/2/57/664:3",1,"He studied at St Clare 's International School in <a>XXXX</a> and then at Bocconi University in Milan .","Oxford","Oxford","[]","['location', 'place']","['state', 'city', 'student']","['oxford']"
"wex/20110513/2/58/185:18",6,"A regular job emerged writing movie reviews , interviews and a sex and the movies column called Hot & amp ; Bothered for IFC.com ; and , from December through February , she reported on <a>XXXX</a> for The Sundance Daily Insider .","the Sundance Film Festival","Festival","['/event', '/location']","['event', 'object']","['reporter']","['festival']"
"wex/20110513/2/58/583:9",1,"As a student , <a>XXXX</a> was a leading protegee of the medievalist Percy Ernst Schramm , an academic who , as Eberhard Jackel commented , regarded World War II as a normal war that regrettably the Nazis were not as skilled at waging as they should have been .","Hillgruber","Hillgruber","[]","['person']","['student', 'protegee']","['hillgruber']"
"wex/20110513/2/61/513:13",3,"The whereabouts of the relics was not known to the Catholic authorities , and <a>XXXX</a> charged the Papal Relief Mission in Russia , headed by American Jesuit Edmund A. Walsh , with the task of locating and '' rescuing '' them .","Pope Pius XI","XI","[]","['person', 'organization']","['religious']","['xi']"
"wex/20110513/2/61/540:6",0,"<a>XXXX</a> wrote the definitive biography of Lord Trenchard , the father of the Royal Air Force .","He","He","[]","['person']","['writer', 'biographer']","['he']"
"wex/20110513/2/62/417:6",0,"Upon his return to NYC in 1979 , he began playing with various bands and recording in <a>XXXX</a> .","studios in Manhattan","studios","[]","['place']","['studio', 'music']","['studio']"
"wex/20110513/2/63/396:30",2,"He has been a visiting fellow in <a>XXXX</a> at Trinity College , Dublin .","Creative Writing","Writing","[]","['location', 'place']","['city']","['writing']"
"wex/20110513/2/64/742:11",2,"Together with <a>XXXX</a> , the De Graeff brothers strived for the abolition of stadtholdership .","the Republican political leader Grand Pensionary Johan de Witt","Witt","[]","['person']","['leader', 'fighter']","['witt']"
"wex/20110513/2/66/128:5",1,"After developing with local club Orrell St James , <a>XXXX</a> made his first team debut for his home town club Wigan at the age of 16 , The Big Interview : Andy Farrell The Sunday Times -LRB- UK -RRB- in a 1991 Regal Trophy match against Keighley .","he","he","[]","['person']","['athlete']","['he']"
"wex/20110513/2/66/814:7",0,"Between his TV gigs , Rheingold writes feature films and he has sold <a>XXXX</a> to Paramount Pictures , Disney , and Nickelodeon Movies .","scripts","scripts","[]","['object']","['movie', 'script']","['script']"
"wex/20110513/2/70/759:46",0,"<a>XXXX</a> contains the Mrs Lee Choon Guan Concert Hall , Tan Cheng Siong Drama Theatre and the Lee Kong Chian Auditorium which can seat 830 , 270 and 1,200 respectively .","The Arts Centre","Centre","[]","['place']","['complex']","['centre']"
"wex/20110513/2/71/411:8",0,"<a>XXXX</a> was first attributed to Danish philosopher Søren Kierkegaard -LRB- 1813 & ndash ; 1855 -RRB- .","The use of the term","use","[]","['object']","['writing']","['use']"
"wex/20110513/2/72/972:282",1,"<a>XXXX</a> was worshipped in the Natchez temple of the sun and the Aztec deity Quetzalcoatl was a feathered serpent-god .","The rattlesnake","rattlesnake","[]","['person']","['god']","['rattlesnake']"
"wex/20110513/2/73/756:9",0,"She co-wrote <a>XXXX</a> to the band 's 1984 LP , From Her to Eternity , as well as the lyrics of the song '' Stranger Than Kindness '' from Your Funeral , My Trial .","the lyrics of the title track","lyrics","[]","['object']","['song']","['lyrics']"
"wex/20110513/2/74/888:4",0,"At the first Melodifestivalen 2007 semifinal on 3 February in Jonkoping , <a>XXXX</a> 's song '' Samba Sambero '' was the second song announced as a finalist .","Book","Book","[]","['person']","['singer']","['book']"
"wex/20110513/2/75/111:17",3,"In 2007 , she played in Mama 's Boy , with <a>XXXX</a> and in 2007 's Smiley Face , with Adam Brody and John Cho .","Jon Heder , Jeff Daniels and Diane Keaton","Heder","[]","['person']","['actor']","['heder']"
"wex/20110513/2/75/366:3",4,"<a>XXXX</a> was by Jean Anouilh , Julien Duvivier and Guy Morgan , music by Constant Lambert , decors by Andre Andrejew and cinematography by Henri Alekan .","The screenplay","screenplay","[]","['object']","['direction', 'production']","['screenplay']"
"wex/20110513/2/75/826:116",4,"The most virulent criticism came from the Nationalist government , but <a>XXXX</a> were not always so opposed to Wong , as demonstrated when Peking University awarded the actress an honorary doctorate in 1932 .","China 's intellectuals and liberals","intellectuals","[]","['person']","['party']","['intellectual']"
"wex/20110513/2/76/112:15",2,"The British renamed <a>XXXX</a> Annapolis Royal after Queen Anne -LRB- 1665-1714 -RRB- , the reigning monarch .","it","it","[]","['place']","['area', 'town']","['it']"
"wex/20110513/2/76/271:10",4,"From Teynampet , <a>XXXX</a> continues straight southwards to Nandanam and Saidapet before traversing the Maraimalai Adigal Bridge across the Adyar River to Little Mount and finally , Guindy .","it","it","[]","['object']","['road']","['it']"
"wex/20110513/2/77/122:2",0,"She founded the organization in 1987 and continued to act as <a>XXXX</a> until 1996 , at which point the fund was administering USD $ 33 million per year in grants .","president","president","[]","['person', 'position']","['president']","['president']"
"wex/20110513/2/77/366:163",4,"After this , Anne played the Bank of the West Classic in Stanford , California , where <a>XXXX</a> lost in the opening round of the singles to Elena Dementieva .","she","she","[]","['person']","['player']","['she']"
"wex/20110513/2/78/748:1",0,"<a>XXXX</a> played Sue Sullivan -LRB- nee Harper -RRB- in Brookside from 1987 to 1991 , and Maria Simons Starr in Family Affairs from 1997 to 2000 .","She","She","[]","['person']","['actor']","['she']"
