"Sent Index","Mention Index/Total","Sentence","Mention","Mention Head","Label->Gov"
"1481","0/1","Prime Minister David Cameron met with his coalition Cabinet for the first time on Wednesday , as the euphoria over the new partnership between the Conservatives and the Liberal Democrats gave <a>XXXX</a> to a let 's - get-down-to-business approach marked by a determination to attack Britain 's huge budget deficit .","way","way","dobj -> gave"
"1482","0/1","Prime Minister David Cameron met with his coalition Cabinet for the first time on Wednesday , as the euphoria over the new partnership between the Conservatives and the Liberal Democrats gave <a>XXXX</a> to a let 's - get-down-to-business approach marked by a determination to attack Britain 's huge budget deficit .","way","way","dobj -> gave"
"1483","0/1","When <a>XXXX</a> became dean of Harvard Law School in 2003 , she could have taken the endowed chair named for Isaac Royall Jr. .","Elena Kagan","Kagan","nsubj -> became"
"1484","0/1","The Royall family had donated more than 2,100 acres to Harvard in the 1700s , but the family had earned <a>XXXX</a> on the backs of the slave trade .","its fortune","fortune","dobj -> earned"
"1485","0/1","After watching <a>XXXX</a> and millions of dollars being casually spent on Warhols and Rauschenbergs , Picassos , Calders and Johnses at the spring art auctions of the last two weeks , it might seem that the money troubles of the recent past were little more than a bad dream .","millions","millions","dobj -> watching"
"1486","0/1","But a distress sale that took <a>XXXX</a> at Phillips de Pury , the third-place auction house , on Thursday night was a reminder that the ghosts of the recession have not been fully exorcised .","place","place","dobj -> took"
"1487","0/1","<a>XXXX</a> met with his coalition Cabinet for the first time on Thursday , as the euphoria over the new partnership between the Conservatives and the Liberal Democrats gave way to a let 's - get-down-to-business approach marked by a determination to attack Britain 's huge budget deficit .","Prime Minister David Cameron","Cameron","nsubj -> met"
"1488","0/1","<a>XXXX</a> owns a Portuguese real estate company and has two identical apartments in the same building in the heart of Lisbon .","Jose Gago da Graca","Graca","nsubj -> owns"
"1492","0/1","A renegade major general who allied <a>XXXX</a> with the protesters who have paralyzed Bangkok for weeks was shot in the head and critically wounded here Thursday as the military began sealing off a barricaded encampment of anti-government protesters .","himself","himself","dobj -> allied"
"1494","0/1","<a>XXXX</a> said in a television interview broadcast late Thursday that the Chinese government would examine the deeper social problems that may have led to the recent string of deadly attacks on schoolchildren .","Prime Minister Wen Jiabao of China","Jiabao","nsubj -> said"
"1495","0/1","It was the first public comment by a Chinese leader on the violence since the latest attack , in which a landlord in a village hacked to death seven kindergartners , <a>XXXX</a> .","a teacher and the teacher 's elderly mother on Wednesday","teacher","appos -> kindergartners"
"1496","0/1","Prime Minister Wen Jiabao of China said in a television interview broadcast late Thursday that <a>XXXX</a> would examine the deeper social problems that may have led to the recent string of deadly attacks on schoolchildren .","the Chinese government","government","nsubj -> examine"
"1497","0/1","<a>XXXX</a> was the first public comment by a Chinese leader on the violence since the latest attack , in which a landlord in a village hacked to death seven kindergartners , a teacher and the teacher 's elderly mother on Wednesday .","It","It","nsubj -> comment"
"1498","0/1","Thai troops fired on anti-government protesters on Friday , turning <a>XXXX</a> into a battlefield as the military used gunfire and tear gas to try to seal off a broad area where demonstrators have camped for weeks .","parts of downtown Bangkok","parts","dobj -> turning"
"1499","0/1","Thai troops fired on anti-government protesters on Friday , turning parts of downtown Bangkok into a battlefield as the military used gunfire and tear gas to try to seal off a broad area where <a>XXXX</a> have camped for weeks .","demonstrators","demonstrators","nsubj -> camped"
"1500","0/1","<a>XXXX</a> has a black eye , and it 's starting to swell .","Congress","Congress","nsubj -> has"
"1501","0/1","As an institution , its approval ratings bounce near all time lows , creating <a>XXXX</a> .","a crisis in confidence among voters","crisis","dobj -> creating"
"1502","0/1","The New York Times called <a>XXXX</a> `` an important reckoning . ''","it","it","nsubj -> reckoning"
"1503","0/1","`` <a>XXXX</a> lesson , '' an Associated Press book reviewer declared .","A gripping history","history","nsubj -> lesson"
"1504","0/1","A businessman in Georgetown , Texas has started a company that markets <a>XXXX</a> .","a small device that kills the germs on pens","device","dobj -> markets"
"1505","0/1","<a>XXXX</a> is on a tour bus bound for Virginia apologizing for the spotty middle-of-nowhere cell coverage .","Sharon Jones","Jones","nsubj -> bus"
"1506","0/1","It may be a buyer 's market , but that 's no reason for Riviera Beach , <a>XXXX</a> , to give away its waterfront .","Fla.","Fla.","appos -> Beach"
"1507","0/1","The Hawks decided not to offer <a>XXXX</a> a new contract , the team announced Friday .","coach Mike Woodson","Woodson","iobj -> offer"
"1508","0/1","<a>XXXX</a> stared blankly into the far distance and moved in a robotic , shuffling gait as she was led by a neighbor into a free health clinic run by Dr. Bob Paeglow .","She","She","nsubj -> moved"
"1509","0/1","`` It 's alarming , this life after death , '' muses one of the many ghosts that haunt <a>XXXX</a> in Rajiv Joseph 's play `` Bengal Tiger at the Baghdad Zoo . ''","a ravaged city","city","dobj -> haunt"
"1510","0/1","Of course , <a>XXXX</a> was no ticker tape parade for Joseph 's cast of characters , either .","life before death","life","nsubj -> parade"
"1511","0/1","Set in the chaotic first days of the American invasion of Iraq , this boldly imagined , harrowing and surprisingly funny drama considers the long afterlife of violent acts , as well as <a>XXXX</a> .","the impenetrable mysteries of the afterlife itself","mysteries","dobj -> considers"
"1512","0/1","Camping in the rainforest got <a>XXXX</a> at Carnegie Hall .","a new meaning on Thursday night","meaning","dobj -> got"
"1513","0/1","It was the annual benefit for the Rainforest Foundation that features Sting and is produced by his wife , <a>XXXX</a> .","Trudie Styler","Styler","appos -> wife"
"1515","0/1","<a>XXXX</a> was in this year 's lineup -- including Elton John , Lady Gaga and the diva of James Bond movie scores , Dame Shirley Bassey -- and some wry production numbers .","The camp","camp","nsubj -> lineup"
"1516","0/1","There was a time , not so long ago , when if a Broadway diva -- say , <a>XXXX</a> wanted to watch somebody else singing her signature songs in her signature style , she had to leave her dressing room and find a drag show .","Carol Channing or Patti LuPone --","Channing","nsubj -> watch"
"1517","0/1","<a>XXXX</a> 's a soggy Saturday morning , but the moms gather anyway , in baseball caps and fleeces , ready for their final big group training run .","It","It","nsubj -> morning"
"1518","0/1","<a>XXXX</a> withdrew their intent to seek the death penalty against two of three men accused in the slaying of former pro boxing champion Vernon Forrest .","Prosecutors on Friday","Prosecutors","nsubj -> withdrew"
"1519","0/1","A chaotic day of deadly street violence in southern Kyrgyzstan on Friday ended with <a>XXXX</a> retaking control of administration buildings in two southern cities .","the interim government","government","nsubj -> retaking"
"1520","0/1","A chaotic day of deadly street violence in southern Kyrgyzstan on Friday ended with <a>XXXX</a> retaking control of administration buildings in two southern cities .","the interim government","government","nsubj -> retaking"
"1521","0/1","<a>XXXX</a> predicted Friday that a new wave of anti-abortion feminists will win Senate seats in the November elections .","Sarah Palin","Palin","nsubj -> predicted"
"1522","0/1","Controversial full-body scanning devices for airline passengers are being deployed at Houston 's William P. Hobby Airport and six other Texas airports this summer , <a>XXXX</a> announced Friday .","Homeland Security Secretary Janet Napolitano","Napolitano","nsubj -> announced"
"1523","0/1","<a>XXXX</a> sharply scolded corporate executives for `` finger-pointing '' over the Deepwater Horizon oil spill disaster on Friday and promised to end the `` cozy relationship '' between oil companies and the federal regulators that are supposed to police them .","President Barack Obama","Obama","nsubj -> scolded"
"1524","0/1","<a>XXXX</a> is used for one week out of the year .","The Stakes Barn at Pimlico Race Course","Barn","nsubjpass -> used"
"1525","0/1","Hadi al-Mahdi , a man you might call <a>XXXX</a> , bounded up the stairs to a radio studio in a converted villa beside the Tigris River .","the Rush Limbaugh of Iraq","Rush","dobj -> call"
"1526","0/1","`` Today , '' he said , with impish determination , `` we are going to defend <a>XXXX</a> . ''","the Sunnis","Sunnis","dobj -> defend"
"1528","0/1","`` Today , '' he said , with impish determination , `` we are going to defend <a>XXXX</a> . ''","the Sunnis","Sunnis","dobj -> defend"
"1529","0/1","At almost 300 years old , somewhat moldy from the remnants of Hurricane Katrina and surrounded by muddy water and swamps , <a>XXXX</a> is not exactly known for being lemony fresh .","this city","city","nsubjpass -> known"
"1530","0/1","At almost 300 years old , somewhat moldy from the remnants of Hurricane Katrina and surrounded by muddy water and swamps , <a>XXXX</a> is not exactly known for being lemony fresh .","this city","city","nsubjpass -> known"
"1532","0/1","This is a town that prides itself on being among the most diverse and tolerant cities in the country , but two recent cases of alleged police brutality against young black men have stirred anger among civil rights leaders and left some residents wondering <a>XXXX</a> have come .","just how far race relations in their city","relations","nsubj -> come"
"1533","0/1","<a>XXXX</a> said Friday that for more than three years it has inadvertently collected snippets of private information that people send over unencrypted wireless networks .","Google","Google","nsubj -> said"
"1534","0/1","At age 36 , <a>XXXX</a> may be running out of product lives .","Hello Kitty","Kitty","nsubj -> running"
"1535","0/1","The space shuttle Atlantis , carrying a crew of six , a Russian docking module and <a>XXXX</a> , vaulted into orbit Friday on a 12-day space station assembly mission , its 32nd and final planned flight after a quarter-century of service .","critical spare parts","parts","appos -> Atlantis"
"1536","0/1","The space shuttle Atlantis , carrying a crew of six , a Russian docking module and critical spare parts , vaulted into orbit Friday on a 12-day space station assembly mission , its 32nd and <a>XXXX</a> after a quarter-century of service .","final planned flight","flight","appos -> Atlantis"
"1537","0/1","<a>XXXX</a> said Friday that for more than three years it has inadvertently collected snippets of private information that people send over unencrypted wireless networks .","Google","Google","nsubj -> said"
"1538","0/1","Protesters blocked railroad tracks at the site of a western Siberian mine disaster on Friday night , demanding to meet with the management of the Raspadskaya Coal Co. and complaining that low salaries and financial incentives were pressuring <a>XXXX</a> to cut corners on safety .","miners","miners","dobj -> pressuring"
"1539","0/1","Protesters blocked railroad tracks at the site of a western Siberian mine disaster on Friday night , demanding to meet with the management of the Raspadskaya Coal Co. and complaining that low salaries and financial incentives were pressuring miners to cut <a>XXXX</a> on safety .","corners","corners","dobj -> cut"
"1540","0/1","<a>XXXX</a> announced Friday that it had completed a partial recount of ballots from the country 's election two months ago and found no widespread fraud or irregularities .","Iraq 's election commission","commission","nsubj -> announced"
"1541","0/1","Full Internet service was restored to the vast western Chinese region of Xinjiang on Friday , 10 months after it was blocked following deadly ethnic rioting that convulsed <a>XXXX</a> .","the regional capital , Urumqi","capital","dobj -> convulsed"
"1542","0/1","The blockage was the longest and most widespread in China since <a>XXXX</a> became readily available throughout the country in the mid-1990s .","the Internet","Internet","nsubj -> became"
"1543","0/1","Iraq 's election commission announced Friday that <a>XXXX</a> had completed a partial recount of ballots from the country 's election two months ago and found no widespread fraud or irregularities .","it","it","nsubj -> completed"
"1544","0/1","Full Internet service was restored to the vast western Chinese region of Xinjiang on Friday , 10 months after it was blocked following deadly ethnic rioting that convulsed the regional capital , <a>XXXX</a> .","Urumqi","Urumqi","appos -> capital"
"1545","0/1","The blockage was the longest and most widespread in China since <a>XXXX</a> became readily available throughout the country in the mid-1990s .","the Internet","Internet","nsubj -> became"
"1546","0/1","The European Aeronautic Defense and Space Co. , the parent of Airbus , said Friday that <a>XXXX</a> fell 39 percent , hurt by costs associated with its A380 superjumbo jet .","its first-quarter profit","profit","nsubj -> fell"
"1547","0/1","At age 36 , <a>XXXX</a> may be running out of product lives .","Hello Kitty","Kitty","nsubj -> running"
"1548","0/1","In an aggressive move to defend its `` Superman '' franchise , <a>XXXX</a> on Friday filed a lawsuit accusing a lawyer for the comic book hero 's co-creators of trying to seize control of nearly half of the lucrative property .","Warner Brothers","Brothers","appos -> franchise"
"1549","0/1","<a>XXXX</a> said Thursday that the Chinese government would examine the deeper social problems that might have led to the recent string of deadly attacks on schoolchildren .","Prime Minister Wen Jiabao of China","Jiabao","nsubj -> said"
"1550","0/1","Thai troops on Friday fired tear <a>XXXX</a> at protesters , who responded with stones , slingshots and homemade rockets , turning parts of downtown Bangkok into a battlefield as the military tried to tighten its cordon around a broad area where the protesters have camped for weeks .","gas and bullets","gas","dobj -> tear"
"1551","0/1","New York City moved Friday to revoke the cab licenses of 633 taxi drivers who it said routinely charged <a>XXXX</a> .","customers higher out-of-town rates for trips within the five boroughs","rates","dobj -> charged"
"1552","0/1","The city said some of the overcharging was so egregious that it has asked <a>XXXX</a> to investigate .","prosecutors","prosecutors","nsubj -> investigate"
"1553","0/1","Thai troops on Friday fired tear gas and bullets at protesters , who responded with stones , slingshots and homemade rockets , turning <a>XXXX</a> into a battlefield as the military tried to tighten its cordon around a broad area where the protesters have camped for weeks .","parts of downtown Bangkok","parts","dobj -> turning"
"1554","0/1","<a>XXXX</a> moved Friday to revoke the cab licenses of 633 taxi drivers who it said routinely charged customers higher out-of-town rates for trips within the five boroughs .","New York City","City","nsubj -> revoke"
"1555","0/1","<a>XXXX</a> said some of the overcharging was so egregious that it has asked prosecutors to investigate .","The city","city","nsubj -> said"
"1556","0/1","Technically , <a>XXXX</a> have stopped fighting in Iraq .","American soldiers","soldiers","nsubj -> stopped"
"1557","0/1","But <a>XXXX</a> can fire back when attacked , which happens frequently in this village of wheat and barley farmers , as well as an uncomfortable number of Baathist insurgents .","they","they","nsubj -> fire"
"1558","0/1","Technically , <a>XXXX</a> have stopped fighting in Iraq .","American soldiers","soldiers","nsubj -> stopped"
"1559","0/1","But <a>XXXX</a> can fire back when attacked , which happens frequently in this village of wheat and barley farmers , as well as an uncomfortable number of Baathist insurgents .","they","they","nsubj -> fire"
"1560","0/1","The U.S. District Court here hired <a>XXXX</a> on an on-call basis in February .","a Creole translator","translator","dobj -> hired"
"1561","0/1","Four months later she is putting in 10-hour days , working so much that she does not have <a>XXXX</a> .","the time to search for a full-time job","time","dobj -> have"
"1562","0/1","<a>XXXX</a> here hired a Creole translator on an on-call basis in February .","The U.S. District Court","Court","nsubj -> hired"
"1563","0/1","Four months later she is putting in 10-hour days , working so much that <a>XXXX</a> does not have the time to search for a full-time job .","she","she","nsubj -> have"
"1564","0/1","<a>XXXX</a> angrily assailed the finger-pointing among the three companies involved in the oil spill in the Gulf of Mexico as a `` ridiculous spectacle , '' even as his own administration came under criticism for failing to do enough to prevent an environmental calamity .","President Barack Obama on Friday","Obama","nsubj -> assailed"
"1565","0/1","<a>XXXX</a> said Thursday that the Chinese government would examine the deeper social problems that might have led to the recent string of deadly attacks on schoolchildren .","Prime Minister Wen Jiabao of China","Jiabao","nsubj -> said"
"1568","0/1","Retailers have begged Congress for years , in vain , to limit the fees <a>XXXX</a> must pay to banks when customers swipe credit or debit cards .","they","they","nsubj -> pay"
"1569","0/1","The Senate did not even grant <a>XXXX</a> .","the courtesy of a committee hearing","courtesy","dobj -> grant"
"1570","0/1","In a nation ravaged by AIDS , a disease still hidden in shadows of stigma and shame , President Jacob Zuma of South Africa has begun to engage in an extraordinarily open conversation about sex , AIDS and HIV prevention , one ignited in part by his own recent admission that he had <a>XXXX</a> during an extramarital affair .","unprotected sex","sex","dobj -> had"
"1571","0/1","In a nation ravaged by AIDS , <a>XXXX</a> , President Jacob Zuma of South Africa has begun to engage in an extraordinarily open conversation about sex , AIDS and HIV prevention , one ignited in part by his own recent admission that he had unprotected sex during an extramarital affair .","a disease still hidden in shadows of stigma and shame","disease","appos -> AIDS"
"1573","0/1","In galvanizing moments , <a>XXXX</a> can be heard blocks away .","the roar of their simultaneous cheers","roar","nsubjpass -> heard"
"1574","0/1","At 12:10 a.m. Friday , LeBron James answered one final question from the news media horde , stood up , slung his knapsack over his shoulder and left <a>XXXX</a> .","the room","room","dobj -> left"
"1575","0/1","<a>XXXX</a> angrily assailed the finger-pointing among the three companies involved in the oil spill in the Gulf of Mexico as a `` ridiculous spectacle , '' even as his own administration came under criticism for failing to do enough to prevent an environmental calamity .","President Barack Obama on Friday","Obama","nsubj -> assailed"
"1576","0/1","A night raid by American troops in the eastern province of Nangarhar left at least 10 Afghans dead , and within hours , on Friday morning , <a>XXXX</a> turned violent , killing at least one other person , according to accounts from witnesses and Afghan officials .","protests by their relatives and friends","protests","nsubj -> turned"
"1577","0/1","<a>XXXX</a> can not help looking past the Preakness Stakes .","Todd Pletcher","Pletcher","nsubj -> help"
"1578","0/1","He likes Super Saver 's chances in the second leg of the Triple Crown , and the odds and <a>XXXX</a> say he should .","recent history","history","nsubj -> say"
"1579","0/1","Seventy favorites have won here in the 134-year history of the Preakness , including the past two years , when Rachel Alexandra -LRB- 9-5 -RRB- and <a>XXXX</a> romped .","Big Brown -LRB- 1-5 -RRB-","Brown","nsubj -> romped"
"1583","0/1","As President Luiz Inacio Lula da Silva heads to Tehran this weekend to make what many Western diplomats consider a last-ditch attempt at persuading Iran to temper <a>XXXX</a> , officials in Washington have expressed concern that the effort could backfire , helping the Islamic republic to block -- or at least delay -- the United States and its allies from imposing sanctions .","its nuclear ambitions","ambitions","dobj -> temper"
"1585","0/1","When organizers of the Tour of California , the most prestigious professional cycling race in the United States , decided to move <a>XXXX</a> to May from February this year , they took a calculated risk .","their event","event","dobj -> move"
"1586","0/1","President Barack Obama 's legal advisers are considering asking <a>XXXX</a> to allow the government to detain terrorism suspects longer after their arrests before presenting them to a judge for an initial hearing , according to officials familiar with the discussions .","Congress","Congress","dobj -> asking"
"1587","0/1","President Barack Obama 's legal advisers are considering asking Congress to allow <a>XXXX</a> to detain terrorism suspects longer after their arrests before presenting them to a judge for an initial hearing , according to officials familiar with the discussions .","the government","government","nsubj -> detain"
"1588","0/1","On the cusp of summer in 2004 , more than a year into his latest tour as a Christian pop star , <a>XXXX</a> took a break for what was supposed to be a family vacation .","Ray Boltz","Boltz","nsubj -> took"
"1589","0/1","All through the previous months , plying the country with two semi-trailers and a dozen musicians and crew members , playing hits like `` Thank You '' and `` The Anchor Holds , '' Boltz had felt something unbearable , <a>XXXX</a> paralyzing .","something","something","nsubj -> paralyzing"
"1590","0/1","Iraq 's election commission announced Friday that <a>XXXX</a> had completed a partial recount of ballots from the country 's election two months ago and found no widespread fraud or irregularities .","it","it","nsubj -> completed"
"1592","0/1","Prime Minister Wen Jiabao of China said Thursday that <a>XXXX</a> would examine the deeper social problems that might have led to the recent string of deadly attacks on schoolchildren .","the Chinese government","government","nsubj -> examine"
"1593","0/1","<a>XXXX</a> said Thursday that the Chinese government would examine the deeper social problems that might have led to the recent string of deadly attacks on schoolchildren .","Prime Minister Wen Jiabao of China","Jiabao","nsubj -> said"
"1594","0/1","Technically , <a>XXXX</a> have stopped fighting in Iraq .","American soldiers","soldiers","nsubj -> stopped"
"1595","0/1","But <a>XXXX</a> can fire back when attacked , which happens frequently in this village of wheat and barley farmers , as well as an uncomfortable number of Baathist insurgents .","they","they","nsubj -> fire"
"1596","0/1","Technically , <a>XXXX</a> have stopped fighting in Iraq .","American soldiers","soldiers","nsubj -> stopped"
"1597","0/1","But <a>XXXX</a> can fire back when attacked , which happens frequently in this village of wheat and barley farmers , as well as an uncomfortable number of Baathist insurgents .","they","they","nsubj -> fire"
"1598","0/1","<a>XXXX</a> was restored to the vast western Chinese region of Xinjiang on Friday , 10 months after it was blocked following deadly ethnic rioting that convulsed the regional capital , Urumqi .","Full Internet service","service","nsubjpass -> restored"
"1599","0/1","The blockage was the longest and most widespread in China since <a>XXXX</a> became readily available throughout the country a decade ago .","the Internet","Internet","nsubj -> became"
"1600","0/1","Full Internet service was restored to the vast western Chinese region of Xinjiang on Friday , 10 months after it was blocked following deadly ethnic rioting that convulsed the regional capital , <a>XXXX</a> .","Urumqi","Urumqi","appos -> capital"
"1601","0/1","The blockage was the longest and most widespread in China since <a>XXXX</a> became readily available throughout the country a decade ago .","the Internet","Internet","nsubj -> became"
"1602","0/1","For centuries , girls throughout the English-speaking world have fantasized that <a>XXXX</a> were Maid Marian getting rescued from damsel-in-distresshood by that dashing hero Robin Hood .","they","they","nsubj -> Maid"
"1603","0/1","The high-tech mirrors designed for the next space-based telescope are almost as complicated as the five-year , cross-country route <a>XXXX</a> will take before launch in 2014 .","they","they","nsubj -> take"
"1605","0/1","President Barack Obama on Friday angrily assailed the finger-pointing among the three companies involved in the oil spill in the Gulf of Mexico as a `` ridiculous spectacle , '' even as <a>XXXX</a> came under criticism for failing to do enough to prevent an environmental calamity .","his own administration","administration","nsubj -> came"
