"Sent Index","Mention Index/Total","Sentence","Mention","Mention Head","Label->Gov"
"750","0/1","In a victory for the major movie studios , <a>XXXX</a> approved a request to allow companies that sell movies via video-on-demand services to activate signals that would block consumers ' home entertainment systems from copying or otherwise reusing recently released films .","the Federal Communications Commission on Friday","Commission","nsubj -> approved"
"752","0/1","<a>XXXX</a> have found themselves cast as the stingy villains in the financial drama over Greece .","Germans","Germans","nsubj -> found"
"753","0/1","But in the struggling industrial cities in western Germany voting in state elections on Sunday , <a>XXXX</a> see themselves as victims of endless demands inside and outside the country for dwindling resources .","they","they","nsubj -> see"
"754","0/1","Leaders from the euro zone countries signed off on a support package for Greece on Friday night and pledged to take <a>XXXX</a> to stanch a spreading debt crisis before markets opened on Monday morning .","steps","steps","dobj -> take"
"755","0/1","Nepal 's Maoists ended their general strike on Friday , after crippling the nation for six days , but failed to achieve their goal of pressuring <a>XXXX</a> to step down .","the prime minister and his coalition government","minister","nsubj -> step"
"756","0/1","The prospect of political stalemate after the indecisive British election sent the pound lower Friday and heightened fears that credit rating agencies , which have been quick to downgrade <a>XXXX</a> in the euro zone , might do so to Britain .","indebted economies","economies","dobj -> downgrade"
"757","0/1","Germans have found <a>XXXX</a> cast as the stingy villains in the financial drama over Greece .","themselves","themselves","nsubj -> cast"
"758","0/1","But in the struggling industrial cities in western Germany voting in state elections on Sunday , <a>XXXX</a> see themselves as victims of endless demands inside and outside the country for dwindling resources .","they","they","nsubj -> see"
"759","0/1","The prospect of political stalemate after the indecisive British election sent the pound lower Friday and heightened fears that credit rating agencies , which have been quick to downgrade <a>XXXX</a> in the euro zone , might do so to Britain .","indebted economies","economies","dobj -> downgrade"
"760","0/1","A giant steel container meant to capture <a>XXXX</a> was lowered to within 200 feet of the seafloor on Friday afternoon , officials said .","oil leaking into the Gulf of Mexico","oil","dobj -> capture"
"761","0/1","<a>XXXX</a> meant to capture oil leaking into the Gulf of Mexico was lowered to within 200 feet of the seafloor on Friday afternoon , officials said .","A giant steel container","container","nsubj -> capture"
"762","0/1","From the Yankees ' perspective , their decision to skip <a>XXXX</a> came easily .","Andy Pettitte 's next start","start","dobj -> skip"
"763","0/1","When a 37-year-old pitcher complains of elbow tightness 27 games into what they hope is another championship season , they see <a>XXXX</a> .","no reason to take unnecessary risks","reason","dobj -> see"
"764","0/1","<a>XXXX</a> are taking a similarly cautious approach with Jorge Posada , who was held out of the lineup Friday night for a third consecutive game , and with Mariano Rivera , who had not pitched in a week because of a muscle pull in his rib cage but was expected to be available Friday night .","They","They","nsubj -> taking"
"765","0/1","Given the staid nature of the political establishment in Colombia , Washington 's top ally in the region , and the broad popularity of President Alvaro Uribe , <a>XXXX</a> seemed a foregone conclusion to many here that his heir apparent would clinch the presidency in the coming elections without too much of a struggle .","it","it","nsubj -> seemed"
"766","0/1","The British public 's failure to elect <a>XXXX</a> in Thursday 's national election appeared to be a mass expression of exasperation with a discredited government and an uninspiring opposition .","a clear winner","winner","dobj -> elect"
"767","0/1","<a>XXXX</a> also showed the voters ' disillusionment with the increasingly creaky electoral system itself .","It","It","nsubj -> showed"
"768","0/1","Sen. Lindsey Graham , one of the chief sponsors of a Senate plan to address energy and climate change , said Friday that <a>XXXX</a> had no chance of passage in the near term and called for a `` pause '' in consideration of the issue .","the proposal","proposal","nsubj -> had"
"769","0/1",", said that the oil spill in the Gulf of Mexico had heightened concern about expanded offshore drilling , which <a>XXXX</a> considers a central to energy legislation .","he","he","nsubj -> considers"
"770","0/1","Without the support of Graham and at least a handful of Republicans , <a>XXXX</a> is likely dead for the year .","the measure","measure","nsubj -> likely"
"771","0/1","CONTAINMENT EFFORT INCHES CLOSER TO TARGET IN GULF ROBERT , <a>XXXX</a> -- A giant steel container meant to capture oil leaking into the Gulf of Mexico was lowered to within 200 feet of the seafloor on Friday afternoon , officials said .","La.","La.","appos -> ROBERT"
"772","0/1","<a>XXXX</a> was positioned slightly to the side of where it needed to be placed to capture the gushing crude nearly a mile below the gulf 's surface .","It","It","nsubjpass -> positioned"
"773","0/1","Workers operating a crane 5,000 feet above the seafloor were trying to place <a>XXXX</a> to completely cover the leaking pipe with a snug fit to the seabed .","the chamber","chamber","dobj -> place"
"774","0/1","Once <a>XXXX</a> is in place , it is to beU.S .","the container","container","nsubj -> place"
"775","0/1","Grant Xia had the misfortune of trying to take up <a>XXXX</a> as an amateur during the collective madness of the Cultural Revolution .","violin","violin","dobj -> take"
"776","0/1","Chinese officials banned <a>XXXX</a> and sent musicians to re-education camps .","classical music","music","dobj -> banned"
"777","0/1","<a>XXXX</a> was destroyed .","Xia 's family collection of more than 1,000 vinyl records","collection","nsubjpass -> destroyed"
"778","0/1","From the Yankees ' perspective , <a>XXXX</a> came easily .","their decision to skip Andy Pettitte 's next start","decision","nsubj -> came"
"779","0/1","When <a>XXXX</a> complains of elbow tightness 27 games into the season , they see no reason to take unnecessary risks .","a 37-year-old pitcher","pitcher","nsubj -> complains"
"781","0/1","Tiger Woods shot <a>XXXX</a> at the Players Championship on Friday , a one-under 71 to go with his opening 70 , which is better than last week , good enough to make the weekend but a $ 30 cab ride from the leader Lee Westwood 's 36-hole total of 12 under .","his second straight subpar round","round","dobj -> shot"
"782","0/1","Kim Jong-il , the North Korean leader , told officials in Beijing that his government would try to restart talks on ending its nuclear weapons program , Chinese news media reported Friday as <a>XXXX</a> wrapped up a five-day trip to China .","Kim","Kim","nsubj -> wrapped"
"783","0/1","<a>XXXX</a> has been all abuzz about a youth movement again , especially this week after the fuzzy-cheeked duo of Ryo Ishikawa , 18 , of Japan and Rory McIlroy , 21 , of Northern Ireland shot record-low rounds to win on the Japan PGA and PGA Tour last week .","Golf","Golf","nsubj -> abuzz"
"784","0/1","But here on Florida 's First Coast , where <a>XXXX</a> hide is not always a reference to the primordial-looking reptiles in the water hazards at TPC Sawgrass , things are a bit different .","alligator","alligator","nsubj -> hide"
"785","0/1","Golf has been all abuzz about a youth movement again , especially this week after the fuzzy-cheeked duo of Ryo Ishikawa , 18 , of Japan and <a>XXXX</a> shot record-low rounds to win on the Japan PGA and PGA Tour last week .","Rory McIlroy , 21 , of Northern Ireland","McIlroy","nsubj -> shot"
"786","0/1","But here on Florida 's First Coast , where <a>XXXX</a> hide is not always a reference to the primordial-looking reptiles in the water hazards at TPC Sawgrass , things are a bit different .","alligator","alligator","nsubj -> hide"
"787","0/1","On April 1 , <a>XXXX</a> approached the starting goalkeeper , Tyler Fiorito , in the locker room before practice .","the Princeton assistant men 's lacrosse coach Greg Raymond","Raymond","nsubj -> approached"
"788","0/1","Raymond informed Fiorito that <a>XXXX</a> was to partake in a prank on the first-year coach Chris Bates by wearing a brace on his left knee .","he","he","nsubj -> partake"
"789","0/1","<a>XXXX</a> was told to say that he had injured it while riding a skateboard and that he would need an MRI exam to determine whether he could play in the next game against Brown .","He","He","nsubjpass -> told"
"790","0/1","Kim Jong-il , <a>XXXX</a> , told officials in Beijing that his government would try to restart talks on ending its nuclear weapons program , Chinese news media reported Friday as Kim wrapped up a five-day trip to China .","the North Korean leader","leader","appos -> Jong-il"
"793","0/1","The Conservatives warned that <a>XXXX</a> could lead to disaster .","it","it","nsubj -> lead"
"794","0/1","And <a>XXXX</a> could potentially use it to cling to power for a little while longer .","the Labour Party","Party","nsubj -> use"
"795","0/1","Driving through some of this city 's neighborhoods is like driving through an alternate , horrifying universe , a place where no one thinks <a>XXXX</a> 's safe to be a child .","it","it","nsubj -> child"
"796","0/1","Leaving the oceanside cliffs of Malibu for the dusty plains of Waco is rather like leaving <a>XXXX</a> to go wander in the desert .","the Garden of Eden","Garden","dobj -> leaving"
"797","0/1","On hearing of his impending move to Texas , one is tempted to ask <a>XXXX</a> if he accidentally bit the wrong apple .","Kenneth Starr , the former Whitewater prosecutor ,","Starr","dobj -> ask"
"798","0/1","<a>XXXX</a> warned that it could lead to disaster .","The Conservatives","Conservatives","nsubj -> warned"
"799","0/1","And <a>XXXX</a> could potentially use it to cling to power for a little while longer .","the Labour Party","Party","nsubj -> use"
"801","0/1","Thousands of Burmese pythons , the offspring of former pets , have invaded the Everglades , eating birds , bunnies , <a>XXXX</a> .","even alligators","alligators","dobj -> eating"
"802","0/1","It has gotten so bad that <a>XXXX</a> is considering an outright ban on buying or selling nine kinds of giant snakes .","Congress","Congress","nsubj -> considering"
"803","0/1","Torn between helping <a>XXXX</a> and trying not to hurt landlords , the Los Angeles City Council on Friday called for a temporary rent freeze on large rent-controlled apartment buildings .","tenants","tenants","dobj -> helping"
"804","0/1","Devotions to Mom inscribed on the stuffed animals and floral arrangements at Conroy 's Flowers in Canoga Park , <a>XXXX</a> , leave no doubt what special day is approaching -- but manager Keyzar Ali wishes there was more he could do to attract customers to buy the tributes .","Calif.","Calif.","appos -> Park"
"805","0/1","<a>XXXX</a> agreed Friday with former Mayor Richard Riordan that the city needs to reform its pension system , but disputed his contention that bankruptcy should be part of the process .","Los Angeles officials","officials","nsubj -> disputed"
"806","0/1","The Conservatives and Liberal Democrats began intensive talks on Friday to try to fashion an unlikely marriage that would allow them to form a government quickly and reassure <a>XXXX</a> after an election that denied any party a clear majority .","jittery financial markets","markets","dobj -> reassure"
"807","0/1","Nearly 50 miles offshore at the big oil rig floating on a glassy-calm sea , a helicopter landed early on the morning of April 20 , carrying <a>XXXX</a> from BP , the oil company .","four executives","executives","dobj -> carrying"
"808","0/1","The men were visiting <a>XXXX</a> to help honor the crew for its standout safety record .","the Deepwater Horizon","Horizon","nsubj -> help"
"809","0/1","When <a>XXXX</a> stood before an admiring audience at Mile High Stadium here and accepted his presidential nomination 21 months ago , Democratic leaders crowed about turning Colorado into a reliable stronghold , another step toward building the party 's strength in the West .","Barack Obama","Obama","nsubj -> accepted"
"810","0/1","When <a>XXXX</a> stood before an admiring audience at Mile High Stadium here and accepted his presidential nomination 21 months ago , Democratic leaders crowed about turning Colorado into a reliable stronghold .","Barack Obama","Obama","nsubj -> accepted"
"811","0/1","<a>XXXX</a> were heartfelt , especially for women of faith , especially so late in life .","The questions","questions","nsubj -> heartfelt"
"812","0/1","<a>XXXX</a> accepted the resignation of a German bishop under investigation for sexual abuse , the latest high-profile resignation since a sexual abuse crisis erupted in the Roman Catholic Church .","Pope Benedict XVI on Saturday","XVI","nsubj -> accepted"
"813","0/1","<a>XXXX</a> accepted the resignation of a German bishop under investigation for sexual abuse , the latest high-profile resignation since a sexual abuse crisis erupted in the Roman Catholic Church .","Pope Benedict XVI on Saturday","XVI","nsubj -> accepted"
"815","0/1","It has been nearly a quarter-century since a former Alaska poet laureate composed <a>XXXX</a> , adding lines to celebrate the diverse indigenous people of the Last Frontier .","a second verse for the Alaska state song","verse","dobj -> composed"
"816","0/1","In the weeks after the Sept. 11 attacks , <a>XXXX</a> became a go-to Muslim cleric for reporters scrambling to explain Islam .","the eloquent 30-year-old imam of a mosque outside Washington","imam","nsubj -> became"
"817","0/1","<a>XXXX</a> condemned the mass murder , invited television crews to follow him around and patiently explained the rituals of his religion .","He","He","nsubj -> condemned"
"818","0/1","In the weeks after the Sept. 11 attacks , <a>XXXX</a> became a go-to Muslim cleric for reporters scrambling to explain Islam .","the eloquent 30-year-old imam of a mosque outside Washington","imam","nsubj -> became"
"819","0/1","He condemned the mass murder , invited <a>XXXX</a> to follow him around and patiently explained the rituals of his religion .","television crews","crews","dobj -> invited"
"820","0/1","Nearly 3 million overseas and <a>XXXX</a> will be permitted to cast ballots over the Internet in November using e-mail or fax , in part because of new regulations proposed last month by the federal agency that oversees voting .","military voters from at least 33 states","voters","nsubjpass -> permitted"
"821","0/1","Nearly 3 million overseas and <a>XXXX</a> will be permitted to cast ballots over the Internet in November using e-mail or fax , in part because of new regulations proposed last month by the federal agency that oversees voting .","military voters from at least 33 states","voters","nsubjpass -> permitted"
"823","0/1","<a>XXXX</a> crawled out of its mud-splattered cab , sauntered into Peter Rajmenjan 's diner and asked if he had any bush hog for sale .","Gold miners","miners","nsubj -> asked"
"824","0/1","<a>XXXX</a> resumed on Saturday amid concern that continuing uncertainty would roil world financial markets when they reopen Monday , but the prospects of a deal between the Conservatives and Liberal Democrats by that deadline appeared slim .","Talks about forming a new government","Talks","nsubj -> resumed"
"825","0/1","Talks about forming a new government resumed on Saturday amid concern that continuing uncertainty would roil world financial markets when <a>XXXX</a> reopen Monday , but the prospects of a deal between the Conservatives and Liberal Democrats by that deadline appeared slim .","they","they","nsubj -> reopen"
"827","0/1","Shootings of Afghan civilians by American and NATO convoys and at military checkpoints have spiked sharply this year , surpassing aerial bombings and <a>XXXX</a> as the leading cause of war-related deaths and injuries , American officials say .","other attacks","attacks","dobj -> surpassing"
"828","0/1","A special committee organized by the president of Uganda has recommended that a harsh antihomosexuality bill that has drawn <a>XXXX</a> be withdrawn from Parliament , a senior government official said Saturday .","the ire of Western governments","ire","dobj -> drawn"
"829","0/1","The Obama administration has delivered new and stiff warnings to Pakistan after the failed Times Square car bombing that it must urgently move against the nexus of Islamic militancy in the country 's lawless tribal regions , <a>XXXX</a> said .","American and Pakistani officials","officials","nsubj -> said"
"830","0/1","The Obama administration has delivered new and stiff warnings to Pakistan after the failed Times Square car bombing that <a>XXXX</a> must urgently move against the nexus of Islamic militancy in the country 's lawless tribal regions , American and Pakistani officials said .","it","it","nsubj -> move"
"831","0/1","<a>XXXX</a> has 40 seconds to play a shot , sometimes a little longer .","A golfer on the PGA Tour","golfer","nsubj -> has"
"832","0/1","If he takes 72 strokes in a five-hour round , that means his mind has <a>XXXX</a> .","more than four hours to wander between hits","hours","dobj -> has"
"833","0/1","As the eldest daughter among 10 siblings -- and the third-eldest in all -- Mary Kay Henry , <a>XXXX</a> , says she was born to be an organizer .","the incoming president of the Service Employees International Union","president","appos -> Henry"
"834","0/1","As the eldest daughter among 10 siblings -- and the third-eldest in all -- Mary Kay Henry , the incoming president of the Service Employees International Union , says <a>XXXX</a> was born to be an organizer .","she","she","nsubjpass -> born"
"835","0/1","Two years ago , feisty Republicans commandeered the darkened House chamber during the summer recess to loudly demand that <a>XXXX</a> be allowed to `` drill here and drill now . ''","oil companies","companies","nsubj -> drill"
"836","0/1","Two years ago , feisty Republicans commandeered the darkened House chamber during the summer recess to loudly demand that <a>XXXX</a> be allowed to `` drill here and drill now . ''","oil companies","companies","nsubj -> drill"
"837","0/1","<a>XXXX</a> marched two by two onto the field , sticks held with purpose for the final home game of the season .","The Oneonta men 's lacrosse team","team","nsubj -> marched"
"838","0/1","Beneath their helmets , the players flashed hard looks and <a>XXXX</a> smeared with eye black .","cheeks","cheeks","dobj -> flashed"
"839","0/1","In grander times , <a>XXXX</a> would have given his word , and that would have been a virtual guarantee .","David Ortiz","Ortiz","nsubj -> given"
"840","0/1","The young female fan , taking <a>XXXX</a> on the field with the player she endearingly called Papi , had to settle for a declaration of hope .","her photo","photo","dobj -> taking"
"841","0/1","<a>XXXX</a> begins with the death of Crispin Salvador , an expatriate Filipino author living in New York , whose body is found floating in the Hudson River .","The story","story","nsubj -> begins"
"842","0/1","<a>XXXX</a> had been scathingly critical of his home country before his mysterious demise .","He","He","nsubj -> critical"
"843","0/1","<a>XXXX</a> begins with the death of Crispin Salvador , an expatriate Filipino author living in New York , whose body is found floating in the Hudson River .","The story","story","nsubj -> begins"
"844","0/1","<a>XXXX</a> had been scathingly critical of his home country before his mysterious demise .","He","He","nsubj -> critical"
"845","0/1","The kind of bungee jump that stocks took Thursday , plunging abruptly before snapping partway back in a brief frenzy of electronic trading , has worried federal regulators and <a>XXXX</a> for some time .","market operators","operators","dobj -> worried"
"846","0/1","Despite a surprising consensus about what needs to be done , <a>XXXX</a> have not shown much urgency in rewriting the rules governing an increasingly fragmented , and computerized , trading system.That appears likely to change after the wild , record-setting ride that briefly sent the market spinning out of control .","they","they","nsubj -> shown"
"847","0/1","President Barack Obama and lawmakers called for action , and regulators at agencies including the Securities and Exchange Commission promised to deliver , even as they struggled to understand <a>XXXX</a> .","the origins and particulars of Thursday 's chaos","origins","dobj -> understand"
"848","0/1","Defense Secretary Robert Gates challenged <a>XXXX</a> in a speech on Saturday , directing both military and civilian officials to find cuts in their overhead and operating costs and then transfer the savings to the fighting force .","some sacrosanct Pentagon spending practices","practices","dobj -> challenged"
"849","0/1","<a>XXXX</a> challenged some sacrosanct Pentagon spending practices in a speech on Saturday , directing both military and civilian officials to find cuts in their overhead and operating costs and then transfer the savings to the fighting force .","Defense Secretary Robert Gates","Gates","nsubj -> challenged"
"850","0/1","Last month in Germany , a 45-year-old Bavarian man followed the directions of his GPS device onto the wrong end of a highway off-ramp near the city of Osnabruck , in what the newspaper Die Welt called <a>XXXX</a> .","a case of `` blind trust '' in his gadget","case","dobj -> called"
"851","0/1","<a>XXXX</a> raced through Europe , and finally shook the stock market in the United States is now affecting the broader global economy , from the ability of Asian corporations to raise money to the outlook for money-market funds where American savers park their cash .","The fear that began in Athens ,","fear","nsubj -> began"
"852","0/1","There was an awful lot of oohing and aahing and giggling in the screening of `` Babies '' that I attended -- and <a>XXXX</a> was n't just from the females in the audience .","it","it","nsubj -> females"
"853","0/1","That 's probably happening today , too , as <a>XXXX</a> are being treated to a showing on Mother 's Day .","mothers","mothers","nsubjpass -> treated"
"854","0/1","<a>XXXX</a> 's played princesses -- twice , but `` sadly they both died young . ''","She","She","nsubjpass -> played"
"855","0/1","When President Barack Obama decided last year to narrow the scope of the nine-year war in Afghanistan and Pakistan , he and his aides settled on a formulation that sounded simple : Eviscerate al-Qaida , but just `` degrade '' <a>XXXX</a> , reversing that movement 's momentum .","the Taliban","Taliban","dobj -> degrade"
"856","0/1","When President Barack Obama decided last year to narrow the scope of the nine-year war in Afghanistan and Pakistan , he and his aides settled on a formulation that sounded simple : Eviscerate al-Qaida , but just `` degrade '' <a>XXXX</a> , reversing that movement 's momentum .","the Taliban","Taliban","dobj -> degrade"
"858","0/1","Talks about forming <a>XXXX</a> resumed on Saturday amid concern that continuing uncertainty would shake world financial markets when they reopen Monday , but the prospects of a deal between the Conservatives and Liberal Democrats by that deadline appeared slim .","a new government","government","dobj -> forming"
"859","0/1","Sen. Robert F. Bennett , an 18-year veteran Republican who had been seeking <a>XXXX</a> , was stripped of his party 's nomination on Saturday at the state convention here , becoming one of the first congressional victims of the surging discontent from the Tea Party-infused Republican right .","a fourth term","term","dobj -> seeking"
"860","0/1","The latest effort to contain the oil spill that has poured millions of gallons of crude into the Gulf of Mexico has encountered <a>XXXX</a> , officials said Saturday , meaning oil will continue gushing into the ocean for at least several more days , and possibly months .","a setback 5,000 feet underwater","feet","dobj -> encountered"
"861","0/1","The latest effort to contain the oil spill that has poured <a>XXXX</a> into the Gulf of Mexico has encountered a setback 5,000 feet underwater , officials said Saturday , meaning oil will continue gushing into the ocean for at least several more days , and possibly months .","millions of gallons of crude","millions","dobj -> poured"
"862","0/1","When <a>XXXX</a> was going down Saturday , it looked as if Lee Westwood was sinking with it .","the sun","sun","nsubj -> going"
"863","0/1","With his golf ball atop a storm drain in the woods right of the 18th fairway -- a seeming portent of the direction <a>XXXX</a> might be heading -- Westwood came up with the kind of shot that reverses trends and wins big tournaments like the Players Championship .","his luck and lead","luck","nsubj -> heading"
"864","0/1","One streak ended for Phil Mickelson in the third round of the Players Championship on Saturday when <a>XXXX</a> slid 2 feet past the hole .","his 12-foot par putt on No. 18","putt","nsubj -> slid"
"865","0/1","As the eldest daughter among 10 siblings -- and the third-eldest in all -- Mary Kay Henry , the new president of the Service Employees International Union , says <a>XXXX</a> was born to be an organizer .","she","she","nsubj -> organizer"
"866","0/1","In grander times , <a>XXXX</a> would have given his word , and that would have been a virtual guarantee .","David Ortiz","Ortiz","nsubj -> given"
