"Sent Index","Mention Index/Total","Sentence","Mention","Mention Head","Label->Gov"
"2345","0/1","Across Western Europe , the `` lifestyle superpower , '' <a>XXXX</a> are suddenly in doubt .","the assumptions and gains of a lifetime","assumptions","nsubj -> doubt"
"2346","0/1","The deficit crisis that threatens <a>XXXX</a> has also undermined the sustainability of the European standard of social welfare , built by left-leaning governments since the end of World War II .","the euro","euro","dobj -> threatens"
"2347","0/1","Across Western Europe , the `` lifestyle superpower , '' <a>XXXX</a> are suddenly in doubt .","the assumptions and gains of a lifetime","assumptions","nsubj -> doubt"
"2348","0/1","The deficit crisis that threatens the euro has also undermined <a>XXXX</a> , built by left-leaning governments since the end of World War II .","the sustainability of the European standard of social welfare","sustainability","dobj -> undermined"
"2349","0/1","At first glance , <a>XXXX</a> does not look much like garbage .","it","it","nsubj -> look"
"2350","0/1","<a>XXXX</a> have been shrink-wrapped into green bales that are neatly stacked , ready to ship about 2,300 miles across the Pacific to the mainland as an another export -- `` opala , '' as garbage is called in Hawaiian .","More than 20,000 tons of it","tons","nsubj -> shrink-wrapped"
"2351","0/1","At first glance , <a>XXXX</a> does not look much like garbage .","it","it","nsubj -> look"
"2352","0/1","<a>XXXX</a> have been shrink-wrapped into green bales that are neatly stacked , ready to ship about 2,300 miles across the Pacific to the mainland as an another export -- `` opala , '' as garbage is called in Hawaiian .","More than 20,000 tons of it","tons","nsubj -> shrink-wrapped"
"2353","0/1","By all accounts , the United States would have been a no-show at the Shanghai Expo had Secretary of State Hillary Rodham Clinton not opened her Rolodex and raised $ 60 million in private cash to finance <a>XXXX</a> .","a pavilion here","pavilion","dobj -> finance"
"2354","0/1","So in a sense , it seemed fair that <a>XXXX</a> got a rousing cheer from a group of Chinese children when she visited the building on Saturday .","Clinton","Clinton","nsubj -> got"
"2355","0/1","Last Wednesday , Rep. David Scott , <a>XXXX</a> , mingled with insurance and financial executives and other supporters at a lunchtime fundraiser in his honor at a chic Washington wine bar before rushing out to cast a House vote .","D-Ga.","D-Ga.","appos -> Scott"
"2356","0/1","Helena Aguiar had come all the way from Sao Paulo , Brazil , for a front-row seat to see her favorite band , and <a>XXXX</a> got it : a black metal folding chair with a gold and cherry-red Bon Jovi logo on the cushion , hers to take home .","she","she","nsubj -> got"
"2358","0/1","The annual Afghan opium harvest finished this month with production sharply down from last year , Afghan farmers and <a>XXXX</a> say .","American military officers","officers","nsubj -> say"
"2360","0/1","The annual Afghan opium harvest finished this month with production sharply down from last year , <a>XXXX</a> say .","Afghan farmers and American military officers","farmers","nsubj -> say"
"2362","0/1","<a>XXXX</a> denied on Saturday any connection to reported peace talks on a resort island in the Maldives and said the gathering was only an informal one that would not lead to anything substantive .","The Afghan government and representatives of the Taliban","government","nsubj -> said"
"2363","0/1","<a>XXXX</a> denied on Saturday any connection to reported peace talks on a resort island in the Maldives and said the gathering was only an informal one that would not lead to anything substantive .","The Afghan government and representatives of the Taliban","government","nsubj -> said"
"2364","0/1","President Barack Obama established a bipartisan national commission on Friday to investigate what caused the devastating oil spill in the Gulf of Mexico and figure out where the government went wrong so as to `` make sure it never happens again , '' as <a>XXXX</a> put it .","he","he","nsubj -> put"
"2365","0/1","<a>XXXX</a> established a bipartisan national commission on Friday to investigate what caused the devastating oil spill in the Gulf of Mexico and figure out where the government went wrong so as to `` make sure it never happens again , '' as he put it .","President Barack Obama","Obama","nsubj -> established"
"2366","0/1","In some parts of the country , the sight of oil drifting toward the Louisiana coast , oozing into the fragile marshlands and bringing <a>XXXX</a> to a halt , has prompted calls to stop offshore drilling indefinitely , if not altogether .","large parts of the state 's economy","parts","dobj -> bringing"
"2367","0/1","In some parts of the country , the sight of oil drifting toward the Louisiana coast , oozing into the fragile marshlands and bringing <a>XXXX</a> to a halt , has prompted calls to stop offshore drilling indefinitely , if not altogether .","large parts of the state 's economy","parts","dobj -> bringing"
"2368","0/1","As work crews scrubbed this city 's streets clean of debris and arson scars left by protesters after two months of demonstrations on the streets of the capital , the country 's finance minister turned <a>XXXX</a> to another sort of damage control .","his attention","attention","dobj -> turned"
"2369","0/1","When the earth shook violently on Jan. 12 , <a>XXXX</a> clamored to be released , screaming : `` Help !","the inmates in this southern city 's squalid prison","inmates","nsubj -> clamored"
"2371","0/1","President Barack Obama outlined a new national security strategy rooted in diplomatic engagement and international alliances on Saturday as <a>XXXX</a> repudiated his predecessor 's emphasis on unilateral American power and the right to wage pre-emptive war .","he","he","nsubj -> repudiated"
"2372","0/1","As work crews scrubbed <a>XXXX</a> clean of debris and arson scars left by protesters after two months of demonstrations on the streets of the capital , the country 's finance minister turned his attention to another sort of damage control .","this city 's streets","streets","nsubj -> clean"
"2374","0/1","An Air India flight carrying 166 people that crashed moments after landing in southern India on Saturday , killing <a>XXXX</a> on board , has raised questions about India 's oversight of a rapidly growing aviation industry , pilots and safety experts said .","almost everyone","everyone","dobj -> killing"
"2375","0/1","A new American intelligence analysis of a deadly torpedo attack on a South Korean warship concludes that Kim Jong Il , the ailing leader of North Korea , must have authorized <a>XXXX</a> , according to senior American officials who cautioned that the assessment was based on their sense of the political dynamics there rather than hard evidence .","the torpedo assault","assault","dobj -> authorized"
"2377","0/1","<a>XXXX</a> was once barred from Roland Garros stadium after she and her father got into a shouting match with a French tennis coach .","She","She","nsubjpass -> barred"
"2378","0/1","Relations with the French Tennis Federation were once so embittered that she was refused financial aid and was obliged to qualify for the French Open instead of being offered a wild card into the main draw routinely reserved for young French players possessing <a>XXXX</a> .","her kind of talent","kind","dobj -> possessing"
"2379","0/1","<a>XXXX</a> was once barred from Roland Garros stadium after she and her father got into a shouting match with a French tennis coach .","She","She","nsubjpass -> barred"
"2380","0/1","Relations with the French Tennis Federation were once so embittered that <a>XXXX</a> was refused financial aid and was obliged to qualify for the French Open instead of being offered a wild card into the main draw routinely reserved for young French players possessing her kind of talent .","she","she","nsubjpass -> obliged"
"2381","0/1","There 's <a>XXXX</a> , one rarely acknowledged by aid groups or U.N. reports .","an ugly secret of global poverty","secret","nsubj -> 's"
"2382","0/1","<a>XXXX</a> 's a blunt truth that is politically incorrect , heartbreaking , frustrating and ubiquitous :","It","It","nsubj -> truth"
"2383","0/1","When the earth shook violently on Jan. 12 , <a>XXXX</a> clamored to be released , screaming : `` Help !","the inmates in this southern city 's squalid prison","inmates","nsubjpass -> released"
"2384","0/1","Turkey 's main opposition party elected a new leader on Saturday after a sex scandal earlier this month led to the abrupt resignation of his predecessor , who had led <a>XXXX</a> for 18 years .","the party","party","dobj -> led"
"2385","0/1","Turkey 's main opposition party elected <a>XXXX</a> on Saturday after a sex scandal earlier this month led to the abrupt resignation of his predecessor , who had led the party for 18 years .","a new leader","leader","dobj -> elected"
"2386","0/1","What Tony Romo is trying to do is near impossible , like trying to find <a>XXXX</a> on the practice range .","a nonstriped ball","ball","dobj -> find"
"2387","0/1","Saturday night is the time for hockey here , <a>XXXX</a> , and it has been so for generations .","not Saturday afternoon","afternoon","appos -> time"
"2388","0/1","That had <a>XXXX</a> in this city grumbling about the weirdness of a daytime playoff game , especially one as important as Game 4 of the Eastern Conference final .","everyone","everyone","dobj -> had"
"2389","0/1","A chandelier in a second-story window on East 66th Street goes dark , and <a>XXXX</a> steps out of his town house .","the lawyer","lawyer","nsubj -> steps"
"2390","0/1","<a>XXXX</a> walks toward Park Avenue and settles into an unhurried amble for nine blocks , clutching a black briefcase whose color matches his combed-back hair .","He","He","nsubj -> settles"
"2391","0/1","He passes <a>XXXX</a> .","doormen , tourists , dog-walking ladies , joggers","doormen","dobj -> passes"
"2392","0/1","His hunched shoulders and slight limp suggest a laborer joylessly shuffling toward the morning whistle -- except it is 6:30 p.m. and he is wearing <a>XXXX</a> .","French cuffs","cuffs","dobj -> wearing"
"2393","0/1","In the postcards of the mind , <a>XXXX</a> is the starkest of all the images of Kandahar , dating back more than 20 years to the period immediately after Soviet troops withdrew from the city , and standing ever since as a grim warning of the folly of foreign military adventures in Afghanistan : hundreds of acres of rubble , whole quarters of the city reduced to fields of blasted concrete and steel , and further out , in the poorer districts , a shattered chocolate-box of a landscape formed by ragged mud walls that had once been home to tens of thousands of people seeking refuge from the war raging in the Afghan hinterland .","it","it","nsubj -> starkest"
"2394","0/1","Pieces of NASCAR 's past have been scattered for decades in garages , ubiquitous racing halls of fame and team museums serving as unofficial historians for a sport that lacked <a>XXXX</a> .","a home","home","dobj -> lacked"
"2395","0/1","If the French Tennis Federation relocates its tournament to the suburbs of Paris , will <a>XXXX</a> find Mickey Mouse across the net ?","the world 's top tennis players","players","nsubj -> find"
"2396","0/1","If the French Tennis Federation relocates its tournament to the suburbs of Paris , will the world 's top tennis players find <a>XXXX</a> across the net ?","Mickey Mouse","Mouse","dobj -> find"
"2397","0/1","It was night in England on Jan. 12 , just before his bedtime , when <a>XXXX</a> began to get the troubling news that an earthquake had struck Haiti , birthplace of his parents , home to more than two dozen relatives .","Jozy Altidore","Altidore","nsubj -> began"
"2399","0/1","<a>XXXX</a> is burnished , but the shine is off his tournament .","The statue","statue","nsubjpass -> burnished"
"2400","0/1","<a>XXXX</a> may not recognize Jane Lynch in `` Shrek Forever After . ''","You","You","nsubj -> recognize"
"2401","0/1","<a>XXXX</a> assaulted Kandahar Air Base , the main military base in southern Afghanistan , on Saturday night , military officials said , in the second attack on a major base in a week .","Insurgents","Insurgents","nsubj -> assaulted"
"2402","0/1","The sewing machine at the front of Tobey and Kelly Duncan 's outdoor apparel store whirred continuously on Saturday as seamstresses stitched <a>XXXX</a> after the next .","together one new police dress uniform","uniform","dobj -> stitched"
"2403","0/1","As a vice presidential hopeful two years ago , Sarah Palin drew <a>XXXX</a> from the Republican base even before there was a Tea Party movement .","passion and loyalty","passion","dobj -> drew"
"2405","0/1","An Air India flight that crashed after landing in southern India on Saturday killed <a>XXXX</a> and raised questions about India 's oversight of a rapidly growing aviation industry .","158 people","people","dobj -> killed"
"2406","0/1","An unmistakable quarterback controversy has started to percolate at Denver Broncos headquarters , and <a>XXXX</a> may be the only one capable of calming the waters .","incumbent Kyle Orton","Orton","nsubj -> capable"
"2407","0/1","What did Tuesday 's rousing round of elections teach <a>XXXX</a> about the 2010 political landscape ?","us","us","dobj -> teach"
"2408","0/1","<a>XXXX</a> may be the only thing spreading more quickly than oil in the Gulf of Mexico , as lawmakers clamor to grill corporate executives and castigate federal officials who regulate offshore drilling .","Congressional hearings about the Deepwater Horizon disaster","hearings","nsubj -> thing"
"2410","0/1","<a>XXXX</a> have been watching the improvement of Korean automakers with some concern .","Automakers from Japan and Detroit","Automakers","nsubj -> watching"
"2411","0/1","But here 's a bit of cheery news for the worried competition : <a>XXXX</a> is n't perfect .","the new Kia Sorento","Sorento","nsubj -> perfect"
"2412","0/1","For decades , <a>XXXX</a> had one of the cushiest gigs in Hollywood .","movie producers","producers","nsubj -> had"
"2413","0/1","Studios kept stables of them around -- <a>XXXX</a> paid -- to shepherd movies through their various stages : inception , the nitty gritty of filming , post-production and publicity .","all expenses","expenses","nsubj -> paid"
"2414","0/1","The Afghan government and representatives of the Taliban denied on Saturday any connection to reported <a>XXXX</a> and said the gathering would not lead to anything substantive .","peace talks on a Maldives island","talks","dobj -> reported"
"2415","0/1","The Afghan government and representatives of the Taliban denied on Saturday any connection to reported peace talks on a Maldives island and said <a>XXXX</a> would not lead to anything substantive .","the gathering","gathering","nsubj -> lead"
"2416","0/1","With her trademark plain talk and pitch that brings roomfuls of loyalists to their feet , former vice presidential candidate Sarah Palin implored 3,500 people at the University of Denver on Saturday to `` wake up '' because , she said , `` <a>XXXX</a> can see November from my house . ''","I","I","nsubj -> see"
"2417","0/1","John Hickenlooper accepted <a>XXXX</a> Saturday , emphasizing his business experience and outlining a general vision for leading the state through its present and future challenges .","the Democratic Party 's nomination for governor","nomination","dobj -> accepted"
"2418","0/1","Helena Aguiar had come all the way from Sao Paulo , Brazil , for a front-row seat to see her favorite band , and <a>XXXX</a> got it : a black metal folding chair with a gold and cherry-red Bon Jovi logo on the cushion , hers to take home .","she","she","nsubj -> got"
"2420","0/1","Hours after news broke that <a>XXXX</a> was in trouble , Interior Secretary Ken Salazar ordered a team of top aides to the Gulf Coast with instructions to call him hourly with updates from the scene .","the offshore rig Deepwater Horizon","Horizon","nsubj -> trouble"
"2421","0/1","Kerry Haigh had just returned to his Florida home from a trip to Colorado when <a>XXXX</a> told him of a new course that he just had to see -- in suburban Denver .","a telephone caller","caller","nsubj -> told"
"2422","0/1","Although <a>XXXX</a> was far from fortuitous , the director of tournaments for the PGA of America was intrigued enough to make a return trip west a month or so later .","the timing","timing","nsubj -> fortuitous"
"2424","0/1","When they escaped this moribund village in southern Mexico nine years ago , <a>XXXX</a> were newly married , looking for factory jobs on the border with West Texas and determined to forge a future in their country 's frenetic industrial frontier .","they","they","nsubjpass -> married"
"2425","0/1","<a>XXXX</a> hold in their hands a powerful therapy for many diseases .","Scientists","Scientists","nsubj -> hold"
"2427","0/1","On Sunday evening the 63rd Cannes Film Festival came to a shocking , exhilarating close with <a>XXXX</a> going to `` Uncle Boonmee Who Can Recall His Past Lives '' from the Thai filmmaker Apichatpong Weerasethakul .","the Palme d'Or","d'Or","nsubj -> going"
"2429","0/1","The speculation that <a>XXXX</a> might appeal to the jury president , Tim Burton , along with some of his more discerning fellow jury members , proved true .","it","it","nsubj -> appeal"
"2430","0/1","Fully half of the United States is now watching <a>XXXX</a> in high definition , the fastest adoption of TV technology since the VCR hit store shelves in the 1980s .","television","television","dobj -> watching"
"2431","0/1","Fully half of the United States is now watching <a>XXXX</a> in high definition , the fastest adoption of TV technology since the VCR hit store shelves in the 1980s .","television","television","dobj -> watching"
"2432","0/1","The United States began pressing China on Sunday to back <a>XXXX</a> for its sinking of a South Korean warship , but American officials acknowledged that the Chinese were reluctant to discipline their isolated neighbor .","punitive measures against North Korea","measures","dobj -> back"
"2433","0/1","shouted a young man , holding <a>XXXX</a> with an imaginary connection to the prime minister .","an imaginary telephone","telephone","dobj -> holding"
"2434","0/1","`` Thank you for giving us stupid buffaloes <a>XXXX</a> !","this train","train","dobj -> giving"
"2436","0/1","`` Thank you for giving us <a>XXXX</a> this train !","stupid buffaloes","buffaloes","dobj -> giving"
"2437","0/1","Reneging on a prominent campaign promise , Prime Minister Yukio Hatoyama told outraged residents of Okinawa on Sunday that <a>XXXX</a> would be moved only to the north side of the island rather than off the island .","an American air base","base","nsubjpass -> moved"
"2438","0/1","Able-bodied , outgoing and accustomed to working , <a>XXXX</a> wants to earn a paycheck .","Alexandria Wallace","Wallace","nsubj -> wants"
"2439","0/1","But that requires someone to look after her 3-year-old daughter , and Wallace , <a>XXXX</a> , can not afford child care .","a 22-year-old single mother","mother","appos -> Wallace"
"2440","0/1","Able-bodied , outgoing and accustomed to working , Alexandria Wallace wants to earn <a>XXXX</a> .","a paycheck","paycheck","dobj -> earn"
"2441","0/1","But that requires <a>XXXX</a> to look after her 3-year-old daughter , and Wallace , a 22-year-old single mother , can not afford child care .","someone","someone","dobj -> requires"
"2442","0/1","As <a>XXXX</a> embarked on a large-scale civil defense exercise on Sunday , Prime Minister Benjamin Netanyahu sought to reassure Israelis and some jittery Arab neighbors that the nationwide drill was not meant to signal a deterioration in security or an imminent war .","Israel","Israel","nsubj -> embarked"
"2443","0/1","Reneging on a prominent campaign promise , Prime Minister Yukio Hatoyama told <a>XXXX</a> on Sunday that an American air base would be moved only to the north side of the island rather than off the island .","outraged residents of Okinawa","residents","dobj -> told"
"2444","0/1","As Israel embarked on a large-scale civil defense exercise on Sunday , <a>XXXX</a> sought to reassure Israelis and some jittery Arab neighbors that the nationwide drill was not meant to signal a deterioration in security or an imminent war .","Prime Minister Benjamin Netanyahu","Netanyahu","nsubj -> sought"
"2445","0/1","The United States began pressing China on Sunday to back punitive measures against North Korea for its sinking of a South Korean warship , but American officials acknowledged that the Chinese were reluctant to discipline <a>XXXX</a> .","their isolated neighbor","neighbor","dobj -> discipline"
"2446","0/1","The speaker of Iran 's parliament said Sunday that <a>XXXX</a> would abandon a deal to ship some of its nuclear fuel to Turkey and rethink its cooperation with the International Atomic Energy Agency if the United States pushes new sanctions through the United Nations Security Council .","his country","country","nsubj -> rethink"
"2447","0/1","The young Taliban prisoner was led blindfolded to a sweltering military tent , seated among 17 village elders and then , eyes uncovered , faced a chief accuser brandishing <a>XXXX</a> .","a document with the elders ' signatures or thumbprints","document","dobj -> brandishing"
"2448","0/1","<a>XXXX</a> was led blindfolded to a sweltering military tent , seated among 17 village elders and then , eyes uncovered , faced a chief accuser brandishing a document with the elders ' signatures or thumbprints .","The young Taliban prisoner","prisoner","nsubjpass -> led"
"2453","0/1","In the days since <a>XXXX</a> announced a moratorium on permits for drilling new offshore wells and a halt to a controversial type of environmental waiver that was given to the Deepwater Horizon , at least seven new drilling permits and five waivers have been granted , according to records .","President Barack Obama","Obama","nsubj -> announced"
"2454","0/1","In the best of times , Chinese foreign affairs scholars here say , Beijing grits <a>XXXX</a> while playing best friend to Kim Jong Il , North Korea 's ailing and erratic 68-year-old leader .","its teeth","teeth","dobj -> grits"
"2455","0/1","South Korea 's charge last week that North Korea sank one of its warships , killing <a>XXXX</a> , makes that role exponentially harder .","46 crewmen","crewmen","dobj -> killing"
"2456","0/1","The authorities in Rio de Janeiro said Sunday that they had arrested a Polish priest and charged him with sexually abusing <a>XXXX</a> .","a 16-year-old former altar boy","boy","dobj -> abusing"
"2457","0/1","The authorities in Rio de Janeiro said Sunday that <a>XXXX</a> had arrested a Polish priest and charged him with sexually abusing a 16-year-old former altar boy .","they","they","nsubj -> charged"
"2458","0/1","<a>XXXX</a> continued to hammer BP and the federal agencies responding to the Gulf of Mexico oil spill on Sunday , repeatedly threatening to `` take matters into our own hands '' if the response fell short .","Louisiana state and local officials","state","nsubj -> continued"
"2460","0/1","The Jamaican government declared a state of emergency in portions of Kingston , the capital , on Sunday after supporters of a gang leader who is wanted in the United States on gun and drug charges attacked <a>XXXX</a> in an attempt to pressure the government to let him remain free , officials said .","three police stations","stations","dobj -> attacked"
"2462","0/1","In less than three weeks , 32 soccer teams from around the world will square off for the chance to lift <a>XXXX</a> in South Africa .","the World Cup trophy","trophy","dobj -> lift"
"2463","0/1","As <a>XXXX</a> continues to widen , now comes Sun Young Yoo , a 23-year-old from Seoul who arrived here in the middle of last week with a goal of staying two days and departed Sunday evening with $ 375,000 and an ample Tiffany crystal trophy .","the torrent of South Korean golfers","torrent","nsubj -> widen"
"2464","0/1","<a>XXXX</a> went to the polls Sunday to choose a new parliament , with Prime Minister Meles Zenawi 's ruling party expected to sweep the vote and extend its 19-year rule , after a campaign marred by widespread complaints of harassment and intimidation of the opposition .","Ethiopians","Ethiopians","nsubj -> choose"
"2465","0/1","Most of the first-day drama at the French Open lasted <a>XXXX</a> on Sunday morning , then reappeared briefly as the long shadows blanketed Court Philippe Chatrier .","about 15 minutes","minutes","dobj -> lasted"
"2467","0/1","Orlando 's <a>XXXX</a> sat at the postgame podium with his arms in front of him and his voice hoarse as Orlando 's spokesman on all things gone wrong .","Dwight Howard","Howard","nsubj -> sat"
"2468","0/1","Republicans remain confident of making <a>XXXX</a> , but as the midterm campaign begins in earnest , they face a series of challenges that could keep the party from fully capitalizing on an electorate clamoring for change in Washington .","big gains in the fall elections","gains","dobj -> making"
"2469","0/1","When Tim Howard was 6 or 8 , <a>XXXX</a> was already being MapQuested by a coach who perhaps did not know about tactics but did understand proportion .","his career path","path","nsubjpass -> MapQuested"
"2470","0/1","<a>XXXX</a> was being bent like a flagstick in a stiff breeze .","The 16-year-old golfer 's ear","ear","nsubjpass -> bent"
"2471","0/1","He had achieved so much so quickly that <a>XXXX</a> were urging him to turn professional .","many people","people","nsubj -> urging"
