"Sent Index","Mention Index/Total","Sentence","Mention","Mention Head","Head POS","Label->Gov"
"1508","0/1","Three years ago , Eric Levin , <a>XXXX</a> , convened with a handful of other independent record store owners in Baltimore .","owner of the Atlanta music store Criminal Records","owner","NN","appos -> Levin"
"1509","0/1","Three years ago , Eric Levin <a>XXXX</a> the Atlanta music store Criminal Records , convened with a handful of other independent record store owners in Baltimore .",", owner of","question","NN","dobj -> answer"
"1510","0/1","<a>XXXX</a> are a great place for sinners to hide .","Churches","Churches","NNS","nsubj -> place"
"1511","0/1","While <a>XXXX</a> was a clear end for this year 's teacher bill , it made his own political future increasingly cloudy .","Florida Gov. Charlie Crist 's veto on Thursday","veto","NN","nsubj -> end"
"1512","0/1","Few have gone through more for a glass of <a>XXXX</a>","wine .","Christian","NNP","appos -> afternoon"
"1513","0/1","Life , when <a>XXXX</a> 're lucky , imitates comedy .","we","we","PRP","nsubj -> lucky"
"1514","0/1","The complicated struggle for control of the Southern Christian Leadership Conference continued Friday with court filings and accusations that that <a>XXXX</a> were willing to sacrifice the civil rights group to seize power .","some SCLC leaders","leaders","NNS","nsubj -> sacrifice"
"1515","0/1","The Texas capital city became one of the national hubs of anti-federal government sentiment Thursday as <a>XXXX</a> rallied Tea Party Activists unveiling their new `` Contract From America . ''","former U.S. House Speaker Newt Gingrich","Gingrich","NNP","nsubj -> rallied"
"1516","0/1","Banks operating in the European Union will have to accept stricter external supervision and be required to set aside more money to prevent <a>XXXX</a> under a regulatory proposal to be presented by the European Commission in June .","another crisis","crisis","NN","dobj -> prevent"
"1517","0/1","A few months ago Robert Whiteman dashed off an e-mail message to Warren Buffett reminding that investor that <a>XXXX</a> reportedly earned his first nickel selling Liberty Magazine in the 1930s .","he","he","PRP","nsubj -> earned"
"1518","0/1","A few <a>XXXX</a> ago Robert Whiteman dashed off an e-mail message to Warren Buffett reminding that investor that he reportedly earned his first nickel selling Liberty Magazine in the 1930s .","months","Buffett","NNP","dobj -> told"
"1519","0/1","Lawmakers from Southwest border states on Friday pleaded with colleagues on a Senate appropriations panel to restore $ 31 million to a program that reimburses local governments for prosecuting <a>XXXX</a> .","drug smuggling cases","cases","NNS","dobj -> prosecuting"
"1520","0/1","Thirty-five years after the start of Lebanon 's long civil war , <a>XXXX</a> remains in a state of collective amnesia about its past .","this divided country","country","NN","nsubj -> remains"
"1521","0/1","Thirty-five years after the start of Lebanon 's long civil war , <a>XXXX</a> country remains in a state of collective amnesia about its past .","this divided","role","NN","dobj -> for"
"1522","0/1","In a new humiliation for the Thai government , several leaders of the Red Shirt protest movement escaped from a hotel on Friday after it had been surrounded by security forces -- even as a deputy prime minister was announcing <a>XXXX</a> live on television .","the raid","raid","NN","nsubj -> live"
"1523","0/1","In a new humiliation for the Thai government , several leaders of the Red Shirt protest movement escaped from a hotel on Friday after <a>XXXX</a> had been surrounded by security forces -- even as a deputy prime minister was announcing the raid live on television .","it","it","PRP","nsubjpass -> surrounded"
"1524","0/1","Thirty-five years after the start of Lebanon 's long civil war , <a>XXXX</a> remains in a state of collective amnesia about its past .","this divided country","country","NN","nsubj -> remains"
"1525","0/1","Thirty-five years after the start of Lebanon 's long civil war , <a>XXXX</a> country remains in a state of collective amnesia about its past .","this divided","role","NN","dobj -> for"
"1526","0/1","<a>XXXX</a> are on the brink of regaining control of Miramax Films , a move that would mark a triumphant and unexpected return by the pair to the independent film spotlight .","Harvey and Bob Weinstein","Harvey","NNP","nsubj -> brink"
"1527","0/1","Harvey and <a>XXXX</a> are on the brink of regaining control of Miramax Films , a move that would mark a triumphant and unexpected return by the pair to the independent film spotlight .","Bob Weinstein","Weinstein","NNP","nsubj -> brink"
"1528","0/1","<a>XXXX</a> had a plan .","The indigenous leaders","leaders","NNS","nsubj -> had"
"1530","0/1","The indigenous leaders had <a>XXXX</a> .","a plan","plan","NN","dobj -> had"
"1531","0/1","The indigenous leaders had a plan .","","lands","NNS","dobj -> threatening"
"1532","0/1","<a>XXXX</a> traveled 1,200 miles back to Canada in what was likely a record journey that ended in death on Jan. 28 .","A Canadian lynx released in Colorado in 2003","lynx","NN","nsubj -> traveled"
"1533","0/1","As he sits in his palatial home 's reception hall , Sheik Munaf Ali al-Nidah denounces <a>XXXX</a> and shakes his head over the vilification of the Baath Party .","the governments of both Iraq and the United States","governments","NNS","dobj -> denounces"
"1534","0/1","As he sits in his palatial home 's reception <a>XXXX</a> Sheik Munaf Ali al-Nidah denounces the governments of both Iraq and the United States and shakes his head over the vilification of the Baath Party .","hall ,","Hussein","NNP","dobj -> smiling"
"1535","0/1","<a>XXXX</a> his palatial home 's reception hall , Sheik Munaf Ali al-Nidah denounces the governments of both Iraq and the United States and shakes his head over the vilification of the Baath Party .","As he sits in","watch","NN","nsubjpass -> wrapped"
"1536","0/1","As he sits in his palatial home 's reception hall , <a>XXXX</a> denounces the governments of both Iraq and the United States and shakes his head over the vilification of the Baath Party .","Sheik Munaf Ali al-Nidah","al-Nidah","NNP","nsubj -> shakes"
"1537","0/1","As he sits in his palatial home 's reception <a>XXXX</a> Sheik Munaf Ali al-Nidah denounces the governments of both Iraq and the United States and shakes his head over the vilification of the Baath Party .","hall ,","Hussein","NNP","dobj -> smiling"
"1538","0/1","<a>XXXX</a> his palatial home 's reception hall , Sheik Munaf Ali al-Nidah denounces the governments of both Iraq and the United States and shakes his head over the vilification of the Baath Party .","As he sits in","watch","NN","nsubjpass -> wrapped"
"1539","0/1","Two dozen fourth-graders from the Chapin School , all in regulation green vests that were dotted with badges , popped up from their chairs to recite <a>XXXX</a> : `` On my honor ... ''","the Pledge of Allegiance and the Girl Scout promise","Pledge","NN","dobj -> recite"
"1540","0/1","Two dozen fourth-graders from the Chapin School , all in regulation green vests that were dotted with badges , popped up from their chairs to recite <a>XXXX</a> : `` On my honor ... ''","the Pledge of Allegiance and the Girl Scout promise","Pledge","NN","dobj -> recite"
"1542","0/1","<a>XXXX</a> spent Friday in the Tibetan high country , comforting survivors of this week 's devastating earthquake in a prominent display of concern by the country 's Han leadership for one of China 's most troubled ethnic minorities .","Prime Minister Wen Jiabao","Jiabao","NNP","nsubj -> spent"
"1543","0/1","President Barack Obama on Friday threatened to veto the financial overhaul bill making its way through Congress if <a>XXXX</a> failed to include strong restrictions on derivatives , which were at the heart of the financial crisis two years ago .","it","it","PRP","nsubj -> failed"
"1544","0/1","President Barack Obama on Friday threatened to veto <a>XXXX</a> if it failed to include strong restrictions on derivatives , which were at the heart of the financial crisis two years ago .","the financial overhaul bill making its way through Congress","bill","NN","dobj -> veto"
"1545","0/1","<a>XXXX</a> was sending a text message on her cell phone the other day when the phone rang .","Nashira Muniz","Muniz","NNP","nsubj -> sending"
"1546","0/1","Nashira Muniz was sending <a>XXXX</a> text message on her cell phone the other day when the phone rang .","a","you","PRP","dobj -> texted"
"1547","0/1","<a>XXXX</a> Muniz was sending a text message on her cell phone the other day when the phone rang .","Nashira","she","PRP","nsubj -> said"
"1548","0/1","Nashira Muniz was sending a text message on her cell phone the other day when <a>XXXX</a> rang .","the phone","subway","NN","dobj -> riding"
"1549","0/1","For the past few days , <a>XXXX</a> have concerned themselves with a question perhaps better put to Talmudic scholars : Is it ever right for protesters to keep a grandfather from his grandson 's bar mitzvah ?","many South African Jews","Jews","NNS","nsubj -> concerned"
"1551","0/1","For the past few days , <a>XXXX</a> have concerned themselves with a question perhaps better put to Talmudic scholars : Is it ever right for protesters to keep a grandfather from his grandson 's bar mitzvah ?","many South African Jews","Jews","NNS","nsubj -> concerned"
"1552","0/1","For years , Mark Schumacher has guided <a>XXXX</a> up and down the Taylor , a swift moving river that cuts through the canyons and cliffs here .","white-water rafts","rafts","NNS","dobj -> guided"
"1553","0/1","<a>XXXX</a> were the human faces of the nation 's wrenching , yearlong health care debate .","They","They","PRP","nsubj -> faces"
"1554","0/1","On the first day , there was <a>XXXX</a> .","light","light","NN","nsubj -> was"
"1556","0/1","The menacing cloud of ash from a volcano in Iceland moved eastward across Northern Europe on Friday , expanding an already massive transportation gridlock and throwing <a>XXXX</a> into an anxious limbo .","weary travelers","travelers","NNS","dobj -> throwing"
"1557","0/1","<a>XXXX</a> moved eastward across Northern Europe on Friday , expanding an already massive transportation gridlock and throwing weary travelers into an anxious limbo .","The menacing cloud of ash from a volcano in Iceland","cloud","NN","nsubj -> moved"
"1561","0/1","As <a>XXXX</a> consider Supreme Court nominees , White House officials and political activists are focusing on the vulnerabilities conservatives could exploit to portray them as liberal judicial activists , according to interviews and a review of documents .","President Barack Obama 's advisers","advisers","NNS","nsubj -> consider"
"1562","0/1","As President Barack Obama 's advisers consider Supreme Court nominees , White House officials and political activists are focusing on the vulnerabilities conservatives could exploit to portray <a>XXXX</a> as liberal judicial activists , according to interviews and a review of documents .","them","them","PRP","dobj -> portray"
"1563","0/1","President Barack Obama issued a memo to develop `` a 21st century strategy for America 's great outdoors '' at a national conservation conference Friday that kicked off <a>XXXX</a> across the country aimed at gathering grassroots input and new ideas .","meetings","meetings","NNS","dobj -> kicked"
"1564","0/1","Few people in the working-class community of Barking seem willing to proclaim <a>XXXX</a> .","unalloyed enthusiasm for the ultra-right-wing , anti-immigration British Nationalist Party","enthusiasm","NN","dobj -> proclaim"
"1565","0/1","Few people in the working-class community of Barking seem willing to proclaim unalloyed <a>XXXX</a> for the ultra-right-wing , anti-immigration British Nationalist Party .","enthusiasm","spilling","NN","dobj -> come"
"1566","0/1","<a>XXXX</a> seem willing to proclaim unalloyed enthusiasm for the ultra-right-wing , anti-immigration British Nationalist Party .","Few people in the working-class neighborhood of Barking","people","NNS","nsubj -> seem"
"1567","0/1","Few people in the working-class neighborhood of Barking seem willing to proclaim unalloyed <a>XXXX</a> for the ultra-right-wing , anti-immigration British Nationalist Party .","enthusiasm","spilling","NN","dobj -> come"
"1568","0/1","Frans van Riemsdyk did not see his son , James , score his first NHL goal live , so there was no way he was going to miss <a>XXXX</a> Wednesday .","James ' first Stanley Cup playoff game","game","NN","dobj -> miss"
"1569","0/1","Frans van Riemsdyk did not see his son <a>XXXX</a> score his first NHL goal live , so there was no way he was going to miss James ' first Stanley Cup playoff game Wednesday .",", James ,","flight","NN","dobj -> caught"
"1570","0/1","<a>XXXX</a> are excited about their prospects for the new campaign .","The Jets","Jets","NNS","nsubjpass -> excited"
"1571","0/1","The Jets <a>XXXX</a> prospects for the new campaign .","are excited about their","game","NN","dobj -> reached"
"1572","0/1","<a>XXXX</a> Jets are excited about their prospects for the new campaign .","The","They","PRP","nsubj -> made"
"1573","0/1","In a new humiliation for the Thai government , several leaders of the Red Shirt protest movement escaped from a hotel on Friday after it had been surrounded by security forces -- even as a deputy prime minister was announcing <a>XXXX</a> live on television .","the raid","raid","NN","nsubj -> live"
"1574","0/1","In a new humiliation for the Thai government , several leaders of the Red Shirt protest movement escaped from a hotel on Friday after it had been surrounded by security forces -- even as <a>XXXX</a> was announcing the raid live on television .","a deputy prime minister","minister","NN","nsubj -> announcing"
"1576","0/1","<a>XXXX</a> was so candid , so remarkably revealing with his evaluation of players and possible strategies during his draft preview news conference Friday , he all but invited the media back to the Broncos ' war room .","Broncos Josh McDaniels","McDaniels","NNP","nsubj -> candid"
"1577","0/1","A top executive for a higher-education system in Virginia was tapped Friday to head <a>XXXX</a> .","the nine-campus Los Angeles Community College District","District","NNP","dobj -> head"
"1578","0/1","A top executive for a higher-education system in Virginia was tapped Friday to head <a>XXXX</a> .","the nine-campus Los Angeles Community College District","District","NNP","dobj -> head"
"1579","0/1","In a new humiliation for the Thai government , <a>XXXX</a> escaped from a hotel on Friday after it had been surrounded by security forces -- even as a deputy prime minister was announcing the raid live on television .","several leaders of the Red Shirt protest movement","leaders","NNS","nsubj -> escaped"
"1581","0/1","Last Friday evening , Josh Selby , <a>XXXX</a> most explosive high school basketball guard yet to commit to a college , walked out the back door of Lake Clifton High School here with the Tennessee assistant Steve Forbes .","the nation 's","Mercedes-Benz","NNP","dobj -> approached"
"1582","0/1","Last Friday evening , Josh Selby , the nation 's most <a>XXXX</a> high school basketball guard yet to commit to a college , walked out the back door of Lake Clifton High School here with the Tennessee assistant Steve Forbes .","explosive","sneakers","NNS","dobj -> threw"
"1583","0/1","Last Friday <a>XXXX</a> the nation 's most explosive high school basketball guard yet to commit to a college , walked out the back door of Lake Clifton High School here with the Tennessee assistant Steve Forbes .","evening , Josh Selby ,","goodbye","NN","dobj -> said"
"1584","0/1","Last Friday evening , Josh Selby , the nation 's most <a>XXXX</a> basketball guard yet to commit to a college , walked out the back door of Lake Clifton High School here with the Tennessee assistant Steve Forbes .","explosive high school","decision","NN","dobj -> making"
"1585","0/1","The menacing cloud of ash from a volcano in Iceland moved eastward across Northern Europe on Friday , expanding <a>XXXX</a> and throwing weary travelers into an anxious limbo .","an already massive transportation gridlock","gridlock","NN","dobj -> expanding"
"1587","0/1","The hardscrabble field where George Herman Ruth Jr. learned <a>XXXX</a> from a Xaverian brother is now a lovingly landscaped diamond .","baseball","baseball","NN","dobj -> learned"
"1588","0/1","The hardscrabble field where George Herman Ruth <a>XXXX</a> learned baseball from a Xaverian brother is now a lovingly landscaped diamond .","Jr.","he","PRP","nsubj -> looked"
"1590","0/1","The hardscrabble field where George Herman Ruth <a>XXXX</a> learned baseball from a Xaverian brother is now a lovingly landscaped diamond .","Jr.","he","PRP","nsubj -> looked"
"1591","0/1","<a>XXXX</a> went prospecting recently in the remote Philippine highlands here known as the Cordillera .","Goad Sibayan","Sibayan","NNP","nsubj -> went"
"1592","0/1","<a>XXXX</a> Sibayan went prospecting recently in the remote Philippine highlands here known as the Cordillera .","Goad","He","PRP","nsubj -> clambered"
"1593","0/1","<a>XXXX</a> went prospecting recently in the remote Philippine highlands here known as the Cordillera .","Goad Sibayan","Sibayan","NNP","nsubj -> went"
"1594","0/1","<a>XXXX</a> Sibayan went prospecting recently in the remote Philippine highlands here known as the Cordillera .","Goad","He","PRP","nsubj -> clambered"
"1595","0/1","On the first day of April , <a>XXXX</a> was sitting down to a barbecue luncheon when he was summoned to a meeting at the state Department of Public Safety .","Zeb Little","Little","NNP","nsubj -> sitting"
"1596","0/1","On the first day of April , <a>XXXX</a> luncheon when he was summoned to a meeting at the state Department of Public Safety .","Zeb Little was sitting down to a barbecue","leader","NN","nsubj -> waited"
"1597","0/1","On the first day of April , <a>XXXX</a> was sitting down to a barbecue luncheon when he was summoned to a meeting at the state Department of Public Safety .","Zeb Little","Little","NNP","nsubj -> sitting"
"1598","0/1","On the first day of April , <a>XXXX</a> luncheon when he was summoned to a meeting at the state Department of Public Safety .","Zeb Little was sitting down to a barbecue","leader","NN","nsubj -> waited"
"1601","0/1","On a recent afternoon , Neal Wolin entered <a>XXXX</a> , across Lafayette Park from his office at the Treasury Department here , and stood before scores of corporate chieftains , financiers and lobbyists .","the ornate limestone headquarters of the U.S. Chamber of Commerce","headquarters","NN","dobj -> entered"
"1602","0/1","The giant rusty fence of metal bars along the border here , built in recent years to keep <a>XXXX</a> from crossing into the United States , has a new nickname among local residents : Jurassic Park Gate , a nod to the barrier in a 1993 movie that kept dangerous dinosaurs at bay in a theme park .","illegal immigrants","immigrants","NNS","dobj -> keep"
"1604","0/1","The Buddhist monks stood atop the jagged remains of a vocational school , struggling to move <a>XXXX</a> with pickax shovels and bare hands .","concrete slabs","slabs","NNS","dobj -> move"
"1605","0/1","The Buddhist monks stood atop the <a>XXXX</a> , struggling to move concrete slabs with pickax shovels and bare hands .","jagged remains of a vocational school","hand","NN","nsubj -> poking"
"1606","0/1","<a>XXXX</a> stood atop the jagged remains of a vocational school , struggling to move concrete slabs with pickax shovels and bare hands .","The Buddhist monks","monks","NNS","nsubj -> stood"
"1607","0/1","The Buddhist monks stood atop the <a>XXXX</a> , struggling to move concrete slabs with pickax shovels and bare hands .","jagged remains of a vocational school","hand","NN","nsubj -> poking"
"1608","0/1","Mindful that the new health care law 's ability to slow rising medical costs will depend to a great extent on how it is put in effect , President Barack Obama is assembling a high-level team to carry out key elements of the overhaul and is considering moving faster than the law requires to put <a>XXXX</a> into action .","them","them","PRP","dobj -> put"
"1609","0/1","Mindful that the new health care law 's ability to slow <a>XXXX</a> will depend to a great extent on how it is put in effect , President Barack Obama is assembling a high-level team to carry out key elements of the overhaul and is considering moving faster than the law requires to put them into action .","rising medical costs","costs","NNS","dobj -> slow"
"1610","0/1","<a>XXXX</a> denied involvement in the mysterious sinking of a South Korean warship in waters disputed between the two Koreas .","North Korea on Saturday","Korea","NNP","nsubj -> denied"
"1611","0/1","The last two justices to leave the Supreme Court , <a>XXXX</a> , were nominated by Republican presidents and then drifted left .","David Souter and Sandra Day O'Connor","Souter","NNP","appos -> justices"
"1612","0/1","The last two justices to leave the Supreme Court <a>XXXX</a> Souter and Sandra Day O'Connor , were nominated by Republican presidents and then drifted left .",", David","retirement","NN","dobj -> announced"
"1613","0/1","The last two justices to leave the Supreme Court , <a>XXXX</a> , were nominated by Republican presidents and then drifted left .","David Souter and Sandra Day O'Connor","Souter","NNP","appos -> justices"
"1614","0/1","The last <a>XXXX</a> Court , David Souter and Sandra Day O'Connor , were nominated by Republican presidents and then drifted left .","two justices to leave the Supreme","Stevens","NNP","nsubj -> announced"
"1615","0/1","In spite of the cloud of volcanic ash drifting south from Iceland , Pope Benedict XVI arrived in this Catholic nation on Saturday evening in his first foreign trip since <a>XXXX</a> began engulfing the Roman Catholic Church .","a sexual abuse crisis","crisis","NN","nsubj -> began"
"1616","0/1","After months of pressure from Western leaders seeking to avoid another fraud-ridden election , President Hamid Karzai on Saturday chose <a>XXXX</a> received the immediate endorsement of the United Nations .","a new head of Afghanistan 's election commission , who","head","NN","nsubj -> received"
"1617","0/1","In the photograph from last November , <a>XXXX</a> is a proud first-year dental student in his new white jacket , framed by his beaming parents .","Ramy Zamzam , 22 ,","Zamzam","NNP","nsubj -> student"
"1618","0/1","In spite of the cloud of volcanic ash drifting south from Iceland , Pope Benedict XVI arrived in this Catholic nation on Saturday evening in his first foreign trip since <a>XXXX</a> began engulfing the Roman Catholic Church .","a sexual abuse crisis","crisis","NN","nsubj -> began"
"1619","0/1","In the photograph from last November , <a>XXXX</a> is a proud first-year dental student in his new white jacket , framed by his beaming parents .","Ramy Zamzam , 22 ,","Zamzam","NNP","nsubj -> student"
"1622","0/1","Yunus-Bek Yevkurov , <a>XXXX</a> , was sitting in his gold-domed palace , a warren of cool , empty marble halls surrounded by rings of gunmen .","the president of the Russian republic of Ingushetia","president","NN","appos -> Yevkurov"
"1623","0/1","Yunus-Bek Yevkurov , the president of the Russian republic of Ingushetia , was sitting in his gold-domed palace , a warren of cool , <a>XXXX</a> .","empty marble halls surrounded by rings of gunmen","halls","NNS","appos -> cool"
"1624","0/1","Even when the days were longest at his North Carolina Marine base , when he went to the weight room three times a day to fill <a>XXXX</a> , Brandon Crawford would not join the unit football teams .","the hours","hours","NNS","dobj -> fill"
"1625","0/1","Even when the days were longest at his North Carolina Marine base , when he went to the weight room three times a day to fill the hours between the 4 a.m. physical fitness test and when <a>XXXX</a> went to bed , Brandon Crawford would not join the unit football teams .","he","he","PRP","nsubj -> went"
"1627","0/1","<a>XXXX</a> could win the NBA 's coach of the year award because he not only Lewis-and-Clarked the Portland Trail Blazers through the league 's strangest season to reach the playoffs , but ruptured his Achilles ' tendon in the process .","Nate McMillan","McMillan","NNP","nsubj -> ruptured"
"1628","0/1","<a>XXXX</a> dropped charges against two prominent members of a powerful political family accused of the mass killing of 57 people in November , the single worst incident of political violence on record here .","The Philippine government on Saturday","government","NN","nsubj -> dropped"
"1629","0/1","<a>XXXX</a> are two of the smartest men of their generation , both magna cum laude products of Harvard Law School , both cerebral and charming and ambitious .","They","They","PRP","nsubj -> two"
"1630","0/1","<a>XXXX</a> are two of the smartest men of their generation , both magna cum laude products of Harvard Law School , both cerebral and charming and ambitious .","They","They","PRP","nsubj -> vaulted"
"1631","0/1","Until very recently , <a>XXXX</a> was seen here as an especially disagreeable strain of Eastern European leader , one of those Slavic turncoats who demonized Russia and toadied up to its rivals .","President Lech Kaczynski of Poland","Kaczynski","NNP","nsubjpass -> seen"
"1632","0/1","Until very recently , President Lech Kaczynski of Poland was seen here as an especially <a>XXXX</a> strain of Eastern European leader , one of those Slavic turncoats who demonized Russia and toadied up to its rivals .","disagreeable","Russia","NNP","nsubj -> choked"
