"Sent Index","Mention Index/Total","Sentence","Mention","Mention Head","Head POS","Label->Gov"
"773","0/1","In the first violent clash of a nearly monthlong standoff in Bangkok , antigovernment demonstrators stormed a satellite television station on Friday , climbed over rolls of barbed wire and beat back <a>XXXX</a> confronted them with tear gas and water cannons .","soldiers and riot police officers who","soldiers","NNS","nsubj -> confronted"
"774","0/1","In last year 's NFL draft , <a>XXXX</a> was David Bruton .","the highest selected player from Notre Dame","player","NN","nsubj -> Bruton"
"775","0/1","In the first violent clash of a nearly monthlong standoff in Bangkok , antigovernment demonstrators stormed a satellite television station Friday , climbed over rolls of barbed wire and beat back <a>XXXX</a> confronted them with tear gas and water cannons .","soldiers and riot police officers who","soldiers","NNS","nsubj -> confronted"
"777","0/1","Mohsen Sazegara recognizes that <a>XXXX</a> is a tough sell for most Iranians , given that bloodshed spills through both their long history and their faith .","nonviolent protest","protest","NN","nsubj -> sell"
"780","0/1","Justice John Paul Stevens , who announced his resignation from the Supreme Court on Friday after 34 years , may be the <a>XXXX</a> justice from a time when ability and independence , rather than perceived ideology , were viewed as the crucial qualifications for a seat on the court .","last","I","PRP","nsubj -> find"
"782","0/1","The announcement by Justice John Paul Stevens on Friday that he would retire at the end of this term gives President Barack Obama the rare opportunity to make <a>XXXX</a> to the Supreme Court during the first two years of his presidency .","back-to-back appointments","appointments","NNS","dobj -> make"
"783","0/1","A half-century ago , before <a>XXXX</a> was even coined , a taxi tycoon named Robert C. Scull started buying up dozens of works by artists like Jasper Johns , Robert Rauschenberg and Andy Warhol .","the phrase `` Pop Art ''","phrase","NN","nsubjpass -> coined"
"784","0/1","As rescuers headed back into the Upper Big Branch coal mine Friday in a fourth bid to search for four missing miners , a federal official said <a>XXXX</a> had `` dragged its feet '' in supplying a crucial component of the rescue effort .","the mine 's operator , Massey Energy ,","operator","NN","nsubj -> dragged"
"785","0/1","After more than a year of watching America 's ability to influence President Hamid Karzai ebb , Obama administration officials now admit privately that <a>XXXX</a> adopted when he came to power may have been a big mistake .","the tough love approach President Barack Obama","Obama","NNP","nsubj -> adopted"
"786","0/1","After more than a year of watching America 's ability to influence President Hamid Karzai ebb , Obama administration officials now admit privately that <a>XXXX</a> adopted when he came to power may have been a big mistake .","the tough love approach President Barack Obama","Obama","NNP","nsubj -> adopted"
"788","0/1","Should <a>XXXX</a> be the party of no ?","Republicans","Republicans","NNPS","nsubj -> party"
"789","0/1","Should <a>XXXX</a> be the party of no ?","Republicans","Republicans","NNPS","nsubj -> party"
"790","0/1","Rep. Bart Stupak , a Democrat and a leading abortion opponent in Congress who ended up infuriating anti-abortion groups for his support of a compromise in the last hours of debate over landmark health care legislation , said Friday that <a>XXXX</a> would not seek a 10th term in November .","he","he","PRP","nsubj -> seek"
"791","0/1","When Tiger Woods completed his second round Friday , after a workmanlike two-under-par 70 put him squarely in contention for a fifth Masters title , <a>XXXX</a> was asked if he liked where he was .","he","he","PRP","nsubjpass -> asked"
"793","0/1","<a>XXXX</a> old golf course behind the gates at the Augusta National Golf Club awoke in a bad mood Friday .","The tough","gloves","NNS","nsubj -> came"
"794","0/1","When Kevin Jenkins wanted to teach his fourth-grade students at Spangler Elementary here how to use the Internet , he created a site where <a>XXXX</a> could post photographs , drawings and surveys .","they","they","PRP","nsubj -> post"
"795","0/1","A German diocese said Friday that <a>XXXX</a> had filed a criminal complaint this week against a Roman Catholic priest on charges of sexually abusing minors in the 1980s and '90s .","it","it","PRP","nsubj -> filed"
"796","0/1","A NATO Osprey aircraft crashed in southern Afghanistan on Thursday night , killing three American service members and <a>XXXX</a> , according to NATO officials.The crash occurred near Qalat , the capital of Zabul Province , a desert area that remains under Taliban influence .","one civilian employee","employee","NN","dobj -> killing"
"797","0/1","A NATO <a>XXXX</a> crashed in southern Afghanistan on Thursday night , killing three American service members and one civilian employee , according to NATO officials.The crash occurred near Qalat , the capital of Zabul Province , a desert area that remains under Taliban influence .","Osprey aircraft","officials","NNS","nsubj -> said"
"798","0/1","As <a>XXXX</a> headed home on Friday with a freshly inked arms control treaty in hand , he faced a new challenge that may be every bit as vexing as negotiating with Russians : making common cause with Republicans .","President Barack Obama","Obama","NNP","nsubj -> headed"
"799","0/1","When Kevin Jenkins wanted to teach his fourth-grade students at Spangler Elementary here how to use the Internet , he created a site where <a>XXXX</a> could post photographs , drawings and surveys .","they","they","PRP","nsubj -> post"
"800","0/1","<a>XXXX</a> said on Friday that it was investigating France Telecom over accusations of psychological harassment related to a recent spate of suicides .","The Paris prosecutor 's office","office","NN","nsubj -> said"
"801","0/1","When it comes to health care , <a>XXXX</a> is hoping to have it both ways , even as he accuses the White House of doing the same .","Mitt Romney","Romney","NNP","nsubj -> have"
"802","0/1","The Paris prosecutor 's office said on Friday that it was investigating <a>XXXX</a> over accusations of psychological harassment related to a recent spate of suicides .","France Telecom","Telecom","NNP","dobj -> investigating"
"803","0/1","Federal safety regulators are considering more fines against Toyota on top of a $ 16.4 million penalty sought this week for taking too long to notify <a>XXXX</a> .","them of defective accelerator pedals","them","PRP","dobj -> notify"
"804","0/1","<a>XXXX</a> arrived in critical condition last month at the Bagram Air Base hospital in Afghanistan , with what American military doctors at first thought was an all too typical war injury : metal shrapnel from an improvised bomb lodged in his head .","The patient","patient","NN","nsubj -> arrived"
"806","0/1","In the summer of 2007 , as <a>XXXX</a> was dying from blood-cell cancer , Edward M. Gramlich , a former member of the Federal Reserve 's board of governors , sent a handwritten note to Alan Greenspan , the Fed chairman under whom he had served .","he","he","PRP","nsubj -> dying"
"807","0/1","When Tiger Woods completed <a>XXXX</a> Friday , after a workmanlike two-under-par 70 put him squarely in contention for a fifth Masters title , he was asked if he liked where he was .","his second round","round","NN","dobj -> completed"
"809","0/1","<a>XXXX</a> old golf course behind the gates at the Augusta National Golf Club awoke in a bad mood Friday .","The tough","gloves","NNS","nsubj -> came"
"810","0/1","The patient arrived in critical condition last month at the Bagram Air Base hospital in Afghanistan , with what American military doctors thought was a typical war injury : <a>XXXX</a> lodged in his head .","shrapnel from an improvised bomb","shrapnel","NN","nsubj -> lodged"
"811","0/1","<a>XXXX</a> said Friday that it had filed a criminal complaint this week against a Roman Catholic priest on charges of sexually abusing minors in the 1980s and '90s .","A German diocese","diocese","NN","nsubj -> said"
"812","0/1","After a week of angry counterattacks by the Catholic Church against its critics over clerical sexual abuse , <a>XXXX</a> struck a more conciliatory tone on Friday with a statement from its spokesman that raised the possibility that Pope Benedict XVI would again meet with victims .","the Vatican","Vatican","NNP","nsubj -> struck"
"813","0/1","The boy was only 7 , but he walked off the plane that arrived in Moscow from Washington all alone , carrying <a>XXXX</a> , along with a single typewritten note .","a knapsack with magic markers and candy","knapsack","NN","dobj -> carrying"
"814","0/1","The boy was only 7 , but he walked off <a>XXXX</a> plane that arrived in Moscow from Washington all alone , carrying a knapsack with magic markers and candy , along with a single typewritten note .","the","him","PRP","dobj -> adopted"
"815","0/1","The <a>XXXX</a> was only 7 , but he walked off the plane that arrived in Moscow from Washington all alone , carrying a knapsack with magic markers and candy , along with a single typewritten note .","boy","him","PRP","dobj -> Take"
"816","0/1","<a>XXXX</a> has been broken , a senior American official said during a visit here on Friday .","A logjam blocking visas for U.S. diplomats in Pakistan","logjam","NN","nsubjpass -> broken"
"817","0/1","As President Barack Obama headed home on Friday with a freshly inked arms control treaty in hand , he faced a new challenge that may be every bit as vexing as negotiating with Russians : making <a>XXXX</a> .","common cause with Republicans","cause","NN","dobj -> making"
"818","0/1","The boy was only 7 , but he walked off <a>XXXX</a> , with a single typewritten note .","the plane that arrived in Moscow from Washington all alone","plane","NN","dobj -> walked"
"820","0/1","The <a>XXXX</a> was only 7 , but he walked off the plane that arrived in Moscow from Washington all alone , with a single typewritten note .","boy","him","PRP","dobj -> Take"
"822","0/1","As she surveys her near-empty townhouse awaiting the deputies to kick her out of her home of the last seven years , <a>XXXX</a> ca n't help but reflect on the irony of her karma .","Deborah Blankenship","Blankenship","NNP","nsubj -> help"
"823","0/1","<a>XXXX</a> were gone Friday , banished from the skies above Augusta National .","Those mocking airplane banners","banners","NNS","nsubjpass -> gone"
"824","0/1","Those mocking airplane banners were gone Friday , banished from the skies above Augusta National .","","leaderboard","NN","dobj -> climbing"
"825","0/1","<a>XXXX</a> floated back to earth Friday .","The old guys","guys","NNS","nsubj -> floated"
"826","0/1","Zenyatta bowed twice -- deep , head-bobbing , theatrical flourishes that telegraphed to an adoring audience that <a>XXXX</a> was about to see something special .","it","it","PRP","nsubj -> see"
"827","0/1","Zenyatta bowed twice <a>XXXX</a> , head-bobbing , theatrical flourishes that telegraphed to an adoring audience that it was about to see something special .","-- deep","Espinoza","NNP","appos -> groom"
"828","0/1","<a>XXXX</a> bowed twice -- deep , head-bobbing , theatrical flourishes that telegraphed to an adoring audience that it was about to see something special .","Zenyatta","Zenyatta","NNP","nsubj -> bowed"
"829","0/1","<a>XXXX</a> head-bobbing , theatrical flourishes that telegraphed to an adoring audience that it was about to see something special .","Zenyatta bowed twice -- deep ,","groom","NN","nsubj -> smiled"
"830","0/1","Boston College Coach Jerry York returned here , to his hometown , the morning after his Eagles won <a>XXXX</a> in 2001 .","the NCAA hockey championship","championship","NN","dobj -> won"
"831","0/1","Boston College Coach Jerry York returned here <a>XXXX</a> to his hometown , the morning after his Eagles won the NCAA hockey championship in 2001 .",",","he","PRP","nsubj -> frequents"
"833","0/1","Prime Minister Stephen Harper asked <a>XXXX</a> to investigate Helena Guergis , his minister of state for the status of women , before she resigned Friday from his cabinet as well as the Conservative Party Caucus .","the Royal Canadian Mounted Police","Police","NNS","nsubj -> investigate"
"834","0/1","Too many conflicting goals make <a>XXXX</a> all but impossible for the mortgage giants Fannie Mae and Freddie Mac to return to their earlier form , according to former executives of Fannie Mae and former regulators who tried to keep a watch on the companies .","it","it","PRP","nsubj -> return"
"835","0/1","An agonizing four-day wait came to a tragic end early Saturday morning when <a>XXXX</a> failed to find any survivors in an underground mine after a huge explosion earlier this week .","rescue workers","workers","NNS","nsubj -> failed"
"837","0/1","A plane carrying the Polish president and <a>XXXX</a> of the country 's top political and military leaders to the site of the Soviet massacre of thousands of Polish officers in World War II crashed in western Russia on Saturday , killing everyone on board .","dozens","dozens","NNS","dobj -> carrying"
"838","0/1","President Jacob Zuma of South Africa reprimanded his most outspoken and often outrageous disciple on Saturday , issuing a statement that Julius Malema had crossed the line and ought to button <a>XXXX</a> .","his lip","lip","NN","dobj -> button"
"839","0/1","<a>XXXX</a> reprimanded his most outspoken and often outrageous disciple on Saturday , issuing a statement that Julius Malema had crossed the line and ought to button his lip .","President Jacob Zuma of South Africa","Zuma","NNP","nsubj -> reprimanded"
"840","0/1","This season 's darling of the political left , <a>XXXX</a> has generated millions of dollars in donations in his quest to stop Sen. Blanche Lincoln from winning the Democratic nomination for a third term , took a seat in the Gunsmoke Room at the Western Sizzlin restaurant here and explained his ideology .","a man who","man","NN","nsubj -> generated"
"844","0/1","The interim government of Kyrgyzstan , which took control on the heels of protesters storming <a>XXXX</a> earlier this week , moved quickly on Saturday to solidify relations with Russia .","the presidential building","building","NN","dobj -> storming"
"845","0/1","The interim government of Kyrgyzstan , which took control on the heels of protesters storming <a>XXXX</a> earlier this week , moved quickly on Saturday to solidify relations with Russia .","the presidential building","building","NN","dobj -> storming"
"846","0/1","For more than three decades , <a>XXXX</a> worked as a chef , cook , bartender and , most recently , nanny .","Kurt Seidl","Seidl","NNP","nsubj -> worked"
"847","0/1","<a>XXXX</a> more than three decades , Kurt Seidl worked as a chef , cook , bartender and , most recently , nanny .","For","He","PRP","nsubj -> wrote"
"848","0/1","For more than three decades , Kurt Seidl worked as a chef , cook <a>XXXX</a> bartender and , most recently , nanny .",",","he","PRP","nsubj -> living"
"849","0/1","For more than three decades , <a>XXXX</a> worked as a chef , cook , bartender and , most recently , nanny .","Kurt Seidl","Seidl","NNP","nsubj -> worked"
"850","0/1","For more than three decades , Kurt <a>XXXX</a> , most recently , nanny .","Seidl worked as a chef , cook , bartender and","collections","NNS","appos -> time"
"851","0/1","For <a>XXXX</a> than three decades , Kurt Seidl worked as a chef , cook , bartender and , most recently , nanny .","more","Seidl","NNP","nsubj -> writing"
"854","0/1","The military began <a>XXXX</a> but the protesters fought back , and wild , running battles continued into the night .","its first big push against antigovernment protesters on Saturday","push","NN","dobj -> began"
"855","0/1","To Sen. Tom Coburn , the idea of providing extended unemployment pay to the nation 's long-term jobless without finding money elsewhere in the federal budget to cover <a>XXXX</a> amounts to a crime .","the added benefits","benefits","NNS","nsubj -> amounts"
"856","0/1","The military began <a>XXXX</a> but the protesters fought back , and wild , running battles continued into the night .","its first big push against antigovernment protesters on Saturday","push","NN","dobj -> began"
"857","0/1","Most any other year , this state 's open Senate seat would be <a>XXXX</a> .","Trey Grayson 's","Grayson","NNP","nsubj -> be"
"860","0/1","<a>XXXX</a> any other year , this state 's open Senate seat would be Trey Grayson 's .","Most","He","PRP","nsubj -> graduated"
"864","0/1","<a>XXXX</a> came from the far reaches of the Amazon , traveling in small boats and canoes for up to three days to discuss their fate .","They","They","PRP","nsubj -> came"
"865","0/1","<a>XXXX</a> the Amazon , traveling in small boats and canoes for up to three days to discuss their fate .","They came from the far reaches of","Cameron","NNP","nsubj -> stood"
"866","0/1","The future Pope Benedict XVI , dealing with a request to defrock a child-molesting priest in California , was handling it as a dismissal from the priesthood -- not an abuse case -- and acted `` expeditiously '' by the standards of the time , <a>XXXX</a> said in a statement released Saturday .","a Vatican lawyer","lawyer","NN","nsubj -> said"
"867","0/1","Kimberly E. Kaplan recently received a notice telling her that she and her three children were about to lose their monthly welfare benefit of $ 584 because they had reached <a>XXXX</a> and she had not made adequate efforts to find work .","the time limit on cash assistance","limit","NN","dobj -> reached"
"868","0/1","The retirement of Justice John Paul Stevens presents a test for Republicans as much as <a>XXXX</a> does for President Barack Obama as they weigh how much they want to wage a high-profile battle in the months before crucial midterm elections .","it","it","PRP","nsubj -> does"
"869","0/1","The retirement of Justice John Paul Stevens presents a test for Republicans as much as <a>XXXX</a> does for President Barack Obama as they weigh how much they want to wage a high-profile battle over ideological issues in the months before crucial midterm elections .","it","it","PRP","nsubj -> does"
"870","0/1","They came from the far reaches of the Amazon , traveling in small boats and canoes for up to three days to discuss <a>XXXX</a> .","their fate","fate","NN","dobj -> discuss"
"871","0/1","<a>XXXX</a> the Amazon , traveling in small boats and canoes for up to three days to discuss their fate .","They came from the far reaches of","Cameron","NNP","nsubj -> stood"
"872","0/1","To Sen. Tom Coburn , the idea of providing extended unemployment pay to the nation 's long-term jobless without finding <a>XXXX</a> elsewhere in the federal budget to cover the added benefits amounts to a crime .","money","money","NN","dobj -> finding"
"873","0/1","One month after finishing <a>XXXX</a> at Harvard , Jeremy Lin was playing for a team sponsored by a water sealant company .","an exceptional basketball career","career","NN","dobj -> finishing"
"874","0/1","The geographic divide between the two golf courses measures <a>XXXX</a> .","4.3 miles","miles","NNS","dobj -> measures"
"875","0/1","<a>XXXX</a> geographic divide between the two golf courses measures 4.3 miles .","The","They","PRP","nsubj -> share"
"876","0/1","A month of military exercises began in Pakistan this weekend , the country 's biggest drills in 20 years , in what <a>XXXX</a> said was a show of military muscle meant mainly to impress a domestic audience .","analysts","analysts","NNS","nsubj -> said"
"877","0/1","A plane carrying the Polish president and <a>XXXX</a> of the country 's top political and military leaders to the site of the Soviet massacre of Polish officers in World War II crashed in western Russia on Saturday , killing everyone on board .","dozens","dozens","NNS","dobj -> carrying"
"878","0/1","The night is inky , <a>XXXX</a> are late and Cmdr. Patrick Opiyo Makasi sits near a dying cooking fire on a remote army base , spinning his thoughts into the darkness .","the helicopters","helicopters","NNS","nsubj -> late"
"879","0/1","<a>XXXX</a> is inky , the helicopters are late and Cmdr. Patrick Opiyo Makasi sits near a dying cooking fire on a remote army base , spinning his thoughts into the darkness .","The night","night","NN","nsubj -> inky"
"881","0/1","Anti-government protesters repulsed an attempt by the military to disperse them on Saturday night in a fierce running battle filled with tear gas , <a>XXXX</a> and explosions that left 11 people dead and more than 500 wounded .","gunfire","gunfire","NN","dobj -> tear"
"882","0/1","Anti-government protesters repulsed an attempt by the military to disperse <a>XXXX</a> on Saturday night in a fierce running battle filled with tear gas , gunfire and explosions that left 11 people dead and more than 500 wounded .","them","them","PRP","dobj -> disperse"
"883","0/1","When I was in Saudi Arabia , I had <a>XXXX</a> with a group of educated and sophisticated young professional women .","tea and sweets","tea","NN","dobj -> had"
"884","0/1","As the Roman Catholic Church continued to battle a sexual abuse crisis , Pope Benedict XVI spent Friday evening watching <a>XXXX</a> .","a movie","movie","NN","dobj -> watching"
"885","0/1","As the Roman Catholic Church continued to battle a sexual abuse crisis , Pope Benedict XVI spent Friday evening watching a movie <a>XXXX</a>",".","papacy","NN","dobj -> haunt"
"886","0/1","As the Roman Catholic Church continued to battle a sexual abuse crisis , Pope Benedict XVI spent <a>XXXX</a> .","Friday evening watching a movie","evening","NN","dobj -> spent"
"887","0/1","As the Roman Catholic Church continued to battle a sexual abuse crisis , Pope Benedict XVI spent Friday evening watching a movie <a>XXXX</a>",".","papacy","NN","dobj -> haunt"
"888","0/1","The United States on Saturday made its first high-level contact with the interim government of Kyrgyzstan , which took control on the heels of protesters storming <a>XXXX</a> .","the presidential building earlier in the week","building","NN","dobj -> storming"
"889","0/1","Suicide vests and grenades hidden in boxes of medicine were found Saturday in a hospital run by an Italian charity in the capital of Helmand province , Lashkar Gah , and <a>XXXX</a> were detained along with six Afghans who worked at the hospital , according to the provincial governor and Interior Ministry officials in Kabul .","three Italian citizens","citizens","NNS","nsubjpass -> detained"
"890","0/1","<a>XXXX</a> is elected for life , by a group of elderly men infused with the will of God .","He","He","PRP","nsubjpass -> elected"
"891","0/1","He is <a>XXXX</a> for life , by a group of elderly men infused with the will of God .","elected","him","PRP","dobj -> address"
"892","0/1","He is elected for life <a>XXXX</a> group of elderly men infused with the will of God .",", by a","title","NN","nsubj -> vicar"
"893","0/1","World leaders expressed sadness on Saturday after an airplane crash in Russia killed <a>XXXX</a> and some of his country 's leading military , banking and foreign policy experts .","Poland President Lech Kaczynski","Kaczynski","NNP","dobj -> killed"
"894","0/1","Tiger Woods ' express ride back to the winner 's circle hit <a>XXXX</a> bumps Saturday .","some speed","speed","NN","nsubj -> bumps"
"895","0/1","Tiger Woods ' express ride back to the winner 's circle hit some <a>XXXX</a> bumps Saturday .","speed","him","PRP","nsubj -> spout"
"896","0/1","As <a>XXXX</a> stood in the 13th fairway waiting to hit , over his right shoulder came a wild , unbridled cheer .","Tiger Woods","Woods","NNP","nsubj -> stood"
"897","0/1","As Tiger Woods stood in the 13th fairway waiting to hit , over his right shoulder came a wild <a>XXXX</a> cheer .",", unbridled","Mickelson","NNP","nsubj -> playing"
"898","0/1","As Tiger <a>XXXX</a> the 13th fairway waiting to hit , over his right shoulder came a wild , unbridled cheer .","Woods stood in","hand","NN","dobj -> put"
"899","0/1","As a kid , <a>XXXX</a> so loved cars that he could name every make and model .","Peter Mullin","Mullin","NNP","nsubj -> loved"
"900","0/1","This community turned from prayers for a miracle rescue to all-out mourning on Saturday , hours after officials confirmed that the last four coal miners missing after a mine explosion <a>XXXX</a> were dead .","nearly a week ago","week","NN","nsubj -> dead"
"901","0/1","This community turned <a>XXXX</a> a miracle rescue to all-out mourning on Saturday , hours after officials confirmed that the last four coal miners missing after a mine explosion nearly a week ago were dead .","from prayers for","toll","NN","dobj -> brought"
"902","0/1","Mayor Antonio Villaraigosa and the City Council have said repeatedly that , come what may , declaring <a>XXXX</a> bankrupt is not an option .","Los Angeles","Angeles","NNP","dobj -> declaring"
"904","0/1","The toys in the backyard suggest generous parenting : <a>XXXX</a> set , its green paint shiny and new ; a red tetherball covered in cherry-red glitter ; even a trampoline .","a swing","swing","NN","nsubj -> set"
"905","0/1","The chairman of the Republican National Committee stood before party members on Saturday and acknowledged that he had made mistakes and created distractions during a critical midterm election year , but he implored <a>XXXX</a> to turn their attention to defeating Democrats .","Republicans","Republicans","NNS","nsubj -> turn"
"906","0/1","One day after sliding down the leaderboard , and tweaking his aching back along the way , <a>XXXX</a> dragged his 50-year-old self right back into the fray .","Fred Couples","Couples","NNP","nsubj -> dragged"
