"Sent Index","Mention Index/Total","Sentence","Mention","Mention Head","Head POS","Label->Gov"
"2122","0/1","<a>XXXX</a> usually revolve around minutiae , like who will be voting in the Harris college football poll and how the standings formula will be tweaked .","The Bowl Championship Series meetings","meetings","NNS","nsubj -> revolve"
"2123","0/1","The Bowl Championship Series meetings usually revolve around minutiae , like who will be <a>XXXX</a> the Harris college football poll and how the standings formula will be tweaked .","voting in","issues","NNS","nsubj -> rested"
"2124","0/1","with 12 more suspected insurgents seized in raids in Baghdad and Mosul in the north on Thursday -- may be the most significant blow yet to a still-deadly movement here that <a>XXXX</a> appeared to be regrouping , the officials said .","only a few months ago","months","NNS","nsubj -> appeared"
"2125","0/1","with 12 more suspected insurgents seized in raids in Baghdad and Mosul in the north on Thursday -- may be the most significant blow yet to a still-deadly movement here that only a few months ago appeared to be regrouping , the officials said .","","reliance","NN","dobj -> diminish"
"2126","0/1","with 12 more suspected insurgents <a>XXXX</a> in Baghdad and Mosul in the north on Thursday -- may be the most significant blow yet to a still-deadly movement here that only a few months ago appeared to be regrouping , the officials said .","seized in raids","weapon","NN","nsubj -> carry"
"2127","0/1","<a>XXXX</a> more suspected insurgents seized in raids in Baghdad and Mosul in the north on Thursday -- may be the most significant blow yet to a still-deadly movement here that only a few months ago appeared to be regrouping , the officials said .","with 12","talks","NNS","nsubj -> begin"
"2128","0/1","<a>XXXX</a> in raids in Baghdad and Mosul in the north on Thursday -- may be the most significant blow yet to a still-deadly movement here that only a few months ago appeared to be regrouping , the officials said .","with 12 more suspected insurgents seized","Palestinians","NNPS","nsubj -> furious"
"2129","0/1","Sen. Charles E. Schumer , <a>XXXX</a> , has long been known as one of Wall Street 's best friends on Capitol Hill , but there are apparently limits to that friendship .","D-New York","York","NNP","appos -> Schumer"
"2130","0/1","Sen. Charles E. Schumer , D-New York , has long been known as one of Wall Street 's best friends on Capitol Hill , but there are apparently <a>XXXX</a> .","limits to that friendship","limits","NNS","nsubj -> are"
"2131","0/1","much of the cost cutting was done in 2009 , '' Janet L. Robinson , the president and <a>XXXX</a> , said in an interview .","chief executive","executive","NN","appos -> Robinson"
"2132","0/1","much <a>XXXX</a> the cost cutting was done in 2009 , '' Janet L. Robinson , the president and chief executive , said in an interview .","of","We","PRP","nsubj -> reaping"
"2134","0/1","<a>XXXX</a> of the cost cutting was done in 2009 , '' Janet L. Robinson , the president and chief executive , said in an interview .","much","Sales","NNS","nsubj -> were"
"2135","0/1","<a>XXXX</a> of the cost cutting was done in 2009 , '' Janet L. Robinson , the president and chief executive , said in an interview .","much","Analysts","NNS","nsubj -> expected"
"2136","0/1","<a>XXXX</a> the cost cutting was done in 2009 , '' Janet L. Robinson , the president and chief executive , said in an interview .","much of","association","NN","nsubj -> said"
"2137","0/1","Where does the City of Austin get off designating <a>XXXX</a> ?","a clump of seven oak trees a park","clump","NN","dobj -> designating"
"2139","0/1","Two stories <a>XXXX</a> 's surface , where the sun never shines , deep thinkers and others gathered this week in Austin to contemplate how to save America .","beneath the Earth","lawmakers","NNS","nsubj -> were"
"2140","0/1","This time last year , <a>XXXX</a> lay in a hospital bed depressed , unable to eat , and believing that death was imminent .","my mother","mother","NN","nsubj -> lay"
"2141","0/1","In January , <a>XXXX</a> unanimously moved to strike Bill Martin Jr. from a third grade social studies curriculum standard .","the Texas State Board of Education","Board","NNP","nsubj -> strike"
"2142","0/1","<a>XXXX</a> fueled the emergence of the Democratic congressional majority in 2006 and then helped expand it in 2008 .","The American suburbs","suburbs","NNS","nsubj -> fueled"
"2143","0/1","The American suburbs fueled the emergence of the Democratic congressional majority <a>XXXX</a> then helped expand it in 2008 .","in 2006 and","races","NNS","dobj -> lost"
"2144","0/1","There are complete skins of animals , dried , tied and knotted , <a>XXXX</a> .","their orifices fitted with hollow canes and reeds","orifices","NNS","nsubj -> are"
"2145","0/1","<a>XXXX</a> complete skins of animals , dried , tied and knotted , their orifices fitted with hollow canes and reeds .","There are","hides","NNS","nsubjpass -> stretched"
"2146","0/1","<a>XXXX</a> , dried , tied and knotted , their orifices fitted with hollow canes and reeds .","There are complete skins of animals","Strings","NNP","nsubjpass -> pulled"
"2147","0/1","<a>XXXX</a> animals , dried , tied and knotted , their orifices fitted with hollow canes and reeds .","There are complete skins of","Antlers","NNP","nsubjpass -> cut"
"2148","0/1","There are complete skins of animals , dried , tied <a>XXXX</a> orifices fitted with hollow canes and reeds .","and knotted , their","skins","NNS","nsubjpass -> used"
"2149","0/1","The British economy grew at a slower pace in the first quarter than some economists had expected , the latest indication that even though a recovery has begun , <a>XXXX</a> will be bumpy and protracted .","it","it","PRP","nsubj -> protracted"
"2150","0/1","The British economy grew at a slower pace in the first quarter than some economists had expected , the latest indication that even though a recovery has begun , <a>XXXX</a> will be bumpy and protracted .","it","it","PRP","nsubj -> bumpy"
"2151","0/1","Chinese authorities confirmed Friday reports that <a>XXXX</a> had asked Buddhist monks to end their relief work in Qinghai , the province in central China 's highlands where an earthquake last week left at least 2,187 people dead .","they","they","PRP","nsubj -> asked"
"2152","0/1","Setting the stage for a gradual withdrawal from Afghanistan , <a>XXXX</a> adopted a plan here Friday that sets conditions for beginning to remove troops from a lead role in Afghan provinces by the end of this year .","the United States and other NATO countries","States","NNPS","nsubj -> adopted"
"2153","0/1","Annie Laurie Gaylor clicked through a flurry of e-mail messages warning her to repent or <a>XXXX</a> would burn in hell .","she","she","PRP","nsubj -> burn"
"2155","0/1","An outbreak of public infighting within Nigeria 's ruling party this week has exposed how confused the country 's politics remain in the wake of the recent shaky handover of power at the top , <a>XXXX</a> contend .","analysts","analysts","NNS","nsubj -> contend"
"2156","0/1","<a>XXXX</a> clicked through a flurry of e-mail messages warning her to repent or she would burn in hell .","Annie Laurie Gaylor","Gaylor","NNP","nsubj -> clicked"
"2157","0/1","<a>XXXX</a> sweeps through the cavernous workshop here where his amusement rides are manufactured while workers measure and bang and solder enormous platforms , oddly shaped beams and assorted fiberglass vehicles .","Alberto Zamperla","Zamperla","NNP","nsubj -> sweeps"
"2158","0/1","<a>XXXX</a> sweeps through the cavernous workshop here where his amusement rides are manufactured while workers measure and bang and solder enormous platforms , oddly shaped beams and assorted fiberglass vehicles .","Alberto Zamperla","Zamperla","NNP","nsubj -> sweeps"
"2159","0/1","North Korea confiscated five facilities owned by South Korea at a jointly operated mountain resort on Friday , and it called South Korea 's president a `` traitor '' and accused <a>XXXX</a> of defaming the North 's most important holiday .","him","him","PRP","dobj -> accused"
"2160","0/1","North Korea confiscated five facilities owned by South Korea at a jointly operated mountain resort on Friday , and <a>XXXX</a> called South Korea 's president a `` traitor '' and accused him of defaming the North 's most important holiday .","it","it","PRP","nsubj -> accused"
"2161","0/1","<a>XXXX</a> turned violent this week in Bangkok , but the capital is not the only place with a whiff of insurrection in the air .","Six weeks of demonstrations by red-shirted protesters","weeks","NNS","nsubj -> turned"
"2162","0/1","When a police officer is killed in Mexico , as six of them were Friday on the streets of Ciudad Juarez , the sad question that immediately arises is , `` <a>XXXX</a> were they on ? ''","Whose side","side","NN","nsubj -> were"
"2163","0/1","Six weeks of demonstrations by red-shirted protesters turned violent this week in Bangkok , but <a>XXXX</a> is not the only place with a whiff of insurrection in the air .","the capital","capital","NN","nsubj -> place"
"2164","0/1","A coordinated series of explosions struck a party headquarters , two mosques , a market and <a>XXXX</a> in Baghdad on Friday , deepening the country 's turmoil amid a political impasse and a concerted military campaign against the leaders of al-Qaida in Iraq .","a shop","shop","NN","appos -> mosques"
"2165","0/1","To walk through the squalor of Mayapuri , <a>XXXX</a> , is to bear witness to the industrial detritus of the world : tons of rusted iron pipes , twisted steel poles , copper and other discarded metals from Europe , Russia , Japan and the United States , as well as from India .","a grimy industrial area of hundreds of tiny scrap-metal shops","area","NN","appos -> Mayapuri"
"2166","0/1","<a>XXXX</a> struck a party headquarters , two mosques , a market and a shop in Baghdad on Friday , deepening the country 's turmoil amid a political impasse and a concerted military campaign against the leaders of al-Qaida in Iraq .","A coordinated series of explosions","series","NN","nsubj -> struck"
"2167","0/1","As a longtime Democratic consultant , <a>XXXX</a> has worked for presidents and managed scandals .","Chris Lehane","Lehane","NNP","nsubj -> managed"
"2168","0/1","As a longtime Democratic consultant , Chris Lehane has worked for presidents and managed scandals .","","attention","NN","dobj -> caught"
"2169","0/1","To walk through the squalor of Mayapuri , a grimy industrial area of hundreds of tiny scrap-metal shops , is to bear witness to the industrial detritus of the world : tons of rusted iron pipes , twisted steel poles , <a>XXXX</a> and other discarded metals from Europe , Russia , Japan and the United States , as well as from India .","copper","copper","NN","appos -> tons"
"2170","0/1","As a longtime Democratic consultant , Chris Lehane has worked for presidents and managed <a>XXXX</a> .","scandals","scandals","NNS","dobj -> managed"
"2172","0/1","The longest-serving bishop in Belgium resigned Friday after admitting to sexually abusing `` <a>XXXX</a> in my close entourage '' many years ago , becoming the latest cleric to quit in a spreading abuse scandal .","a boy","boy","NN","dobj -> abusing"
"2173","0/1","<a>XXXX</a> resigned Friday after admitting to sexually abusing `` a boy in my close entourage '' many years ago , becoming the latest cleric to quit in a spreading abuse scandal .","The longest-serving bishop in Belgium","bishop","NN","nsubj -> resigned"
"2174","0/1","Like hip-hop , health food and snowboarding , <a>XXXX</a> is going corporate .","marijuana","marijuana","NN","nsubj -> going"
"2175","0/1","Josh Blum wanted a second home in this mountain community but was concerned about the image <a>XXXX</a> would convey .","it","it","PRP","nsubj -> convey"
"2176","0/1","Describing his country 's economy as `` a sinking ship , '' Greece 's prime minister formally requested an international bailout on Friday , creating <a>XXXX</a> so far to the European monetary union .","the biggest test","test","NN","dobj -> creating"
"2177","0/1","Like hip-hop , health food and snowboarding , <a>XXXX</a> is going corporate .","marijuana","marijuana","NN","nsubj -> going"
"2178","0/1","By day , <a>XXXX</a> deal with risk .","they","they","PRP","nsubj -> deal"
"2179","0/1","By day , <a>XXXX</a> deal with risk .","they","it","PRP","nsubj -> got"
"2180","0/1","Describing his country 's economy as `` a sinking ship , '' Greece 's prime minister formally requested <a>XXXX</a> on Friday , creating the biggest test so far to the European monetary union .","an international bailout","bailout","NN","dobj -> requested"
"2181","0/1","The Chinese military is seeking to project naval power well beyond the Chinese coast , from the oil ports of the Middle East to the shipping lanes of the Pacific , where <a>XXXX</a> has long reigned as the dominant force , military officials and analysts say .","the United States Navy","Navy","NNP","nsubj -> reigned"
"2182","0/1","A government analysis of the new health care law says it will not slow the overall growth of health spending because <a>XXXX</a> will offset cost reductions in Medicare and other programs .","the expansion of insurance and services to 34 million people","expansion","NN","nsubj -> offset"
"2183","0/1","A government analysis of the new health care law says it will not slow the overall growth of health spending because the expansion of insurance and services to 34 million people will offset <a>XXXX</a> .","cost reductions in Medicare and other programs","reductions","NNS","dobj -> offset"
"2184","0/1","The Chinese military is seeking to project naval power well beyond the Chinese coast , from the oil ports of the Middle East to the shipping lanes of the Pacific , where <a>XXXX</a> has long reigned as the dominant force , military officials and analysts say .","the U.S. Navy","Navy","NNP","nsubj -> reigned"
"2185","0/1","On Sunday , the Indian Premier League , <a>XXXX</a> following , holds the final game of its third season .","a wildly successful professional cricket empire with a huge fan","empire","NN","appos -> League"
"2186","0/1","On Sunday , the Indian Premier League , a wildly successful professional cricket empire with a huge fan following , holds <a>XXXX</a> .","the final game of its third season","game","NN","dobj -> holds"
"2187","0/1","As Amar ' e Stoudemire sat at his locker stall <a>XXXX</a> , he made a proclamation that drew a chuckle from several reporters -- and probably outright laughter around the NBA .","Thursday night","night","NN","dobj -> stall"
"2188","0/1","<a>XXXX</a> signed the nation 's toughest bill on illegal immigration into law Friday ; its aim is to identify , prosecute and deport illegal immigrants .","Gov. Jan Brewer of Arizona","Brewer","NNP","nsubj -> signed"
"2189","0/1","<a>XXXX</a> signed the nation 's toughest bill on illegal immigration into law Friday ; its aim is to identify , prosecute and deport illegal immigrants .","Gov. Jan Brewer of Arizona","Brewer","NNP","nsubj -> signed"
"2190","0/1","Hotman Paris Hutapea is , by his own reckoning , <a>XXXX</a> .","the freest lawyer in Indonesia","lawyer","NN","appos -> reckoning"
"2191","0/1","Three days after an explosion on an oil rig off the southeast coast of Louisiana , <a>XXXX</a> has been at least temporarily forestalled , but the search for 11 missing workers has ended , the Coast Guard said Friday evening .","an environmental disaster","disaster","NN","nsubjpass -> forestalled"
"2192","0/1","Three days after an explosion on an oil rig off the southeast coast of Louisiana , an environmental disaster has been at least temporarily forestalled , but <a>XXXX</a> has ended , the Coast Guard said Friday evening .","the search for 11 missing workers","search","NN","nsubj -> ended"
"2193","0/1","<a>XXXX</a> is , by his own reckoning , the freest lawyer in Indonesia .","Hotman Paris Hutapea","Hutapea","NNP","nsubj -> is"
"2194","0/1","A day after CenturyTel announced plans for a $ 22 billion takeover of Denver-based Qwest , shares of both companies dropped <a>XXXX</a> on Friday as analysts raised concerns about the integration of what would be the largest telecommunications merger in years .","nearly 2 percent","percent","NN","dobj -> dropped"
"2195","0/1","Usain Bolt , the men 's world-record holder in the 100 and <a>XXXX</a> , will be the main attraction at the Penn Relays this weekend .","the 200 meters","meters","NNS","appos -> Bolt"
"2196","0/1","Usain <a>XXXX</a> , the men 's world-record holder in the 100 and the 200 meters , will be the main attraction at the Penn Relays this weekend .","Bolt","he","PRP","nsubj -> sprinter"
"2197","0/1","No one would have blamed Ken Green if the thought of quitting crossed <a>XXXX</a> Friday .","his mind","mind","NN","dobj -> crossed"
"2198","0/1","No one would have blamed Ken Green if the thought of quitting crossed his mind Friday .","","it","PRP","dobj -> looked"
"2199","0/1","The NBA 's elite can blame <a>XXXX</a> for Kevin Durant 's evolution .","themselves","themselves","PRP","dobj -> blame"
"2200","0/1","<a>XXXX</a> NBA 's elite can blame themselves for Kevin Durant 's evolution .","The","He","PRP","nsubj -> takes"
"2201","0/1","<a>XXXX</a> NBA 's elite can blame themselves for Kevin Durant 's evolution .","The","He","PRP","nsubj -> mimics"
"2202","0/1","The NBA 's elite can blame themselves <a>XXXX</a>","for Kevin Durant 's evolution .","experience","NN","dobj -> have"
"2204","0/1","While President Barack Obama struggles to negotiate U.N. sanctions with teeth against Iran , a parallel campaign to turn up the heat is gaining momentum by pressuring <a>XXXX</a> individually to cut their business ties there .","American and foreign corporations","corporations","NNS","dobj -> pressuring"
"2205","0/1","While President Barack Obama struggles to negotiate U.N. sanctions with teeth against Iran , a parallel campaign to turn up the heat is gaining <a>XXXX</a> by pressuring American and foreign corporations individually to cut their business ties there .","momentum","momentum","NN","dobj -> gaining"
"2207","0/1","The Boy Scouts of America were ordered Friday to pay $ 18.5 million in a lawsuit that has focused new attention on the secret files <a>XXXX</a> keep to document claims of sexual abuse by troop leaders and volunteers .","the Scouts","Scouts","NNS","nsubj -> document"
"2208","0/1","Proposals to establish a global tax on banks and charge them for the cost of government bailouts <a>XXXX</a> during a summit meeting here on Friday .","divided representatives of the Group of 20 countries","representatives","NNS","dobj -> bailouts"
"2209","0/1","New York state environmental officials announced on Friday that they would impose <a>XXXX</a> on a controversial type of natural gas drilling in the upstate area that supplies most of New York City 's drinking water , making it highly unlikely that any drilling would be done there .","far stricter regulations","regulations","NNS","dobj -> impose"
"2210","0/1","<a>XXXX</a> were ordered Friday to pay $ 18.5 million in a lawsuit that has focused new attention on the secret files the Scouts keep to document claims of sexual abuse by troop leaders and volunteers .","The Boy Scouts of America","Scouts","NNS","nsubjpass -> ordered"
"2211","0/1","New York state environmental officials announced Friday that they would impose far stricter regulations on a controversial type of natural gas drilling in the upstate area that supplies most of New York City 's drinking water , making it highly unlikely that <a>XXXX</a> would be done there .","any drilling","drilling","NN","nsubjpass -> done"
"2214","0/1","<a>XXXX</a> turned violent this week in Bangkok , but the capital is not the only place with a whiff of insurrection in the air .","Six weeks of demonstrations by red-shirted protesters","weeks","NNS","nsubj -> turned"
"2215","0/1","<a>XXXX</a> is seeking to project naval power well beyond the Chinese coast , from the oil ports of the Middle East to the shipping lanes of the Pacific , where the U.S. Navy has long reigned as the dominant force , military officials and analysts say .","The Chinese military","military","NN","nsubj -> seeking"
"2216","0/1","<a>XXXX</a> said Friday that a three-week search in the Atlantic for the wreckage of an Air France jet that crashed in June had proved unsuccessful and that search boats and equipment would return to port early next week .","The French air-accident investigation bureau","bureau","NN","nsubj -> said"
"2217","0/1","The first time <a>XXXX</a> saw his family 's new recreational vehicle , he cringed .","Kyle Wilson","Wilson","NNP","nsubj -> saw"
"2218","0/1","<a>XXXX</a> first time Kyle Wilson saw his family 's new recreational vehicle , he cringed .","The","He","PRP","nsubj -> looked"
"2219","0/1","The three generations of the Frausto family represent a paradox of the 2010 Census -- and the worst fears of Latino leaders who have been working for months to boost <a>XXXX</a> in the nation 's dicennial head count .","participation","participation","NN","dobj -> boost"
"2220","0/1","A Californa State University , Northridge , associate professor who published an Internet guide to Thailand 's `` girl scene '' shut down his website Friday after he and campus administrators agreed <a>XXXX</a> tarnished the university 's image .","it","it","PRP","nsubj -> tarnished"
"2221","0/1","When a police officer is killed in Mexico , as six of them were Friday on the streets of Ciudad Juarez , the sad question that immediately arises is , `` Whose side were <a>XXXX</a> on ? ''","they","they","PRP","nsubj -> on"
"2222","0/1","Gov. Jan Brewer of Arizona signed the nation 's toughest bill on illegal immigration into law Friday ; its aim is to identify , prosecute and deport <a>XXXX</a> .","illegal immigrants","immigrants","NNS","dobj -> deport"
"2223","0/1","After the fireworks that was the Broncos ' first day of the NFL draft , <a>XXXX</a> was all quiet on the league 's Western front .","Friday 's second day","day","NN","nsubj -> quiet"
"2224","0/1","Like hip-hop , health food and snowboarding , <a>XXXX</a> is going corporate .","marijuana","marijuana","NN","nsubj -> going"
"2225","0/1","Gov. Jan Brewer of Arizona signed the nation 's toughest bill on illegal immigration into law Friday ; <a>XXXX</a> is to identify , prosecute and deport illegal immigrants .","its aim","aim","NN","nsubj -> identify"
"2226","0/1","If this was a statement game , <a>XXXX</a> whimpered : No mas .","then the Nuggets","Nuggets","NNPS","nsubj -> whimpered"
"2227","0/1","The sorcerer still has <a>XXXX</a> .","his head","head","NN","dobj -> has"
"2229","0/1","When <a>XXXX</a> set out to knock on doors in this recession-hit English town on a chilly , gusting evening last week , the venture had the air of an itinerant penance , among a population reluctant to forgive .","Jacqui Smith","Smith","NNP","nsubj -> knock"
"2230","0/1","<a>XXXX</a> still has his head .","The sorcerer","sorcerer","NN","nsubj -> has"
"2231","0/1","The people of Chicago debate <a>XXXX</a> .","the Cubs versus the White Sox","Cubs","NNP","dobj -> debate"
"2232","0/1","The people of Chicago debate the Cubs versus the White <a>XXXX</a>","Sox .","Geno","NNP","nsubj -> divided"
"2234","0/1","Dueling <a>XXXX</a> are planned for Las Vegas , and it seems almost certain that someone is going to get hurt .","centers chronicling the history of the mob","centers","NNS","dobj -> Dueling"
"2235","0/1","South Korea on Saturday salvaged the remaining half of a warship that sank near a disputed sea border with North Korea , as suspicion of a North Korean torpedo attack deepened and two former South Korean presidents urged <a>XXXX</a> to punish Pyongyang economically .","the country 's leaders","leaders","NNS","nsubj -> punish"
"2236","0/1","The black-and-white photographs that were published last month in a North Korean newspaper appear no different from other propaganda coming from North Korea : <a>XXXX</a> show the supreme leader , Kim Jong-Il , touring a steel plant in a fur cap and his trademark sunglasses .","they","they","PRP","nsubj -> show"
"2238","0/1","For China , <a>XXXX</a> seems smooth .","the transition","transition","NN","nsubj -> seems"
"2239","0/1","For China , <a>XXXX</a> seems smooth .","the transition","transition","NN","nsubj -> seems"
"2240","0/1","Rep. David Obey has won <a>XXXX</a> , easily prevailing through wars and economic crises that have spanned presidencies from Nixon to Obama .","21 straight races","races","NNS","dobj -> won"
"2241","0/1","Rep. David Obey has won 21 straight races , easily prevailing through wars and economic crises <a>XXXX</a> from Nixon to Obama .","that have spanned presidencies","control","NN","dobj -> threatening"
"2242","0/1","Rep. David Obey has won 21 straight races , easily prevailing through wars and economic crises that have spanned <a>XXXX</a> to Barack Obama .","presidencies from Richard Nixon","presidencies","NNS","dobj -> spanned"
"2243","0/1","Rep. <a>XXXX</a> 21 straight races , easily prevailing through wars and economic crises that have spanned presidencies from Richard Nixon to Barack Obama .","David Obey has won","discontent","NN","nsubj -> surging"
"2244","0/1","One recent morning Antonia Antonaccio , a home care aide , got a call to help an elderly couple whose regular aide could not make <a>XXXX</a> .","it","it","PRP","dobj -> make"
"2245","0/1","<a>XXXX</a> , got a call to help an elderly couple whose regular aide could not make it .","One recent morning Antonia Antonaccio , a home care aide","aide","NN","nsubj -> old"
