"Sent Index","Mention Index/Total","Sentence","Mention","Mention Head","Head POS","Label->Gov"
"2","0/1","The secretary of the Army , John M. McHugh , said Wednesday that he was effectively ignoring the `` do n't ask , do n't tell '' law because he had no intention of pursuing discharges of active-duty service members who have recently told <a>XXXX</a> they are gay .","him","him","PRP","dobj -> told"
"4","0/1","<a>XXXX</a> in Vail Square for her welcome-home celebration Wednesday , but it 's doubtful any were as thrilled as the quiet one at the front of the crowd in a wheelchair .","Lindsey Vonn delighted hundreds of children gathered","Nash","NNP","nsubj -> has"
"5","0/1","In the long , rectangular-shaped New York Yankees clubhouse at Steinbrenner Field , players likely to make the team are assigned <a>XXXX</a> on the perimeter .","lockers","lockers","NNS","dobj -> assigned"
"6","0/1","In the long , rectangular-shaped New York Yankees clubhouse at Steinbrenner Field , players likely to make the team are assigned lockers on the perimeter .","","players","NNS","dobj -> making"
"7","0/1","In the long , rectangular-shaped New York Yankees clubhouse <a>XXXX</a> Steinbrenner Field , players likely to make the team are assigned lockers on the perimeter .","at","camp","NN","nsubj -> progresses"
"8","0/1","And the winner , or should we say <a>XXXX</a> , is","the loser","loser","NN","dobj -> say"
"9","0/1","<a>XXXX</a> stood straight as fence posts in their military uniforms , eyes locked on a federal judge perched before a stadium-size American flag .","They","They","PRP","nsubj -> stood"
"11","0/1","Tiger Woods , the world 's biggest sports star , actually was famous before TMZ and other news gossip shows began leading <a>XXXX</a> with the latest of his scandals .","their nightly shows","shows","NNS","dobj -> leading"
"12","0/1","Hispanics and <a>XXXX</a> are having an identity crisis .","Arabs","Arabs","NNPS","nsubj -> having"
"13","0/1","This year , it will take Americans 99 days to render <a>XXXX</a> what is his .","unto Caesar -LRB- pronounced `` Uncle Sam '' -RRB-","Caesar","NNP","dobj -> render"
"14","0/1","Has <a>XXXX</a> ever looked worse doing the right thing ?","anyone","anyone","NN","nsubj -> looked"
"15","0/1","And now <a>XXXX</a> is closed on the 2010 Republican primary for Texas governor .","the book","book","NN","nsubjpass -> closed"
"16","0/1","A judge in Travis County has declined to consider Texas Attorney General Greg Abbott 's request to intervene in the county 's first same-sex divorce case , letting stand the judge 's February decision to grant <a>XXXX</a> to two women who had been married in another state .","a divorce","divorce","NN","dobj -> grant"
"17","0/1","<a>XXXX</a> 's Holy Week , which means it is shopping spree week in San Antonio for many Mexicans .","It","It","PRP","nsubj -> Week"
"18","0/1","Sarah m ` dear , <a>XXXX</a> 's not about the party .","it","it","PRP","nsubj -> party"
"19","0/1","<a>XXXX</a> m ` dear , it 's not about the party .","Sarah","It","PRP","nsubj -> tea"
"20","0/1","Since Tiger Woods already has been tabbed the favorite and needs no more analysis , and Billy Payne 's aim as chairman of Augusta National is to grow <a>XXXX</a> globally , here 's each continent 's best chance to put on the famed Green Jacket that comes with winning the Masters :","the game","game","NN","dobj -> grow"
"21","0/1","<a>XXXX</a> was blowing 15 mph by the time it sluiced through the canyon above Duck Lake .","An 8 mph wind","wind","NN","nsubj -> blowing"
"22","0/1","On that chilly evening in Atlanta in October 1970 when <a>XXXX</a> returned to boxing , nobody knew what to expect .","Muhammad Ali","Ali","NNP","nsubj -> returned"
"23","0/1","<a>XXXX</a> leveled against Ben Roethlisberger will likely be completed minus a second interview with the Steelers quarterback .","The investigation into a sexual assault charge","investigation","NN","nsubj -> leveled"
"24","0/1","<a>XXXX</a> won the National League Central as an underdog last season , surprising Chicago and Milwaukee .","St. Louis","Louis","NNP","nsubj -> won"
"25","0/1","Mighty saguaro cactuses , noble and oddly cartoonish , stood like sentinels on ledges of the cliffs to our left as <a>XXXX</a> hiked around Saguaro Lake .","we","we","PRP","nsubj -> hiked"
"26","0/1","Mighty saguaro cactuses <a>XXXX</a> and oddly cartoonish , stood like sentinels on ledges of the cliffs to our left as we hiked around Saguaro Lake .",", noble","water","NN","nsubj -> glittered"
"27","0/1","<a>XXXX</a> am a habitue of vintage-clothes shops , and while on vacation here recently , I checked out Sherry 's YesterDaze Vintage , a consignment shop in the Seminole Heights neighborhood that a friend had recommended .","I","I","PRP","nsubj -> habitue"
"28","0/1","<a>XXXX</a> am a habitue of vintage-clothes shops , and while on vacation here recently , I checked out Sherry 's YesterDaze Vintage , a consignment shop in the Seminole Heights neighborhood that a friend had recommended .","I","I","PRP","nsubj -> looking"
"31","0/1","I am a habitue of vintage-clothes shops , and while on vacation here recently , I checked out Sherry 's YesterDaze Vintage , a consignment shop in the Seminole Heights neighborhood that a friend had recommended .","","it","PRP","nsubjpass -> wrapped"
"33","0/1","The federal government took <a>XXXX</a> to regulate global warming pollution on Thursday by issuing final rules for greenhouse gas emissions for automobiles and light trucks .","its first formal step","step","NN","dobj -> took"
"34","0/1","Sen. John Kerry met Thursday with President Bashar Assad of Syria in Damascus , another indication that the United States is moving to re-engage with Syria as the Obama administration works to resuscitate <a>XXXX</a> .","Middle East peace talks","talks","NNS","dobj -> resuscitate"
"36","0/1","As a presidential candidate <a>XXXX</a> then-Sen .",",","it","PRP","nsubj -> illegal"
"38","0/1","For centuries , <a>XXXX</a> have continued to hope , doubt , wonder and probe whether the image of Christ was left on the burial cloth in which his body was wrapped on Good Friday , now known as the Shroud of Turin .","the faithful and skeptics","faithful","NN","nsubj -> continued"
"40","0/1","President Dmitri Medvedev , trying to demonstrate the government 's resolve after a spate of terrorist bombings , made <a>XXXX</a> on Thursday to one of the most tumultuous areas of Russia and called for `` harsher '' tactics to combat the insurgency .","a surprise visit","visit","NN","dobj -> made"
"41","0/1","Michael Bauer camped out for the iPhone when <a>XXXX</a> launched nearly three years ago .","Apple 's revolutionary cell phone","phone","NN","nsubj -> launched"
"42","0/1","<a>XXXX</a> continued on Thursday what might be called his Go-for-It Tour , traveling to this Northeastern state -- represented by two moderate Republican senators who balked at his health care overhaul -- to dare the opposition party to run against it this fall .","President Barack Obama","Obama","NNP","nsubj -> continued"
"43","0/1","<a>XXXX</a> continued on Thursday what might be called his Go-for-It Tour , traveling to this Northeastern state -- represented by two moderate Republican senators who balked at his health care overhaul -- to dare the opposition party to run against it this fall .","President Barack Obama","Obama","NNP","nsubj -> continued"
"44","0/1","As a presidential candidate <a>XXXX</a> then-Sen .",",","it","PRP","nsubj -> illegal"
"46","0/1","At 8:30 a.m. Thursday , a <a>XXXX</a> of sunlight shined through one of the arched windows and eerily landed at center court in old Hinkle Fieldhouse .","beam","Hinkle","NNP","nsubjpass -> held"
"48","0/1","Even if the Colorado Avalanche loses again Friday night in regulation , <a>XXXX</a> still will hold the edge for the eighth and final playoff spot in the Western Conference standings .","it","it","PRP","nsubj -> hold"
"49","0/1","Even if the Colorado Avalanche loses again Friday night in regulation , it still will <a>XXXX</a> edge for the eighth and final playoff spot in the Western Conference standings .","hold the","victories","NNS","dobj -> have"
"50","0/1","<a>XXXX</a> prompted a sales surge and touched off an industrywide incentive tussle that drew shoppers into showrooms last month .","Toyota 's offers of subsidized leases and interest-free financing","offers","NNS","nsubj -> touched"
"51","0/1","Hamid Karzai , the Afghan president , delivered extraordinarily harsh criticism Thursday of the Western governments fighting in his country , the United Nations , and the British and American news media , accusing them of perpetrating the fraud that denied <a>XXXX</a> an outright victory in last summer 's presidential elections .","him","him","PRP","iobj -> denied"
"52","0/1","If leaders of the world 's many indebted countries want to see what austerity looks like , <a>XXXX</a> might want to visit this Baltic nation of 3.3 million .","they","they","PRP","nsubj -> want"
"53","0/1","If leaders of the world 's many indebted countries want to see what austerity looks like , they might want to visit <a>XXXX</a> of 3.3 million .","this Baltic nation","nation","NN","dobj -> visit"
"54","0/1","Hamid Karzai , <a>XXXX</a> , delivered extraordinarily harsh criticism Thursday of the Western governments fighting in his country , the United Nations , and the British and American news media , accusing them of perpetrating the fraud that denied him an outright victory in last summer 's presidential elections .","the Afghan president","president","NN","appos -> Karzai"
"55","0/1","Sen. John Ensign sought <a>XXXX</a> in 2008 , and at the same time he urged the company to hire his mistress 's husband , according to people involved in the matter .","financial backing for a troubled Nevada energy company","backing","NN","dobj -> sought"
"56","0/1","Tensions between China and the United States have ebbed significantly in recent days , with the countries now working together to confront Iran over its nuclear ambitions and with the Obama administration backing off <a>XXXX</a> .","a politically charged clash over China 's currency","clash","NN","dobj -> backing"
"57","0/1","<a>XXXX</a> have ebbed significantly in recent days , with the countries now working together to confront Iran over its nuclear ambitions and with the Obama administration backing off a politically charged clash over China 's currency .","Tensions between China and the United States","Tensions","NNS","nsubj -> ebbed"
"58","0/1","Iran may seem an unlikely place to turn for guidance when <a>XXXX</a> comes to putting together a democratic government , but that is exactly what most of Iraq 's political class did immediately after last month 's parliamentary elections .","it","it","PRP","nsubj -> comes"
"60","0/1","When the bank sued Leann Weaver for not paying <a>XXXX</a> , her reaction was typical for someone in that situation .","her credit card balance","balance","NN","dobj -> paying"
"61","0/1","When the bank sued Leann Weaver for not paying <a>XXXX</a> credit card balance , her reaction was typical for someone in that situation .","her","she","PRP","nsubj -> knew"
"62","0/1","When <a>XXXX</a> bank sued Leann Weaver for not paying her credit card balance , her reaction was typical for someone in that situation .","the","she","PRP","nsubj -> defend"
"63","0/1","Iran may seem an unlikely place to turn for guidance when <a>XXXX</a> comes to putting together a democratic government , but that is exactly what most of Iraq 's political class did immediately after last month 's parliamentary elections .","it","it","PRP","nsubj -> putting"
"65","0/1","Last month , John Doerr , one of America 's most celebrated venture capitalists , announced that he would step down from the board of Amazon , <a>XXXX</a> he helped to finance and build .","a company that","company","NN","dobj -> helped"
"66","0/1","Last month , John Doerr , <a>XXXX</a> of America 's most celebrated venture capitalists , announced that he would step down from the board of Amazon , a company that he helped to finance and build .","one","Doerr","NNP","nsubj -> decided"
"69","0/1","The case that has raised questions about the future pope 's <a>XXXX</a> of a pedophile priest in Germany came to light three decades after it occurred , and then almost by chance .","handling","he","PRP","nsubj -> stumbled"
"70","0/1","On one point , everyone here agrees : The high school students who taunted and threatened Phoebe Prince for three months , until she hanged <a>XXXX</a> , deserve to be punished .","herself","herself","PRP","dobj -> hanged"
"71","0/1","Several of Sudan 's biggest opposition parties announced Thursday that <a>XXXX</a> were planning a full boycott of the national elections this month , casting a cloud of uncertainty over Sudan 's first multiparty vote in more than 20 years and complicating the landmark agreement that ended decades of civil war in the country .","they","they","PRP","nsubj -> planning"
"72","0/1","In southern China , the worst drought in at least 50 years has dried up farmers ' fields and left <a>XXXX</a> .","tens of millions of people short of water","tens","NNS","dobj -> left"
"73","0/1","When the bank sued Leann Weaver for not paying <a>XXXX</a> , her reaction was typical for someone in that situation .","her credit card balance","balance","NN","dobj -> paying"
"74","0/1","When the bank sued Leann Weaver for not paying <a>XXXX</a> credit card balance , her reaction was typical for someone in that situation .","her","she","PRP","nsubj -> knew"
"75","0/1","When <a>XXXX</a> bank sued Leann Weaver for not paying her credit card balance , her reaction was typical for someone in that situation .","the","she","PRP","nsubj -> went"
"76","0/1","In southern China , the worst drought in at least 50 years has dried up <a>XXXX</a> and left tens of millions of people short of water .","farmers ' fields","fields","NNS","dobj -> dried"
"78","0/1","For some odd reason , <a>XXXX</a> emerged relatively unscathed earlier this year when a book depicted him as a volatile bully who swears at underlings , destroys office supplies and jabs his pen compulsively into the upholstery of his car in a bad-tempered manner at times of stress .","Prime Minister Gordon Brown","Brown","NNP","nsubj -> emerged"
"79","0/1","The annual hunt for harp seals off the coast of eastern Canada will barely take <a>XXXX</a> this year .","place","place","NN","dobj -> take"
"80","0/1","The annual hunt for harp seals off the coast of eastern Canada will barely take <a>XXXX</a> this year .","place","place","NN","dobj -> take"
"81","0/1","Jennifer Piper was at the Seattle Sculpture Park with her family the other day and <a>XXXX</a> did what art can do : It got her thinking .","the art","art","NN","nsubj -> did"
"82","0/1","Jennifer <a>XXXX</a> the Seattle Sculpture Park with her family the other day and the art did what art can do : It got her thinking .","Piper was at","park","NN","nsubj -> bustling"
"83","0/1","<a>XXXX</a> here emerged six months ago with a call to the Mecklenburg County Department of Social Services .","Warning signs about a family splintered by a grisly murder-suicide","signs","NNS","nsubj -> emerged"
"84","0/1","Warning signs about a family splintered by a grisly murder-suicide <a>XXXX</a> six months ago with a call to the Mecklenburg County Department of Social Services .","here emerged","case","NN","dobj -> open"
"85","0/1","<a>XXXX</a> remains intact even if the knee did not .","The memory","memory","NN","nsubj -> remains"
"86","0/1","A leading House member issued <a>XXXX</a> on Thursday of a former aide who had become an industry lobbyist after working on legislation to overhaul the nation 's financial regulations .","a stern rebuke","rebuke","NN","dobj -> issued"
"87","0/1","<a>XXXX</a> talks about Butler University 's unlikely road to the Final Four .","Everyone","Everyone","NN","nsubj -> talks"
"88","0/1","Everyone talks about Butler <a>XXXX</a> unlikely road to the Final Four .","University 's","trip","NN","nsubj -> journey"
"89","0/1","The Army secretary , <a>XXXX</a> , said Thursday that he had incorrectly stated that there was a moratorium on the discharge of gay members of the military .","John M. McHugh","McHugh","NNP","appos -> secretary"
"90","0/1","In 18 years of Colorado Rockies baseball , has there ever been a sunnier spring ?","","seat","NN","dobj -> find"
"91","0/1","<a>XXXX</a> still gets giddy recalling the day Gordon Hayward committed to play basketball for him nearly three years ago .","Butler University coach Brad Stevens","Stevens","NNP","nsubj -> gets"
"93","0/1","State and local governments will eventually save $ 12.3 billion from bonds issued in the first year of the Build America Bonds program , compared with what they would have spent by issuing <a>XXXX</a> to finance projects , a Treasury Department analysis has found .","traditional tax-exempt bonds","bonds","NNS","dobj -> issuing"
"94","0/1","Hamid Karzai , <a>XXXX</a> , delivered extraordinarily harsh criticism Thursday of the Western governments fighting in his country , the United Nations , and the British and American news media , accusing them of perpetrating the fraud that denied him an outright victory in last summer 's presidential elections .","the Afghan president","president","NN","appos -> Karzai"
"95","0/1","Tensions between China and the United States have ebbed significantly in recent days , with the countries now working together to deter <a>XXXX</a> and with the Obama administration backing off a politically charged clash over China 's currency .","Iran 's nuclear ambitions","ambitions","NNS","dobj -> deter"
"97","0/1","President Barack Obama has signed off on new security protocols for people flying to the United States , establishing a system that uses intelligence information and assessment of threats to identify <a>XXXX</a> could have links to terrorism , a senior administration official said Thursday .","passengers who","passengers","NNS","nsubj -> have"
"98","0/1","It was 75 years ago that <a>XXXX</a> told his chauffeur to pick up a party of soldiers at Hollywood and Highland and take them to ogle homes of Tinseltown 's biggest stars .","movie-house mogul Sid Grauman","Grauman","NNP","nsubj -> told"
"99","0/1","A 10-year-old girl ran out of her home with her 2-year-old brother to waiting <a>XXXX</a> late Monday night .","police officers","officers","NNS","dobj -> waiting"
"100","0/1","A 10-year-old girl ran out of her home with <a>XXXX</a> 2-year-old brother to waiting police officers late Monday night .","her","himself","PRP","dobj -> shot"
"101","0/1","<a>XXXX</a> of her home with her 2-year-old brother to waiting police officers late Monday night .","A 10-year-old girl ran out","adults","NNS","nsubj -> dead"
"102","0/1","It was a high-stakes gamble over one-tenth of a penny , and <a>XXXX</a> wound up costing $ 36 million .","it","it","PRP","nsubj -> wound"
"103","0/1","There 's <a>XXXX</a> in our bedroom -- other than me , I mean .","a real antique","antique","NN","nsubj -> 's"
"104","0/1","<a>XXXX</a> is one of at least 30 governors nationwide to receive a letter warning him to leave office immediately or be removed .","Georgia Gov. Sonny Perdue","Perdue","NNP","nsubj -> one"
"105","0/1","I suppose <a>XXXX</a> should be upset that Austin Mayor Lee Leffingwell wants to close down the Congress Avenue bridge for a bat party , since it 'll bring downtown traffic to its knees .","I","I","PRP","nsubjpass -> upset"
"106","0/1","<a>XXXX</a> has gone mainstream .","The fringe","fringe","NN","nsubj -> gone"
"107","0/1","<a>XXXX</a> won the National League Central as an underdog last season , surprising Chicago and Milwaukee .","St. Louis","Louis","NNP","nsubj -> won"
"108","0/1","<a>XXXX</a> stares back at Jennifer Frazier from her computer screen .","A fraternity brother from Oswego , N.Y. ,","brother","NN","nsubj -> stares"
"109","0/1","<a>XXXX</a> is an endangered species .","Success in America","Success","NN","nsubj -> species"
"111","0/1","<a>XXXX</a> has asked the federal appeals court to reverse a judge 's ruling that declared metro Atlanta can not tap into Lake Lanier for most of its water needs , saying it `` will be devastating to 3 million residents . ''","The state of Georgia","state","NN","nsubj -> asked"
"113","0/1","A new poll released Friday shows that <a>XXXX</a> believe oil and gas drilling should be allowed off the coasts of California and New England .","a majority of people surveyed","majority","NN","nsubj -> believe"
"114","0/1","For weeks , Hollywood has sat in judgment of a last-second decision by Warner Brothers to convert <a>XXXX</a> '' into 3-D after filming was finished .","its two-dimensional `` Clash of the Titans","Clash","NN","dobj -> convert"
"115","0/1","For weeks , Hollywood has sat in judgment of a last-second decision by Warner Brothers to convert its two-dimensional `` Clash of the Titans <a>XXXX</a> into 3-D after filming was finished .","''","people","NNS","nsubj -> skip"
"116","0/1","<a>XXXX</a> eats , breathes and sleeps home improvement .","Joe McFarland","McFarland","NNP","nsubj -> sleeps"
"118","0/1","A federal judge in Denver dealt <a>XXXX</a> this week to the Securities and Exchange Commission 's civil lawsuit against five former Qwest officials , including former chief executive Joe Nacchio .","a blow","blow","NN","dobj -> dealt"
"119","0/1","Residents rebuilding on Bolivar Peninsula after <a>XXXX</a> have been met by stringent codes requiring them to build their homes 20 feet above sea level .","Hurricane Ike","Ike","NNP","nsubjpass -> met"
"120","0/1","Four or five Sundays in 2005 , his own atheism notwithstanding , Dale McGowan took <a>XXXX</a> into the neo-Gothic grandeur of St. Mark 's Episcopal Cathedral in Minneapolis on a kind of skeptic 's field trip .","his family","family","NN","dobj -> took"
"122","0/1","<a>XXXX</a> have always been entwined by more than just their point guard position .","The careers of Joe Mazzulla and Korie Lucious","careers","NNS","nsubjpass -> entwined"
"123","0/1","The careers of Joe Mazzulla and Korie Lucious have always <a>XXXX</a> entwined by more than just their point guard position .","been","they","PRP","nsubj -> save"
"124","0/1","Aviation security experts and industry officials said Friday that new screening protocols for air passengers coming to the United States were a marked improvement over an emergency plan that had required <a>XXXX</a> from 14 countries since the attempted bombing of an airliner on Christmas Day .","extra screening of every passenger","screening","NN","dobj -> required"
"125","0/1","Aviation security experts and <a>XXXX</a> said Friday that new screening protocols for air passengers coming to the United States were a marked improvement over an emergency plan that had required extra screening of every passenger from 14 countries since the attempted bombing of an airliner on Christmas Day .","industry officials","officials","NNS","nsubj -> said"
"126","0/1","The day before Tom Izzo 's first game as Michigan State coach , he had his assistant Tom Crean go to an office supplies store to purchase <a>XXXX</a> on which he could draw the first six plays of the game .","small plastic sheets","sheets","NNS","dobj -> purchase"
"128","0/1","<a>XXXX</a> has a taste for luxury -- Michael Kors gold leather satchel bags , hand-constructed Japanese denim jeans that start at $ 260 and about $ 23,000 worth of designer sunglasses .","He","He","PRP","nsubj -> has"
"129","0/1","Baby-faced , <a>XXXX</a> looks barely a teenager .","she","she","PRP","nsubj -> looks"
"130","0/1","Baby-faced <a>XXXX</a>",", she looks barely a teenager .","pistol","NN","nsubj -> suggests"
"131","0/1","The gray barrier evokes the West Bank or <a>XXXX</a> : a 500-foot-long , 7-foot-high concrete wall that separates a Roma ghetto from the neatly manicured homes of gadzos , or white people , on the other side .","Cold War Berlin","Berlin","NNP","dobj -> evokes"
"132","0/1","The gray barrier evokes the West Bank or Cold War Berlin : a 500-foot-long , 7-foot-high concrete wall that separates <a>XXXX</a> from the neatly manicured homes of gadzos , or white people , on the other side .","a Roma ghetto","ghetto","NN","dobj -> separates"
"134","0/1","Baby-faced , <a>XXXX</a> looks barely a teenager .","she","she","PRP","nsubj -> looks"
"135","0/1","Baby-faced , she looks barely a teenager .","","destiny","NN","dobj -> choose"
"138","0/1","When Duke forwards Mason and <a>XXXX</a> transferred from the public high school in this town of hay bales and basketball hoops , their father , Perky , was treated like a pariah .","Miles Plumlee","Plumlee","NNP","nsubj -> transferred"
"139","0/1","When Duke forwards Mason and <a>XXXX</a> the public high school in this town of hay bales and basketball hoops , their father , Perky , was treated like a pariah .","Miles Plumlee transferred from","cup","NN","dobj -> grab"
"140","0/1","In one of its first steps to carry out the new health care law , the Obama administration announced Friday that <a>XXXX</a> was establishing a temporary insurance pool where uninsured people with medical problems could buy coverage at reduced rates .","it","it","PRP","nsubj -> establishing"
"142","0/1","When Duke forwards Mason and <a>XXXX</a> transferred from the public high school in this town of hay bales and basketball hoops , their father , Perky , was treated like a pariah .","Miles Plumlee","Plumlee","NNP","nsubj -> transferred"
"143","0/1","When Duke forwards Mason and <a>XXXX</a> the public high school in this town of hay bales and basketball hoops , their father , Perky , was treated like a pariah .","Miles Plumlee transferred from","cup","NN","dobj -> grab"
