"Sent Index","Mention Index/Total","Sentence","Mention","Mention Head","Label->Gov"
"758","0/1","But in the struggling industrial cities in western Germany voting in state elections on Sunday , <a>XXXX</a> see themselves as victims of endless demands inside and outside the country for dwindling resources .","they","they","nsubj -> see"
"759","0/1","<a>XXXX</a> sent the pound lower Friday and heightened fears that credit rating agencies , which have been quick to downgrade indebted economies in the euro zone , might do so to Britain .","The prospect of political stalemate after the indecisive British election","prospect","nsubj -> sent"
"760","0/1","A giant steel container meant to capture <a>XXXX</a> was lowered to within 200 feet of the seafloor on Friday afternoon , officials said .","oil leaking into the Gulf of Mexico","oil","dobj -> capture"
"761","0/1","<a>XXXX</a> meant to capture oil leaking into the Gulf of Mexico was lowered to within 200 feet of the seafloor on Friday afternoon , officials said .","A giant steel container","container","nsubj -> capture"
"762","0/1","From the Yankees ' perspective , <a>XXXX</a> came easily .","their decision to skip Andy Pettitte 's next start","decision","nsubj -> came"
"763","0/1","When a 37-year-old pitcher complains of elbow tightness 27 games into what they hope is another championship season , <a>XXXX</a> see no reason to take unnecessary risks .","they","they","nsubj -> see"
"764","0/1","<a>XXXX</a> are taking a similarly cautious approach with Jorge Posada , who was held out of the lineup Friday night for a third consecutive game , and with Mariano Rivera , who had not pitched in a week because of a muscle pull in his rib cage but was expected to be available Friday night .","They","They","nsubj -> taking"
"765","0/1","Given the staid nature of the political establishment in Colombia , Washington 's top ally in the region , and the broad popularity of President Alvaro Uribe , it seemed a foregone conclusion to many here that his heir apparent would clinch <a>XXXX</a> in the coming elections without too much of a struggle .","the presidency","presidency","dobj -> clinch"
"768","0/1","Sen. Lindsey Graham , one of the chief sponsors of a Senate plan to address <a>XXXX</a> , said Friday that the proposal had no chance of passage in the near term and called for a `` pause '' in consideration of the issue .","energy and climate change","change","dobj -> address"
"769","0/1",", said that <a>XXXX</a> had heightened concern about expanded offshore drilling , which he considers a central to energy legislation .","the oil spill in the Gulf of Mexico","spill","nsubj -> heightened"
"770","0/1","Without the support of Graham and at least a handful of Republicans , <a>XXXX</a> is likely dead for the year .","the measure","measure","nsubj -> likely"
"771","0/1","CONTAINMENT EFFORT INCHES CLOSER TO TARGET IN GULF ROBERT , La. -- <a>XXXX</a> meant to capture oil leaking into the Gulf of Mexico was lowered to within 200 feet of the seafloor on Friday afternoon , officials said .","A giant steel container","container","nsubj -> meant"
"772","0/1","It was positioned slightly to the side of where <a>XXXX</a> needed to be placed to capture the gushing crude nearly a mile below the gulf 's surface .","it","it","nsubjpass -> placed"
"773","0/1","Workers operating a crane 5,000 feet above the seafloor were trying to place <a>XXXX</a> to completely cover the leaking pipe with a snug fit to the seabed .","the chamber","chamber","dobj -> place"
"774","0/1","Once the container is in place , <a>XXXX</a> is to beU.S .","it","it","nsubj -> is"
"776","0/1","<a>XXXX</a> banned classical music and sent musicians to re-education camps .","Chinese officials","officials","nsubj -> sent"
"777","0/1","<a>XXXX</a> was destroyed .","Xia 's family collection of more than 1,000 vinyl records","collection","nsubjpass -> destroyed"
"778","0/1","From the Yankees ' perspective , their decision to skip <a>XXXX</a> came easily .","Andy Pettitte 's next start","start","dobj -> skip"
"779","0/1","When a 37-year-old pitcher complains of elbow tightness 27 games into the season , they see <a>XXXX</a> .","no reason to take unnecessary risks","reason","dobj -> see"
"781","0/1","Tiger Woods shot <a>XXXX</a> at the Players Championship on Friday , a one-under 71 to go with his opening 70 , which is better than last week , good enough to make the weekend but a $ 30 cab ride from the leader Lee Westwood 's 36-hole total of 12 under .","his second straight subpar round","round","dobj -> shot"
"782","0/1","Kim Jong-il , the North Korean leader , told officials in Beijing that his government would try to restart talks on ending <a>XXXX</a> reported Friday as Kim wrapped up a five-day trip to China .","its nuclear weapons program , Chinese news media","program","nsubj -> reported"
"783","0/1","Golf has been all abuzz about a youth movement again , especially this week after the fuzzy-cheeked duo of Ryo Ishikawa , 18 , of Japan and Rory McIlroy , 21 , of Northern Ireland shot <a>XXXX</a> to win on the Japan PGA and PGA Tour last week .","record-low rounds","rounds","dobj -> shot"
"784","0/1","But here on Florida 's First Coast , where alligator hide is not always a reference to the primordial-looking reptiles in the water hazards at TPC Sawgrass , <a>XXXX</a> are a bit different .","things","things","nsubj -> different"
"786","0/1","But here on Florida 's First Coast , where <a>XXXX</a> hide is not always a reference to the primordial-looking reptiles in the water hazards at TPC Sawgrass , things are a bit different .","alligator","alligator","nsubj -> hide"
"787","0/1","On April 1 , <a>XXXX</a> approached the starting goalkeeper , Tyler Fiorito , in the locker room before practice .","the Princeton assistant men 's lacrosse coach Greg Raymond","Raymond","nsubj -> approached"
"788","0/1","Raymond informed Fiorito that <a>XXXX</a> was to partake in a prank on the first-year coach Chris Bates by wearing a brace on his left knee .","he","he","nsubj -> was"
"789","0/1","He was told to say that he had injured it while riding <a>XXXX</a> and that he would need an MRI exam to determine whether he could play in the next game against Brown .","a skateboard","skateboard","dobj -> riding"
"790","0/1","Kim Jong-il , <a>XXXX</a> , told officials in Beijing that his government would try to restart talks on ending its nuclear weapons program , Chinese news media reported Friday as Kim wrapped up a five-day trip to China .","the North Korean leader","leader","appos -> Jong-il"
"792","0/1","Sen. Lindsey Graham , one of the chief sponsors of a nascent plan to address energy and climate change in the Senate , said Friday that <a>XXXX</a> had no chance of passage in the near term and called for a `` pause '' in consideration of the issue .","the proposal","proposal","nsubj -> had"
"793","0/1","The Conservatives warned that <a>XXXX</a> could lead to disaster .","it","it","nsubj -> lead"
"794","0/1","And the Labour Party could potentially use <a>XXXX</a> to cling to power for a little while longer .","it","it","nsubj -> cling"
"795","0/1","Driving through some of this city 's neighborhoods is like driving through an alternate , horrifying universe , a place where no one thinks <a>XXXX</a> 's safe to be a child .","it","it","nsubj -> child"
"796","0/1","Leaving the oceanside cliffs of Malibu for the dusty plains of Waco is rather like leaving <a>XXXX</a> to go wander in the desert .","the Garden of Eden","Garden","dobj -> leaving"
"797","0/1","On hearing of his impending move to Texas , one is tempted to ask Kenneth Starr , the former Whitewater prosecutor , if he accidentally bit <a>XXXX</a> .","the wrong apple","apple","dobj -> bit"
"798","0/1","<a>XXXX</a> warned that it could lead to disaster .","The Conservatives","Conservatives","nsubj -> warned"
"799","0/1","And the Labour Party could potentially use <a>XXXX</a> to cling to power for a little while longer .","it","it","dobj -> use"
"801","0/1","Thousands of Burmese pythons , the offspring of former pets , have invaded the Everglades , eating <a>XXXX</a> even alligators .","birds , bunnies ,","birds","dobj -> eating"
"802","0/1","It has gotten so bad that Congress is considering an outright ban on buying or selling <a>XXXX</a> .","nine kinds of giant snakes","kinds","dobj -> selling"
"803","0/1","Torn between helping <a>XXXX</a> and trying not to hurt landlords , the Los Angeles City Council on Friday called for a temporary rent freeze on large rent-controlled apartment buildings .","tenants","tenants","dobj -> helping"
"804","0/1","Devotions to Mom inscribed on the stuffed animals and floral arrangements at Conroy 's Flowers in Canoga Park , Calif. , leave no doubt what special day is approaching -- but manager Keyzar Ali wishes there was more he could do to attract <a>XXXX</a> to buy the tributes .","customers","customers","nsubj -> buy"
"805","0/1","Los Angeles officials agreed Friday with former Mayor Richard Riordan that the city needs to reform <a>XXXX</a> , but disputed his contention that bankruptcy should be part of the process .","its pension system","system","dobj -> reform"
"806","0/1","The Conservatives and Liberal Democrats began intensive talks on Friday to try to fashion an unlikely marriage that would allow them to form <a>XXXX</a> quickly and reassure jittery financial markets after an election that denied any party a clear majority .","a government","government","dobj -> form"
"807","0/1","Nearly 50 miles offshore at the big oil rig floating on a glassy-calm sea , a helicopter landed early on the morning of April 20 , carrying <a>XXXX</a> from BP , the oil company .","four executives","executives","dobj -> carrying"
"808","0/1","The men were visiting the Deepwater Horizon to help honor <a>XXXX</a> .","the crew for its standout safety record","crew","dobj -> honor"
"810","0/1","When Barack Obama stood before an admiring audience at Mile High Stadium here and accepted his presidential nomination 21 months ago , <a>XXXX</a> .","Democratic leaders crowed about turning Colorado into a reliable stronghold","leaders","appos -> nomination"
"811","0/1","<a>XXXX</a> were heartfelt , especially for women of faith , especially so late in life .","The questions","questions","nsubj -> heartfelt"
"812","0/1","Pope Benedict XVI on Saturday accepted the resignation of a German bishop under investigation for sexual abuse , <a>XXXX</a> erupted in the Roman Catholic Church .","the latest high-profile resignation since a sexual abuse crisis","resignation","nsubj -> erupted"
"813","0/1","Pope Benedict XVI on Saturday accepted the resignation of a German bishop under investigation for sexual abuse , <a>XXXX</a> erupted in the Roman Catholic Church .","the latest high-profile resignation since a sexual abuse crisis","resignation","nsubj -> erupted"
"814","0/1","<a>XXXX</a> has been nearly a quarter-century since a former Alaska poet laureate composed a second verse for the Alaska state song , adding lines to celebrate the diverse indigenous people of the Last Frontier .","It","It","nsubj -> quarter-century"
"815","0/1","It has been nearly a quarter-century since a former Alaska poet laureate composed <a>XXXX</a> , adding lines to celebrate the diverse indigenous people of the Last Frontier .","a second verse for the Alaska state song","verse","dobj -> composed"
"816","0/1","In the weeks after the Sept. 11 attacks , the eloquent 30-year-old imam of a mosque outside Washington became a go-to Muslim cleric for reporters scrambling to explain <a>XXXX</a> .","Islam","Islam","dobj -> explain"
"817","0/1","<a>XXXX</a> condemned the mass murder , invited television crews to follow him around and patiently explained the rituals of his religion .","He","He","nsubj -> condemned"
"818","0/1","In the weeks after the Sept. 11 attacks , the eloquent 30-year-old imam of a mosque outside Washington became a go-to Muslim cleric for reporters scrambling to explain <a>XXXX</a> .","Islam","Islam","dobj -> explain"
"819","0/1","He condemned <a>XXXX</a> , invited television crews to follow him around and patiently explained the rituals of his religion .","the mass murder","murder","dobj -> condemned"
"820","0/1","Nearly 3 million overseas and military voters from at least 33 states will be permitted to cast ballots over the Internet in November using <a>XXXX</a> , in part because of new regulations proposed last month by the federal agency that oversees voting .","e-mail or fax","e-mail","dobj -> using"
"821","0/1","Nearly 3 million overseas and <a>XXXX</a> will be permitted to cast ballots over the Internet in November using e-mail or fax , in part because of new regulations proposed last month by the federal agency that oversees voting .","military voters from at least 33 states","voters","nsubjpass -> permitted"
"823","0/1","<a>XXXX</a> crawled out of its mud-splattered cab , sauntered into Peter Rajmenjan 's diner and asked if he had any bush hog for sale .","Gold miners","miners","nsubj -> crawled"
"824","0/1","Talks about forming <a>XXXX</a> resumed on Saturday amid concern that continuing uncertainty would roil world financial markets when they reopen Monday , but the prospects of a deal between the Conservatives and Liberal Democrats by that deadline appeared slim .","a new government","government","dobj -> forming"
"825","0/1","Talks about forming <a>XXXX</a> resumed on Saturday amid concern that continuing uncertainty would roil world financial markets when they reopen Monday , but the prospects of a deal between the Conservatives and Liberal Democrats by that deadline appeared slim .","a new government","government","dobj -> forming"
"826","0/1","Shootings of Afghan civilians by American and NATO convoys and at military checkpoints have spiked sharply this year , surpassing aerial bombings and other attacks as the leading cause of war-related deaths and injuries , <a>XXXX</a> say .","American officials","officials","nsubj -> say"
"827","0/1","Shootings of Afghan civilians by American and NATO convoys and at military checkpoints have spiked sharply this year , surpassing aerial bombings and <a>XXXX</a> as the leading cause of war-related deaths and injuries , American officials say .","other attacks","attacks","dobj -> surpassing"
"828","0/1","A special committee organized by the president of Uganda has recommended that a harsh antihomosexuality bill that has drawn the ire of Western governments be withdrawn from Parliament , <a>XXXX</a> said Saturday .","a senior government official","official","nsubj -> said"
"829","0/1","The Obama administration has delivered new and stiff warnings to Pakistan after the failed Times Square car bombing that <a>XXXX</a> must urgently move against the nexus of Islamic militancy in the country 's lawless tribal regions , American and Pakistani officials said .","it","it","nsubj -> move"
"830","0/1","<a>XXXX</a> has delivered new and stiff warnings to Pakistan after the failed Times Square car bombing that it must urgently move against the nexus of Islamic militancy in the country 's lawless tribal regions , American and Pakistani officials said .","The Obama administration","administration","nsubj -> delivered"
"831","0/1","A golfer on the PGA Tour has <a>XXXX</a> , sometimes a little longer .","40 seconds to play a shot","seconds","dobj -> has"
"832","0/1","If he takes 72 strokes in a five-hour round , that means <a>XXXX</a> has more than four hours to wander between hits .","his mind","mind","nsubj -> has"
"833","0/1","As the eldest daughter among 10 siblings -- and the third-eldest in all -- Mary Kay Henry , the incoming president of the Service Employees International Union , says <a>XXXX</a> was born to be an organizer .","she","she","nsubjpass -> born"
"834","0/1","As the eldest daughter among 10 siblings -- and the third-eldest in all -- Mary Kay Henry , the incoming president of the Service Employees International Union , says <a>XXXX</a> was born to be an organizer .","she","she","nsubj -> organizer"
"835","0/1","Two years ago , feisty Republicans commandeered the darkened House chamber during the summer recess to loudly demand that <a>XXXX</a> be allowed to `` drill here and drill now . ''","oil companies","companies","nsubj -> drill"
"836","0/1","Two years ago , feisty Republicans commandeered the darkened House chamber during the summer recess to loudly demand that <a>XXXX</a> be allowed to `` drill here and drill now . ''","oil companies","companies","nsubj -> drill"
"837","0/1","<a>XXXX</a> marched two by two onto the field , sticks held with purpose for the final home game of the season .","The Oneonta men 's lacrosse team","team","nsubj -> marched"
"838","0/1","Beneath their helmets , the players flashed hard looks and <a>XXXX</a> smeared with eye black .","cheeks","cheeks","dobj -> flashed"
"839","0/1","In grander times , <a>XXXX</a> would have given his word , and that would have been a virtual guarantee .","David Ortiz","Ortiz","nsubj -> given"
"840","0/1","The young female fan , taking <a>XXXX</a> on the field with the player she endearingly called Papi , had to settle for a declaration of hope .","her photo","photo","dobj -> taking"
"841","0/1","<a>XXXX</a> begins with the death of Crispin Salvador , an expatriate Filipino author living in New York , whose body is found floating in the Hudson River .","The story","story","nsubj -> begins"
"842","0/1","<a>XXXX</a> had been scathingly critical of his home country before his mysterious demise .","He","He","nsubj -> critical"
"843","0/1","<a>XXXX</a> begins with the death of Crispin Salvador , an expatriate Filipino author living in New York , whose body is found floating in the Hudson River .","The story","story","nsubj -> begins"
"844","0/1","<a>XXXX</a> had been scathingly critical of his home country before his mysterious demise .","He","He","nsubj -> critical"
"845","0/1","The kind of bungee jump that stocks took Thursday , plunging abruptly before snapping partway back in a brief frenzy of electronic trading , has worried federal regulators and <a>XXXX</a> for some time .","market operators","operators","dobj -> worried"
"846","0/1","Despite a surprising consensus about what needs to be done , they have not shown much urgency in rewriting the rules governing an increasingly fragmented , and computerized , trading system.That appears likely to change after the wild , record-setting ride that briefly sent <a>XXXX</a> spinning out of control .","the market","market","nsubj -> spinning"
"847","0/1","President Barack Obama and lawmakers called for action , and <a>XXXX</a> promised to deliver , even as they struggled to understand the origins and particulars of Thursday 's chaos .","regulators at agencies including the Securities and Exchange Commission","regulators","nsubj -> promised"
"848","0/1","Defense Secretary Robert Gates challenged some sacrosanct Pentagon spending practices in a speech on Saturday , directing both military and civilian officials to find cuts in their overhead and operating costs and then transfer <a>XXXX</a> to the fighting force .","the savings","savings","dobj -> transfer"
"849","0/1","Defense Secretary Robert Gates challenged <a>XXXX</a> in a speech on Saturday , directing both military and civilian officials to find cuts in their overhead and operating costs and then transfer the savings to the fighting force .","some sacrosanct Pentagon spending practices","practices","dobj -> challenged"
"850","0/1","Last month in Germany , a 45-year-old Bavarian man followed the directions of his GPS device onto the wrong end of a highway off-ramp near the city of Osnabruck , in what the newspaper Die Welt called <a>XXXX</a> .","a case of `` blind trust '' in his gadget","case","dobj -> called"
"851","0/1","<a>XXXX</a> raced through Europe , and finally shook the stock market in the United States is now affecting the broader global economy , from the ability of Asian corporations to raise money to the outlook for money-market funds where American savers park their cash .","The fear that began in Athens ,","fear","nsubj -> raced"
"852","0/1","There was <a>XXXX</a> and giggling in the screening of `` Babies '' that I attended -- and it was n't just from the females in the audience .","an awful lot of oohing and aahing","lot","nsubj -> was"
"853","0/1","That 's probably happening today , too , as <a>XXXX</a> are being treated to a showing on Mother 's Day .","mothers","mothers","nsubjpass -> treated"
"854","0/1","She 's played princesses -- twice , but `` sadly <a>XXXX</a> both died young . ''","they","they","nsubj -> died"
"855","0/1","When President Barack Obama decided last year to narrow the scope of the nine-year war in Afghanistan and Pakistan , he and his aides settled on a formulation that sounded simple : Eviscerate al-Qaida , but just `` degrade '' <a>XXXX</a> , reversing that movement 's momentum .","the Taliban","Taliban","dobj -> degrade"
"856","0/1","When <a>XXXX</a> decided last year to narrow the scope of the nine-year war in Afghanistan and Pakistan , he and his aides settled on a formulation that sounded simple : Eviscerate al-Qaida , but just `` degrade '' the Taliban , reversing that movement 's momentum .","President Barack Obama","Obama","nsubj -> narrow"
"857","0/1","Sen. Robert F. Bennett , <a>XXXX</a> had been seeking a fourth term , was stripped of his party 's nomination on Saturday at the state convention here , becoming one of the first congressional victims of the surging discontent from the Tea Party-infused Republican right .","an 18-year veteran Republican who","Republican","nsubj -> seeking"
"858","0/1","Talks about forming a new government resumed on Saturday amid concern that continuing uncertainty would shake world financial markets when <a>XXXX</a> reopen Monday , but the prospects of a deal between the Conservatives and Liberal Democrats by that deadline appeared slim .","they","they","nsubj -> reopen"
"860","0/1","The latest effort to contain the oil spill that has poured millions of gallons of crude into the Gulf of Mexico has encountered a setback 5,000 feet underwater , officials said Saturday , meaning <a>XXXX</a> will continue gushing into the ocean for at least several more days , and possibly months .","oil","oil","nsubj -> continue"
"861","0/1","The latest effort to contain the oil spill that has poured millions of gallons of crude into the Gulf of Mexico has encountered a setback 5,000 feet underwater , <a>XXXX</a> said Saturday , meaning oil will continue gushing into the ocean for at least several more days , and possibly months .","officials","officials","nsubj -> said"
"862","0/1","When <a>XXXX</a> was going down Saturday , it looked as if Lee Westwood was sinking with it .","the sun","sun","nsubj -> going"
"863","0/1","With his golf ball atop a storm drain in the woods right of the 18th fairway -- a seeming portent of the direction his luck and lead might be heading -- Westwood came up with the kind of shot that reverses <a>XXXX</a> and wins big tournaments like the Players Championship .","trends","trends","dobj -> reverses"
"864","0/1","One streak ended for Phil Mickelson in the third round of the Players Championship on Saturday when his 12-foot par putt on No. 18 slid <a>XXXX</a> .","2 feet past the hole","feet","dobj -> slid"
"865","0/1","As the eldest daughter among 10 siblings -- and the third-eldest in all -- Mary Kay Henry , the new president of the Service Employees International Union , says <a>XXXX</a> was born to be an organizer .","she","she","nsubjpass -> born"
"866","0/1","In grander times , David Ortiz would have given <a>XXXX</a> , and that would have been a virtual guarantee .","his word","word","dobj -> given"
"867","0/1","The young female fan , taking her photo on the field with the player <a>XXXX</a> endearingly called Papi , had to settle for a declaration of hope .","she","she","nsubj -> called"
"868","0/1","A terrorist tried to bomb New York , Nashville nearly drowned , a huge oil slick continues to gush toward the Gulf Coast and Wall Street gave <a>XXXX</a> a heart attack as millions of Americans once again watched their 401 -LRB- k -RRB- s do the loop-the-loop .","everyone","everyone","iobj -> gave"
"869","0/1","<a>XXXX</a> seldom look back in this business because we 're so focused on tomorrow .","We","We","nsubj -> look"
"871","0/1","Less than <a>XXXX</a> might think , say psychology and investment experts who have studied financial frauds .","you","you","nsubj -> think"
"873","0/1","<a>XXXX</a> was lucky .","George Mason High School teacher Kent Foster","Foster","nsubj -> lucky"
"874","0/1","<a>XXXX</a> returned from Paris just days before a volcanic ash cloud disrupted international travel .","He and his French class","He","nsubj -> returned"
"876","0/1","Energy industry lobbyists and their allies in Washington have molded <a>XXXX</a> over two decades in ways that may have ultimately proven costly in lives as well as environmental and economic damage .","federal laws and regulations","laws","dobj -> molded"
"877","0/1","<a>XXXX</a> are adults with children and responsibilities of their own .","My children","children","nsubj -> adults"
"878","0/1","I have had wonderful Mother 's Days with both of my children , and <a>XXXX</a> have had some that made me welcome the setting sun .","I","I","nsubj -> had"
"879","0/1","To many people , the notion of living without oil -- at least oil in the various forms sloshing around in their cars and SUVs -- is a scratchy-shirt , <a>XXXX</a> .","nuts-and-twigs kind of idea","kind","appos -> scratchy-shirt"
"880","0/1","But with electric vehicles of various degrees -- pure battery , hybrids and plug-in hybrids -- on the way from major automakers , <a>XXXX</a> will be finding out how scratchy that shirt might be .","more drivers","drivers","nsubj -> finding"
