"Sent Index","Mention Index/Total","Sentence","Mention","Mention Head","Label->Gov"
"2388","0/1","That had <a>XXXX</a> in this city grumbling about the weirdness of a daytime playoff game , especially one as important as Game 4 of the Eastern Conference final .","everyone","everyone","dobj -> had"
"2389","0/1","A chandelier in a second-story window on East 66th Street goes dark , and <a>XXXX</a> steps out of his town house .","the lawyer","lawyer","nsubj -> steps"
"2390","0/1","<a>XXXX</a> walks toward Park Avenue and settles into an unhurried amble for nine blocks , clutching a black briefcase whose color matches his combed-back hair .","He","He","nsubj -> walks"
"2391","0/1","<a>XXXX</a> passes doormen , tourists , dog-walking ladies , joggers .","He","He","nsubj -> passes"
"2392","0/1","His hunched shoulders and slight limp suggest a laborer joylessly shuffling toward the morning whistle -- except <a>XXXX</a> is 6:30 p.m. and he is wearing French cuffs .","it","it","nsubj -> p.m."
"2393","0/1","In the postcards of the mind , <a>XXXX</a> is the starkest of all the images of Kandahar , dating back more than 20 years to the period immediately after Soviet troops withdrew from the city , and standing ever since as a grim warning of the folly of foreign military adventures in Afghanistan : hundreds of acres of rubble , whole quarters of the city reduced to fields of blasted concrete and steel , and further out , in the poorer districts , a shattered chocolate-box of a landscape formed by ragged mud walls that had once been home to tens of thousands of people seeking refuge from the war raging in the Afghan hinterland .","it","it","nsubj -> starkest"
"2394","0/1","Pieces of NASCAR 's past have been scattered for decades in garages , ubiquitous racing halls of fame and team museums serving as unofficial historians for a sport that lacked <a>XXXX</a> .","a home","home","dobj -> lacked"
"2395","0/1","If <a>XXXX</a> relocates its tournament to the suburbs of Paris , will the world 's top tennis players find Mickey Mouse across the net ?","the French Tennis Federation","Federation","nsubj -> relocates"
"2396","0/1","If the French Tennis Federation relocates <a>XXXX</a> to the suburbs of Paris , will the world 's top tennis players find Mickey Mouse across the net ?","its tournament","tournament","dobj -> relocates"
"2397","0/1","It was night in England on Jan. 12 , just before his bedtime , when Jozy Altidore began to get the troubling news that an earthquake had struck <a>XXXX</a> , birthplace of his parents , home to more than two dozen relatives .","Haiti","Haiti","dobj -> struck"
"2399","0/1","The statue is burnished , but <a>XXXX</a> is off his tournament .","the shine","shine","nsubj -> tournament"
"2400","0/1","<a>XXXX</a> may not recognize Jane Lynch in `` Shrek Forever After . ''","You","You","nsubj -> recognize"
"2401","0/1","Insurgents assaulted Kandahar Air Base , the main military base in southern Afghanistan , on Saturday night , <a>XXXX</a> said , in the second attack on a major base in a week .","military officials","officials","nsubj -> said"
"2403","0/1","As a vice presidential hopeful two years ago , Sarah Palin drew passion and <a>XXXX</a> from the Republican base even before there was a Tea Party movement .","loyalty","loyalty","dobj -> drew"
"2406","0/1","An unmistakable quarterback controversy has started to percolate at Denver Broncos headquarters , and <a>XXXX</a> may be the only one capable of calming the waters .","incumbent Kyle Orton","Orton","nsubj -> capable"
"2407","0/1","What did <a>XXXX</a> teach us about the 2010 political landscape ?","Tuesday 's rousing round of elections","round","nsubj -> teach"
"2408","0/1","Congressional hearings about the Deepwater Horizon disaster may be the only thing spreading more quickly than oil in the Gulf of Mexico , as lawmakers clamor to grill corporate executives and castigate federal officials who regulate <a>XXXX</a> .","offshore drilling","drilling","dobj -> regulate"
"2409","0/1","Rice University doctoral candidate Laurie Carrillo flew here on her own dime to stump for NASA , one of nearly 150 students and other unpaid citizens who have taken up the call to save <a>XXXX</a> by knocking on the doors of Capitol Hill .","space agency programs","programs","dobj -> save"
"2410","0/1","<a>XXXX</a> have been watching the improvement of Korean automakers with some concern .","Automakers from Japan and Detroit","Automakers","nsubj -> watching"
"2411","0/1","But here 's a bit of cheery news for the worried competition : <a>XXXX</a> is n't perfect .","the new Kia Sorento","Sorento","nsubj -> perfect"
"2412","0/1","For decades , <a>XXXX</a> had one of the cushiest gigs in Hollywood .","movie producers","producers","nsubj -> had"
"2413","0/1","Studios kept stables of them around -- <a>XXXX</a> paid -- to shepherd movies through their various stages : inception , the nitty gritty of filming , post-production and publicity .","all expenses","expenses","nsubj -> paid"
"2414","0/1","The Afghan government and <a>XXXX</a> of the Taliban denied on Saturday any connection to reported peace talks on a Maldives island and said the gathering would not lead to anything substantive .","representatives","representatives","nsubj -> denied"
"2415","0/1","<a>XXXX</a> denied on Saturday any connection to reported peace talks on a Maldives island and said the gathering would not lead to anything substantive .","The Afghan government and representatives of the Taliban","government","nsubj -> denied"
"2416","0/1","With her trademark plain talk and pitch that brings roomfuls of loyalists to their feet , former vice presidential candidate <a>XXXX</a> implored 3,500 people at the University of Denver on Saturday to `` wake up '' because , she said , `` I can see November from my house . ''","Sarah Palin","Palin","nsubj -> implored"
"2418","0/1","Helena Aguiar had come all the way from Sao Paulo , Brazil , for a front-row seat to see her favorite band , and she got <a>XXXX</a> : a black metal folding chair with a gold and cherry-red Bon Jovi logo on the cushion , hers to take home .","it","it","dobj -> got"
"2420","0/1","Hours after news broke that <a>XXXX</a> was in trouble , Interior Secretary Ken Salazar ordered a team of top aides to the Gulf Coast with instructions to call him hourly with updates from the scene .","the offshore rig Deepwater Horizon","Horizon","nsubj -> trouble"
"2421","0/1","<a>XXXX</a> had just returned to his Florida home from a trip to Colorado when a telephone caller told him of a new course that he just had to see -- in suburban Denver .","Kerry Haigh","Haigh","nsubj -> returned"
"2422","0/1","Although <a>XXXX</a> was far from fortuitous , the director of tournaments for the PGA of America was intrigued enough to make a return trip west a month or so later .","the timing","timing","nsubj -> fortuitous"
"2423","0/1","The obsessive urge to get airborne unites <a>XXXX</a> in `` Take Flight , '' an ambitious concept musical about the pioneering spirits of American aviation making its U.S. premiere at the McCarter Theater Center here .","the singing dreamers","dreamers","dobj -> unites"
"2424","0/1","When they escaped this moribund village in southern Mexico nine years ago , <a>XXXX</a> were newly married , looking for factory jobs on the border with West Texas and determined to forge a future in their country 's frenetic industrial frontier .","they","they","nsubjpass -> married"
"2425","0/1","<a>XXXX</a> hold in their hands a powerful therapy for many diseases .","Scientists","Scientists","nsubj -> hold"
"2426","0/1","Weaknesses in the Spanish financial sector were exposed over the weekend when <a>XXXX</a> was forced to rescue CajaSur , a savings bank crippled by property-related losses and unable to agree on a merger with a bigger rival .","the central bank","bank","nsubj -> rescue"
"2427","0/1","On Sunday evening the 63rd Cannes Film Festival came to a shocking , exhilarating close with <a>XXXX</a> going to `` Uncle Boonmee Who Can Recall His Past Lives '' from the Thai filmmaker Apichatpong Weerasethakul .","the Palme d'Or","d'Or","nsubj -> going"
"2428","0/1","Surely the only Palme winner to feature <a>XXXX</a> , `` Boonmee '' is a fantastical tale about a dying man whose past lives -- and ghostly relatives -- enraptured some critics while turning others off .","sex between a princess and a thrashing catfish","sex","dobj -> feature"
"2429","0/1","The speculation that it might appeal to the jury president , <a>XXXX</a> , along with some of his more discerning fellow jury members , proved true .","Tim Burton","Burton","appos -> president"
"2430","0/1","Fully half of the United States is now watching television in high definition , the fastest adoption of TV technology since the VCR hit <a>XXXX</a> in the 1980s .","store shelves","shelves","dobj -> hit"
"2431","0/1","Fully half of the United States is now watching <a>XXXX</a> in high definition , the fastest adoption of TV technology since the VCR hit store shelves in the 1980s .","television","television","dobj -> watching"
"2432","0/1","The United States began pressing China on Sunday to back punitive measures against North Korea for its sinking of a South Korean warship , but <a>XXXX</a> acknowledged that the Chinese were reluctant to discipline their isolated neighbor .","American officials","officials","nsubj -> acknowledged"
"2434","0/1","`` Thank you for giving us <a>XXXX</a> this train !","stupid buffaloes","buffaloes","dobj -> giving"
"2435","0/1","shouted a young man , holding <a>XXXX</a> with an imaginary connection to the prime minister .","an imaginary telephone","telephone","dobj -> holding"
"2436","0/1","`` Thank you for giving <a>XXXX</a> stupid buffaloes this train !","us","us","iobj -> giving"
"2437","0/1","Reneging on a prominent campaign promise , Prime Minister Yukio Hatoyama told outraged residents of Okinawa on Sunday that <a>XXXX</a> would be moved only to the north side of the island rather than off the island .","an American air base","base","nsubjpass -> moved"
"2438","0/1","Able-bodied , outgoing and accustomed to working , Alexandria Wallace wants to earn <a>XXXX</a> .","a paycheck","paycheck","dobj -> earn"
"2439","0/1","But that requires someone to look after her 3-year-old daughter , and <a>XXXX</a> can not afford child care .","Wallace , a 22-year-old single mother ,","Wallace","nsubj -> afford"
"2440","0/1","Able-bodied , outgoing and accustomed to working , <a>XXXX</a> wants to earn a paycheck .","Alexandria Wallace","Wallace","nsubj -> wants"
"2441","0/1","But that requires someone to look after her 3-year-old daughter , and Wallace , a 22-year-old single mother , can not afford <a>XXXX</a> .","child care","care","dobj -> afford"
"2442","0/1","As Israel embarked on a large-scale civil defense exercise on Sunday , Prime Minister Benjamin Netanyahu sought to reassure Israelis and <a>XXXX</a> that the nationwide drill was not meant to signal a deterioration in security or an imminent war .","some jittery Arab neighbors","neighbors","dobj -> reassure"
"2443","0/1","Reneging on a prominent campaign promise , Prime Minister Yukio Hatoyama told outraged residents of Okinawa on Sunday that <a>XXXX</a> would be moved only to the north side of the island rather than off the island .","an American air base","base","nsubjpass -> moved"
"2444","0/1","As Israel embarked on a large-scale civil defense exercise on Sunday , Prime Minister Benjamin Netanyahu sought to reassure Israelis and some jittery Arab neighbors that <a>XXXX</a> was not meant to signal a deterioration in security or an imminent war .","the nationwide drill","drill","nsubjpass -> meant"
"2445","0/1","The United States began pressing <a>XXXX</a> on Sunday to back punitive measures against North Korea for its sinking of a South Korean warship , but American officials acknowledged that the Chinese were reluctant to discipline their isolated neighbor .","China","China","dobj -> pressing"
"2446","0/1","The speaker of Iran 's parliament said Sunday that his country would abandon a deal to ship some of its nuclear fuel to Turkey and rethink its cooperation with the International Atomic Energy Agency if <a>XXXX</a> pushes new sanctions through the United Nations Security Council .","the United States","States","nsubj -> pushes"
"2448","0/1","The young Taliban prisoner was led blindfolded to a sweltering military tent , seated among 17 village elders and then , <a>XXXX</a> uncovered , faced a chief accuser brandishing a document with the elders ' signatures or thumbprints .","eyes","eyes","nsubj -> uncovered"
"2453","0/1","In the days since President Barack Obama announced a moratorium on permits for drilling new offshore wells and a halt to a controversial type of environmental waiver that was given to the Deepwater Horizon , at least seven new drilling permits and <a>XXXX</a> have been granted , according to records .","five waivers","waivers","nsubjpass -> granted"
"2454","0/1","In the best of times , Chinese foreign affairs scholars here say , <a>XXXX</a> grits its teeth while playing best friend to Kim Jong Il , North Korea 's ailing and erratic 68-year-old leader .","Beijing","Beijing","nsubj -> grits"
"2455","0/1","South Korea 's charge last week that North Korea sank one of its warships , killing 46 crewmen , makes that <a>XXXX</a> exponentially harder .","role","role","nsubj -> harder"
"2456","0/1","The authorities in Rio de Janeiro said Sunday that they had arrested a Polish priest and charged him with sexually abusing <a>XXXX</a> .","a 16-year-old former altar boy","boy","dobj -> abusing"
"2457","0/1","The authorities in Rio de Janeiro said Sunday that they had arrested a Polish priest and charged <a>XXXX</a> with sexually abusing a 16-year-old former altar boy .","him","him","dobj -> charged"
"2458","0/1","Louisiana state and local officials continued to hammer BP and the federal agencies responding to the Gulf of Mexico oil spill on Sunday , repeatedly threatening to `` take matters into our own hands '' if <a>XXXX</a> fell short .","the response","response","nsubj -> fell"
"2459","0/1","It was here , in this blue-collar town of frame houses and good-natured biker bars , that Jerry Ralph Kane Jr. began his fight against what <a>XXXX</a> regarded as the illegitimate for-profit corporations he believed had usurped the government .","he","he","nsubj -> regarded"
"2460","0/1","The Jamaican government declared a state of emergency in portions of Kingston , the capital , on Sunday after supporters of a gang leader who is wanted in the United States on gun and drug charges attacked <a>XXXX</a> in an attempt to pressure the government to let him remain free , officials said .","three police stations","stations","dobj -> attacked"
"2461","0/1","<a>XXXX</a> declared a state of emergency in portions of Kingston , the capital , on Sunday after supporters of a gang leader who is wanted in the United States on gun and drug charges attacked three police stations in an attempt to pressure the government to let him remain free , officials said .","The Jamaican government","government","nsubj -> declared"
"2462","0/1","In less than three weeks , 32 soccer teams from around the world will square off for the chance to lift <a>XXXX</a> in South Africa .","the World Cup trophy","trophy","dobj -> lift"
"2463","0/1","As <a>XXXX</a> continues to widen , now comes Sun Young Yoo , a 23-year-old from Seoul who arrived here in the middle of last week with a goal of staying two days and departed Sunday evening with $ 375,000 and an ample Tiffany crystal trophy .","the torrent of South Korean golfers","torrent","nsubj -> continues"
"2464","0/1","<a>XXXX</a> went to the polls Sunday to choose a new parliament , with Prime Minister Meles Zenawi 's ruling party expected to sweep the vote and extend its 19-year rule , after a campaign marred by widespread complaints of harassment and intimidation of the opposition .","Ethiopians","Ethiopians","nsubj -> went"
"2465","0/1","Most of the first-day drama at the French Open lasted <a>XXXX</a> on Sunday morning , then reappeared briefly as the long shadows blanketed Court Philippe Chatrier .","about 15 minutes","minutes","dobj -> lasted"
"2467","0/1","Orlando 's <a>XXXX</a> sat at the postgame podium with his arms in front of him and his voice hoarse as Orlando 's spokesman on all things gone wrong .","Dwight Howard","Howard","nsubj -> sat"
"2469","0/1","When Tim Howard was 6 or 8 , <a>XXXX</a> was already being MapQuested by a coach who perhaps did not know about tactics but did understand proportion .","his career path","path","nsubjpass -> MapQuested"
"2470","0/1","<a>XXXX</a> was being bent like a flagstick in a stiff breeze .","The 16-year-old golfer 's ear","ear","nsubjpass -> bent"
"2471","0/1","He had achieved so much so quickly that <a>XXXX</a> were urging him to turn professional .","many people","people","nsubj -> urging"
"2472","0/1","At least 14 people were killed and more than 25 were wounded Sunday in heavy fighting between government troops and <a>XXXX</a> who attacked the presidential palace with mortars , witnesses and officials said .","insurgents","insurgents","nsubj -> attacked"
"2473","0/1","In a newly released video , Anwar al-Awlaki , the Muslim cleric believed to be an inspiration for a series of recent terrorism plots , justifies the mass killing of American civilians and taunts the authorities to come find <a>XXXX</a> in Yemen .","him","him","dobj -> find"
"2474","0/1","Sarah Ferguson , <a>XXXX</a> , has been in many mortifying positions in her many years in the public eye .","the Duchess of York and the queen 's former daughter-in-law","Duchess","appos -> Ferguson"
"2475","0/1","But <a>XXXX</a> may have surpassed even the occasion in 1992 when a tabloid newspaper published photographs of her sunbathing topless while having her feet kissed by a Texas businessman -LRB- who was not her husband -RRB- .","the latest one","one","nsubj -> surpassed"
"2476","0/1","Sarah Ferguson , <a>XXXX</a> , has been in many mortifying positions in her many years in the public eye .","the Duchess of York and the queen 's former daughter-in-law","Duchess","appos -> Ferguson"
"2477","0/1","But the latest one may have surpassed even the occasion in 1992 when <a>XXXX</a> published photographs of her sunbathing topless while having her feet kissed by a Texas businessman -LRB- who was not her husband -RRB- .","a tabloid newspaper","newspaper","nsubj -> photographs"
"2478","0/1","After four days of chaos in cycling , spurred by the Floyd Landis ' admission of doping and his allegations against other top riders , <a>XXXX</a> celebrated .","one team at Sunday 's Tour of California","team","nsubj -> celebrated"
"2479","0/1","About one-third of employers subject to major requirements of the new health care law may face tax penalties because <a>XXXX</a> offer health insurance that could be considered unaffordable to some employees , a new study says .","they","they","nsubj -> offer"
"2480","0/1","About one-third of employers subject to major requirements of the new health care law may face tax penalties because <a>XXXX</a> offer health insurance that could be considered unaffordable to some employees , a new study says .","they","they","nsubj -> offer"
"2481","0/1","Stepping quickly toward his big black Dodge Ram truck , <a>XXXX</a> offered a few highlights of the weekend ahead .","Todd Palin","Palin","nsubj -> offered"
"2482","0/1","It was here , in this blue-collar town of frame houses and good-natured biker bars , that Jerry Ralph Kane Jr. began his fight against what <a>XXXX</a> regarded as the illegitimate corporations he believed had usurped the government .","he","he","nsubj -> regarded"
"2483","0/1","As <a>XXXX</a> continues to widen , now comes Sun Young Yoo , a 23-year-old from Seoul who arrived here in the middle of last week with a goal of staying two days and departed Sunday evening with $ 375,000 and an ample Tiffany crystal trophy .","the torrent of South Korean golfers","torrent","nsubj -> continues"
"2485","0/1","His rebounding , <a>XXXX</a> , even at times his sleek goggles .","his assertiveness","assertiveness","appos -> rebounding"
"2486","0/1","If there was a little extra heat in the Arizona desert last week , it was all absorbed by Stoudemire , the Phoenix Suns ' bespectacled , <a>XXXX</a> .","bewildering big man","man","appos -> Stoudemire"
"2488","0/1","President Lee Myung-bak said on Monday that South Korea would cut nearly all trade with North Korea , deny North Korean merchant ships use of South Korean sea lanes and ask <a>XXXX</a> to punish the North for what he called the deliberate sinking of a South Korean warship two months ago .","the U.N. Security Council","Council","nsubj -> punish"
"2489","0/1","Tensions escalated sharply Monday on the Korean peninsula , as South Korean President Lee Myung-bak said on Monday that his nation would cut nearly all trade with North Korea , deny North Korean merchant ships use of South Korean sea lanes and ask the U.N. Security Council to punish the North for what <a>XXXX</a> called the deliberate sinking of a South Korean warship two months ago .","he","he","nsubj -> called"
"2490","0/1","Tensions escalated sharply Monday on the Korean Peninsula as the South Korean president , Lee Myung-bak , said that his nation would sever nearly all trade with North Korea , deny North Korean merchant ships use of South Korean sea lanes and ask <a>XXXX</a> to punish the North for what he called the deliberate sinking of a South Korean warship two months ago .","the U.N. Security Council","Council","nsubj -> punish"
"2492","0/1","Tensions escalated sharply Monday on the Korean Peninsula as the South Korean president , Lee Myung-bak , said that his nation would sever nearly all trade with North Korea , deny <a>XXXX</a> and ask the U.N. Security Council to punish the North for what he called the deliberate sinking of a South Korean warship two months ago .","North Korean merchant ships use of South Korean sea lanes","ships","dobj -> deny"
"2494","0/1","There are no words on the cover of `` Renoir : His Life , Art and Letters '' <a>XXXX</a> , but none are necessary .","-LRB- Abrams -RRB-","Abrams","appos -> Renoir"
"2495","0/1","<a>XXXX</a> 've had people try to break into my computer .","I","I","nsubj -> had"
"2497","0/1","During the course of 20 years , familiarity might have lulled the casual viewer into forgetting that `` <a>XXXX</a> '' broke ground on several television fronts .","Law & Order","Law","nsubj -> broke"
"2498","0/1","Coca-Cola 's shareholder meeting at the cavernous Gwinnett Center in Duluth , <a>XXXX</a> , was wrapping up last month when John Evans rose from his seat in the audience after CEO Muhtar Kent asked for questions .","Ga.","Ga.","appos -> Duluth"
"2499","0/1","A citizen oversight panel issued a report critical of the Atlanta Police Department on Monday , citing police for a variety of problems , including inexplicable delays in the interviewing of witnesses and failure to punish <a>XXXX</a> .","officers who break rules","officers","dobj -> punish"
"2501","0/1","<a>XXXX</a> 're both high-profile members of their teams and they both found themselves in trying situations last week .","They","They","nsubj -> members"
"2504","0/1","A history teacher in Dahlonega , Ga. , was placed on administrative leave Monday after she let four students wear <a>XXXX</a> in a historical reenactment .","Ku Klux Klan outfits","outfits","dobj -> wear"
"2505","0/1","Walking across the campus of Montana State University here , <a>XXXX</a> says the blanket of snow draped over the mountains around town contains a surprise .","David Sands , a plant pathologist ,","Sands","nsubj -> says"
"2506","0/1","Walking across the campus of Montana State University here , David Sands , a plant pathologist , says <a>XXXX</a> contains a surprise .","the blanket of snow draped over the mountains around town","blanket","nsubj -> contains"
"2507","0/1","<a>XXXX</a> hoists materials to the skeletal third floor of a revolutionary research facility under construction on the University of Colorado 's east campus .","A crane","crane","nsubj -> hoists"
"2508","0/1","Despite turmoil in the economy and high unemployment , <a>XXXX</a> fell significantly across the United States in 2009 , according to a report released by the FBI on Monday .","crime rates","rates","nsubj -> fell"
"2509","0/1","Exploiting a political crisis , Malagasy timber barons are robbing this island nation of its sylvan heritage , illegally cutting down <a>XXXX</a> in poorly protected national parks and exporting most of the valuable logs to China .","scarce species of rosewood trees","species","dobj -> cutting"
"2510","0/1","Exploiting a political crisis , <a>XXXX</a> are robbing this island nation of its sylvan heritage , illegally cutting down scarce species of rosewood trees in poorly protected national parks and exporting most of the valuable logs to China .","Malagasy timber barons","barons","appos -> crisis"
"2511","0/1","Prime Minister Manmohan Singh said Monday that India must reach 10 percent annual economic growth and improve relations with Pakistan if it wants to reduce poverty and make <a>XXXX</a> .","more rapid progress","progress","dobj -> make"
"2512","0/1","Prime Minister Manmohan Singh said Monday that India must reach 10 percent annual economic growth and improve relations with Pakistan if <a>XXXX</a> wants to reduce poverty and make more rapid progress .","it","it","nsubj -> wants"
