"Sent Index","Mention Index/Total","Sentence","Mention","Mention Head","Label->Gov"
"1506","0/1","It may be a buyer 's market , but that 's no reason for Riviera Beach , Fla. , to give away <a>XXXX</a> .","its waterfront","waterfront","dobj -> give"
"1507","0/1","The Hawks decided not to offer coach Mike Woodson <a>XXXX</a> , the team announced Friday .","a new contract","contract","dobj -> offer"
"1508","0/1","She stared blankly into the far distance and moved in a robotic , shuffling gait as <a>XXXX</a> was led by a neighbor into a free health clinic run by Dr. Bob Paeglow .","she","she","nsubjpass -> led"
"1509","0/1","`` It 's alarming , <a>XXXX</a> , '' muses one of the many ghosts that haunt a ravaged city in Rajiv Joseph 's play `` Bengal Tiger at the Baghdad Zoo . ''","this life after death","life","nsubj -> muses"
"1510","0/1","Of course , <a>XXXX</a> was no ticker tape parade for Joseph 's cast of characters , either .","life before death","life","nsubj -> parade"
"1512","0/1","Camping in the rainforest got <a>XXXX</a> at Carnegie Hall .","a new meaning on Thursday night","meaning","dobj -> got"
"1513","0/1","<a>XXXX</a> was the annual benefit for the Rainforest Foundation that features Sting and is produced by his wife , Trudie Styler .","It","It","nsubjpass -> produced"
"1514","0/1","<a>XXXX</a> supports the preservation of rainforests worldwide and the human rights of their indigenous peoples .","The foundation","foundation","nsubj -> supports"
"1515","0/1","<a>XXXX</a> was in this year 's lineup -- including Elton John , Lady Gaga and the diva of James Bond movie scores , Dame Shirley Bassey -- and some wry production numbers .","The camp","camp","nsubj -> lineup"
"1516","0/1","There was a time , not so long ago , when if <a>XXXX</a> -- say , Carol Channing or Patti LuPone -- wanted to watch somebody else singing her signature songs in her signature style , she had to leave her dressing room and find a drag show .","a Broadway diva","diva","nsubj -> wanted"
"1517","0/1","It 's a soggy Saturday morning , but <a>XXXX</a> gather anyway , in baseball caps and fleeces , ready for their final big group training run .","the moms","moms","nsubj -> gather"
"1518","0/1","Prosecutors on Friday withdrew their intent to seek <a>XXXX</a> against two of three men accused in the slaying of former pro boxing champion Vernon Forrest .","the death penalty","penalty","dobj -> seek"
"1519","0/1","A chaotic day of deadly street violence in southern Kyrgyzstan on Friday ended with the interim government retaking <a>XXXX</a> in two southern cities .","control of administration buildings","control","dobj -> retaking"
"1520","0/1","A chaotic day of deadly street violence in southern Kyrgyzstan on Friday ended with the interim government retaking <a>XXXX</a> in two southern cities .","control of administration buildings","control","dobj -> retaking"
"1521","0/1","Sarah Palin predicted Friday that <a>XXXX</a> will win Senate seats in the November elections .","a new wave of anti-abortion feminists","wave","nsubj -> win"
"1522","0/1","<a>XXXX</a> are being deployed at Houston 's William P. Hobby Airport and six other Texas airports this summer , Homeland Security Secretary Janet Napolitano announced Friday .","Controversial full-body scanning devices for airline passengers","devices","nsubjpass -> deployed"
"1523","0/1","President Barack Obama sharply scolded corporate executives for `` finger-pointing '' over the Deepwater Horizon oil spill disaster on Friday and promised to end the `` cozy relationship '' between oil companies and the federal regulators that are supposed to police <a>XXXX</a> .","them","them","dobj -> police"
"1524","0/1","<a>XXXX</a> is used for one week out of the year .","The Stakes Barn at Pimlico Race Course","Barn","nsubjpass -> used"
"1525","0/1","Hadi al-Mahdi , a man <a>XXXX</a> might call the Rush Limbaugh of Iraq , bounded up the stairs to a radio studio in a converted villa beside the Tigris River .","you","you","nsubj -> call"
"1526","0/1","`` Today , '' he said , with impish determination , `` we are going to defend <a>XXXX</a> . ''","the Sunnis","Sunnis","dobj -> defend"
"1527","0/1","Hadi al-Mahdi , a man you might call <a>XXXX</a> , bounded up the stairs to a radio studio in a converted villa beside the Tigris River .","the Rush Limbaugh of Iraq","Rush","dobj -> call"
"1528","0/1","`` Today , '' he said , with impish determination , `` <a>XXXX</a> are going to defend the Sunnis . ''","we","we","nsubj -> going"
"1529","0/1","At almost 300 years old , somewhat moldy from the remnants of Hurricane Katrina and surrounded by muddy water and swamps , <a>XXXX</a> is not exactly known for being lemony fresh .","this city","city","nsubjpass -> known"
"1530","0/1","At almost 300 years old , somewhat moldy from the remnants of Hurricane Katrina and surrounded by muddy water and swamps , <a>XXXX</a> is not exactly known for being lemony fresh .","this city","city","nsubjpass -> known"
"1531","0/1","This is a town that prides itself on being among the most diverse and tolerant cities in the country , but two recent cases of alleged police brutality against young black men have stirred anger among civil rights leaders and left some residents wondering <a>XXXX</a> have come .","just how far race relations in their city","relations","nsubj -> come"
"1532","0/1","This is a town that prides itself on being among the most diverse and tolerant cities in the country , but two recent cases of alleged police brutality against young black men have stirred <a>XXXX</a> and left some residents wondering just how far race relations in their city have come .","anger among civil rights leaders","anger","dobj -> stirred"
"1533","0/1","Google said Friday that for more than three years <a>XXXX</a> has inadvertently collected snippets of private information that people send over unencrypted wireless networks .","it","it","nsubj -> collected"
"1534","0/1","At age 36 , <a>XXXX</a> may be running out of product lives .","Hello Kitty","Kitty","nsubj -> running"
"1535","0/1","The space shuttle Atlantis , carrying <a>XXXX</a> , a Russian docking module and critical spare parts , vaulted into orbit Friday on a 12-day space station assembly mission , its 32nd and final planned flight after a quarter-century of service .","a crew of six","crew","dobj -> carrying"
"1536","0/1","The space shuttle Atlantis , carrying <a>XXXX</a> , a Russian docking module and critical spare parts , vaulted into orbit Friday on a 12-day space station assembly mission , its 32nd and final planned flight after a quarter-century of service .","a crew of six","crew","dobj -> carrying"
"1538","0/1","Protesters blocked railroad tracks at the site of a western Siberian mine disaster on Friday night , demanding to meet with the management of the Raspadskaya Coal Co. and complaining that low salaries and financial incentives were pressuring <a>XXXX</a> to cut corners on safety .","miners","miners","nsubj -> cut"
"1539","0/1","Protesters blocked railroad tracks at the site of a western Siberian mine disaster on Friday night , demanding to meet with the management of the Raspadskaya Coal Co. and complaining that low salaries and financial incentives were pressuring miners to cut <a>XXXX</a> on safety .","corners","corners","dobj -> cut"
"1540","0/1","<a>XXXX</a> announced Friday that it had completed a partial recount of ballots from the country 's election two months ago and found no widespread fraud or irregularities .","Iraq 's election commission","commission","nsubj -> announced"
"1541","0/1","<a>XXXX</a> was restored to the vast western Chinese region of Xinjiang on Friday , 10 months after it was blocked following deadly ethnic rioting that convulsed the regional capital , Urumqi .","Full Internet service","service","nsubjpass -> restored"
"1542","0/1","The blockage was the longest and most widespread in China since <a>XXXX</a> became readily available throughout the country in the mid-1990s .","the Internet","Internet","nsubj -> became"
"1543","0/1","Iraq 's election commission announced Friday that it had completed a partial recount of ballots from the country 's election two months ago and found <a>XXXX</a> .","no widespread fraud or irregularities","fraud","dobj -> found"
"1544","0/1","<a>XXXX</a> was restored to the vast western Chinese region of Xinjiang on Friday , 10 months after it was blocked following deadly ethnic rioting that convulsed the regional capital , Urumqi .","Full Internet service","service","nsubjpass -> restored"
"1545","0/1","The blockage was the longest and most widespread in China since <a>XXXX</a> became readily available throughout the country in the mid-1990s .","the Internet","Internet","nsubj -> became"
"1547","0/1","At age 36 , <a>XXXX</a> may be running out of product lives .","Hello Kitty","Kitty","nsubj -> running"
"1548","0/1","In an aggressive move to defend its `` Superman '' franchise , Warner Brothers on Friday filed a lawsuit accusing <a>XXXX</a> for the comic book hero 's co-creators of trying to seize control of nearly half of the lucrative property .","a lawyer","lawyer","dobj -> accusing"
"1549","0/1","<a>XXXX</a> said Thursday that the Chinese government would examine the deeper social problems that might have led to the recent string of deadly attacks on schoolchildren .","Prime Minister Wen Jiabao of China","Jiabao","nsubj -> said"
"1550","0/1","Thai troops on Friday fired tear gas and <a>XXXX</a> at protesters , who responded with stones , slingshots and homemade rockets , turning parts of downtown Bangkok into a battlefield as the military tried to tighten its cordon around a broad area where the protesters have camped for weeks .","bullets","bullets","dobj -> tear"
"1552","0/1","The city said some of the overcharging was so egregious that it has asked <a>XXXX</a> to investigate .","prosecutors","prosecutors","nsubj -> investigate"
"1553","0/1","Thai troops on Friday fired tear <a>XXXX</a> at protesters , who responded with stones , slingshots and homemade rockets , turning parts of downtown Bangkok into a battlefield as the military tried to tighten its cordon around a broad area where the protesters have camped for weeks .","gas and bullets","gas","dobj -> tear"
"1554","0/1","New York City moved Friday to revoke the cab licenses of 633 taxi drivers who it said routinely charged <a>XXXX</a> .","customers higher out-of-town rates for trips within the five boroughs","rates","dobj -> charged"
"1555","0/1","The city said some of the overcharging was so egregious that it has asked <a>XXXX</a> to investigate .","prosecutors","prosecutors","nsubj -> investigate"
"1556","0/1","Technically , <a>XXXX</a> have stopped fighting in Iraq .","American soldiers","soldiers","nsubj -> stopped"
"1557","0/1","But <a>XXXX</a> can fire back when attacked , which happens frequently in this village of wheat and barley farmers , as well as an uncomfortable number of Baathist insurgents .","they","they","nsubj -> fire"
"1558","0/1","Technically , <a>XXXX</a> have stopped fighting in Iraq .","American soldiers","soldiers","nsubj -> stopped"
"1559","0/1","But <a>XXXX</a> can fire back when attacked , which happens frequently in this village of wheat and barley farmers , as well as an uncomfortable number of Baathist insurgents .","they","they","nsubj -> fire"
"1560","0/1","The U.S. District Court here hired <a>XXXX</a> on an on-call basis in February .","a Creole translator","translator","dobj -> hired"
"1561","0/1","Four months later <a>XXXX</a> is putting in 10-hour days , working so much that she does not have the time to search for a full-time job .","she","she","nsubj -> putting"
"1562","0/1","<a>XXXX</a> here hired a Creole translator on an on-call basis in February .","The U.S. District Court","Court","nsubj -> hired"
"1563","0/1","Four months later <a>XXXX</a> is putting in 10-hour days , working so much that she does not have the time to search for a full-time job .","she","she","nsubj -> putting"
"1564","0/1","<a>XXXX</a> angrily assailed the finger-pointing among the three companies involved in the oil spill in the Gulf of Mexico as a `` ridiculous spectacle , '' even as his own administration came under criticism for failing to do enough to prevent an environmental calamity .","President Barack Obama on Friday","Obama","nsubj -> assailed"
"1569","0/1","<a>XXXX</a> did not even grant the courtesy of a committee hearing .","The Senate","Senate","nsubj -> grant"
"1570","0/1","In a nation ravaged by AIDS , a disease still hidden in shadows of stigma and shame , President Jacob Zuma of South Africa has begun to engage in an extraordinarily open conversation about sex , AIDS and HIV prevention , one ignited in part by his own recent admission that <a>XXXX</a> had unprotected sex during an extramarital affair .","he","he","nsubj -> had"
"1571","0/1","In a nation ravaged by AIDS , <a>XXXX</a> , President Jacob Zuma of South Africa has begun to engage in an extraordinarily open conversation about sex , AIDS and HIV prevention , one ignited in part by his own recent admission that he had unprotected sex during an extramarital affair .","a disease still hidden in shadows of stigma and shame","disease","appos -> AIDS"
"1573","0/1","In galvanizing moments , <a>XXXX</a> can be heard blocks away .","the roar of their simultaneous cheers","roar","nsubjpass -> heard"
"1574","0/1","At 12:10 a.m. Friday , LeBron James answered one final question from the news media horde , stood up , slung <a>XXXX</a> over his shoulder and left the room .","his knapsack","knapsack","dobj -> slung"
"1575","0/1","President Barack Obama on Friday angrily assailed the finger-pointing among the three companies involved in the oil spill in the Gulf of Mexico as a `` ridiculous spectacle , '' even as <a>XXXX</a> came under criticism for failing to do enough to prevent an environmental calamity .","his own administration","administration","nsubj -> came"
"1577","0/1","<a>XXXX</a> can not help looking past the Preakness Stakes .","Todd Pletcher","Pletcher","nsubj -> help"
"1578","0/1","He likes Super Saver 's chances in the second leg of the Triple Crown , and <a>XXXX</a> say he should .","the odds and recent history","odds","nsubj -> say"
"1579","0/1","<a>XXXX</a> have won here in the 134-year history of the Preakness , including the past two years , when Rachel Alexandra -LRB- 9-5 -RRB- and Big Brown -LRB- 1-5 -RRB- romped .","Seventy favorites","favorites","nsubj -> won"
"1583","0/1","As President Luiz Inacio Lula da Silva heads to Tehran this weekend to make what <a>XXXX</a> consider a last-ditch attempt at persuading Iran to temper its nuclear ambitions , officials in Washington have expressed concern that the effort could backfire , helping the Islamic republic to block -- or at least delay -- the United States and its allies from imposing sanctions .","many Western diplomats","diplomats","nsubj -> consider"
"1584","0/1","A 16-year-old Palestinian boy who had been throwing stones at Israeli cars passing his West Bank village near the city of Ramallah was shot dead on Thursday after an Israeli settler whose car was hit opened <a>XXXX</a> .","fire","fire","dobj -> opened"
"1586","0/1","President Barack Obama 's legal advisers are considering asking Congress to allow <a>XXXX</a> to detain terrorism suspects longer after their arrests before presenting them to a judge for an initial hearing , according to officials familiar with the discussions .","the government","government","nsubj -> detain"
"1587","0/1","President Barack Obama 's legal advisers are considering asking <a>XXXX</a> to allow the government to detain terrorism suspects longer after their arrests before presenting them to a judge for an initial hearing , according to officials familiar with the discussions .","Congress","Congress","dobj -> asking"
"1589","0/1","All through the previous months , plying the country with two semi-trailers and a dozen musicians and crew members , playing hits like `` Thank You '' and `` The Anchor Holds , '' <a>XXXX</a> had felt something unbearable , something paralyzing .","Boltz","Boltz","nsubj -> felt"
"1590","0/1","Iraq 's election commission announced Friday that it had completed a partial recount of ballots from the country 's election two months ago and found no widespread fraud or <a>XXXX</a> .","irregularities","irregularities","dobj -> found"
"1592","0/1","<a>XXXX</a> said Thursday that the Chinese government would examine the deeper social problems that might have led to the recent string of deadly attacks on schoolchildren .","Prime Minister Wen Jiabao of China","Jiabao","nsubj -> said"
"1594","0/1","Technically , <a>XXXX</a> have stopped fighting in Iraq .","American soldiers","soldiers","nsubj -> stopped"
"1595","0/1","But <a>XXXX</a> can fire back when attacked , which happens frequently in this village of wheat and barley farmers , as well as an uncomfortable number of Baathist insurgents .","they","they","nsubj -> fire"
"1596","0/1","Technically , <a>XXXX</a> have stopped fighting in Iraq .","American soldiers","soldiers","nsubj -> stopped"
"1597","0/1","But <a>XXXX</a> can fire back when attacked , which happens frequently in this village of wheat and barley farmers , as well as an uncomfortable number of Baathist insurgents .","they","they","nsubj -> fire"
"1598","0/1","<a>XXXX</a> was restored to the vast western Chinese region of Xinjiang on Friday , 10 months after it was blocked following deadly ethnic rioting that convulsed the regional capital , Urumqi .","Full Internet service","service","nsubjpass -> restored"
"1599","0/1","The blockage was the longest and most widespread in China since <a>XXXX</a> became readily available throughout the country a decade ago .","the Internet","Internet","nsubj -> became"
"1601","0/1","The blockage was the longest and most widespread in China since <a>XXXX</a> became readily available throughout the country a decade ago .","the Internet","Internet","nsubj -> became"
"1602","0/1","For centuries , girls throughout the English-speaking world have fantasized that <a>XXXX</a> were Maid Marian getting rescued from damsel-in-distresshood by that dashing hero Robin Hood .","they","they","nsubj -> Maid"
"1603","0/1","The high-tech mirrors designed for the next space-based telescope are almost as complicated as the five-year , cross-country route they will take <a>XXXX</a> .","before launch in 2014","launch","dobj -> take"
"1605","0/1","President Barack Obama on Friday angrily assailed the finger-pointing among the three companies involved in the oil spill in the Gulf of Mexico as a `` ridiculous spectacle , '' even as <a>XXXX</a> came under criticism for failing to do enough to prevent an environmental calamity .","his own administration","administration","nsubj -> came"
"1607","0/1","A decade after it was introduced , nearly 5,000 girls play statewide -- a welcome development in a state that , like others , has struggled to close <a>XXXX</a> in high school athletics .","the gender gap","gap","dobj -> close"
"1608","0/1","This small harbor on Japan 's northern coast , where whaling boats sit docked with harpoon guns proudly displayed , and shops sell <a>XXXX</a> , might seem to be an unlikely place to find opponents of the nation 's contested Antarctic whaling .","carvings made from the ivorylike teeth of sperm whales","carvings","dobj -> sell"
"1609","0/1","From drug addicts in the 1970s ripping copper plumbing from walls to scrap-yard regulars of more recent years who proffer whatever fell off a truck , stealing hunks of coil or reinforcing bar has mostly been about having a strong back and <a>XXXX</a> to get dirty , law enforcement experts say .","a willingness","willingness","nsubj -> say"
"1610","0/1","This small harbor on Japan 's northern coast , where whaling boats sit docked with harpoon guns proudly displayed , and shops sell <a>XXXX</a> , might seem to be an unlikely place to find opponents of the nation 's contested Antarctic whaling .","carvings made from the ivorylike teeth of sperm whales","carvings","dobj -> sell"
"1611","0/1","From drug addicts in the 1970s ripping <a>XXXX</a> from walls to scrap-yard regulars of more recent years who proffer whatever fell off a truck , stealing hunks of coil or reinforcing bar has mostly been about having a strong back and a willingness to get dirty , law enforcement experts say .","copper plumbing","plumbing","dobj -> ripping"
"1612","0/1","When <a>XXXX</a> gathered in a secure room in the Pentagon on a recent Friday to get a video briefing from the Afghan battlefield , they were startled to see a youthful British diplomat in an open-neck shirt , rather than the familiar face and camouflage fatigues of Gen. Stanley McChrystal , the American commander .","military officers and diplomats","officers","nsubj -> gathered"
"1613","0/1","When military officers and <a>XXXX</a> gathered in a secure room in the Pentagon on a recent Friday to get a video briefing from the Afghan battlefield , they were startled to see a youthful British diplomat in an open-neck shirt , rather than the familiar face and camouflage fatigues of Gen. Stanley McChrystal , the American commander .","diplomats","diplomats","nsubj -> get"
"1614","0/1","A Taliban spokesman boasted on Saturday that the group had kidnapped and killed <a>XXXX</a> , one on his wedding day , apparently because they worked for the U.S. military and a Western contractor .","four Afghan interpreters","interpreters","dobj -> kidnapped"
"1615","0/1","A Taliban spokesman boasted on Saturday that <a>XXXX</a> had kidnapped and killed four Afghan interpreters , one on his wedding day , apparently because they worked for the U.S. military and a Western contractor .","the group","group","nsubj -> kidnapped"
"1616","0/1","A young French teacher arrested on spying charges last July for photographing demonstrations in Iran will be allowed to leave <a>XXXX</a> after paying a fine of about $ 300,000 , her lawyer said in Tehran on Saturday .","the country","country","dobj -> leave"
"1617","0/1","A battle over Thailand 's future is raging , but <a>XXXX</a> has been able to resolve such intractable conflicts in the past has been notably silent : King Bhumibol Adulyadej , long a unifying father figure for his nation .","the one man who","man","nsubj -> able"
"1618","0/1","<a>XXXX</a> has been a Democrat his entire adult life , just like many here in this mostly rural , economically impoverished southwestern corner of the state , where the party 's roots run as deep as the coal underfoot .","Sam Boyd","Boyd","nsubj -> Democrat"
"1619","0/1","<a>XXXX</a> has been a Democrat his entire adult life , just like many here in this mostly rural , economically impoverished southwestern corner of the state , where the party 's roots run as deep as the coal underfoot .","Sam Boyd","Boyd","nsubj -> Democrat"
"1620","0/1","In a plastic tent under a glorious desert sky , <a>XXXX</a> preached the gospel of the second chance .","Richard Lee","Lee","nsubj -> preached"
"1621","0/1","In a plastic tent under a glorious desert sky , <a>XXXX</a> preached the gospel of the second chance .","Richard Lee","Lee","nsubj -> preached"
"1622","0/1","In her early years as a law professor , <a>XXXX</a> wrote almost exclusively on the First Amendment .","Elena Kagan","Kagan","nsubj -> wrote"
"1624","0/1","The Thai government struck an aggressive tone on Saturday , saying it would continue its efforts to cut antigovernment protesters off from the rest of the city despite a rising death toll and determined <a>XXXX</a> .","resistance from the demonstrators","resistance","dobj -> determined"
"1625","0/1","During Spain 's construction boom , <a>XXXX</a> happily traded long hours and backbreaking labor in the fields for the better-regulated building trades , earning four times as much as a bricklayer .","Antonio Rivera Romero","Romero","nsubj -> traded"
"1626","0/1","<a>XXXX</a> took out a mortgage and enlarged his house on a quiet side street in this small city in southern Spain .","He","He","nsubj -> took"
"1627","0/1","During Spain 's construction boom , Antonio Rivera Romero happily traded long hours and backbreaking labor in the fields for the better-regulated building trades , earning <a>XXXX</a> as much as a bricklayer .","four times","times","dobj -> earning"
"1628","0/1","He took out a mortgage and <a>XXXX</a> on a quiet side street in this small city in southern Spain .","enlarged his house","house","dobj -> took"
"1629","0/1","<a>XXXX</a> are lobbying federal and state officials in an effort to ward off strict regulation of premiums and profits under the new health care law .","Health insurance companies","companies","nsubj -> lobbying"
"1630","0/1","Health insurance companies are lobbying federal and state officials in an effort to ward off <a>XXXX</a> under the new health care law .","strict regulation of premiums and profits","regulation","dobj -> ward"
"1631","0/1","<a>XXXX</a> ping-ponged in Jameer Nelson 's mind nearly a year ago .","The conflicting thoughts","thoughts","nsubj -> ping-ponged"
"1632","0/1","If he returned to the NBA finals after a separated shoulder that was supposed to end his season , <a>XXXX</a> might as well apologize to every Orlando Magic fan should the Magic fall short against the Los Angeles Lakers .","he","he","nsubj -> apologize"
"1633","0/1","<a>XXXX</a> have continued to rely on a secret network of private spies who have produced hundreds of reports from deep inside Afghanistan and Pakistan , according to American officials and businessmen , despite concerns among some in the military about the legality of the operation .","Top military officials","officials","nsubj -> continued"
